user_input,retrieved_contexts,response,reference,context_recall,faithfulness,factual_correctness(mode=f1)
Why the kingdom in the story have so much trouble with the golden apples and what happen to it after all the adventures?,"['THE WHITE SNAKE\n\nA long time ago there lived a king who was famed for his wisdom through\n all the land. Nothing was hidden from him, and it seemed as if news of the\n most secret things was brought to him through the air. But he had a\n strange custom; every day after dinner, when the table was cleared, and no\n one else was present, a trusty servant had to bring him one more dish. It\n was covered, however, and even the servant did not know what was in it,\n neither did anyone know, for the king never took off the cover to eat of\n it until he was quite alone.\nThis had gone on for a long time, when one day the servant, who took away\n the dish, was overcome with such curiosity that he could not help carrying\n the dish into his room. When he had carefully locked the door, he lifted\n up the cover, and saw a white snake lying on the dish. But when he saw it\n he could not deny himself the pleasure of tasting it, so he cut of a\n little bit and put it into his mouth. No sooner had it touched his tongue\n than he heard a strange whispering of little voices outside his window. He\n went and listened, and then noticed that it was the sparrows who were\n chattering together, and telling one another of all kinds of things which\n they had seen in the fields and woods. Eating the snake had given him\n power of understanding the language of animals.\nNow it so happened that on this very day the queen lost her most beautiful\n ring, and suspicion of having stolen it fell upon this trusty servant, who\n was allowed to go everywhere. The king ordered the man to be brought\n before him, and threatened with angry words that unless he could before\n the morrow point out the thief, he himself should be looked upon as guilty\n and executed. In vain he declared his innocence; he was dismissed with no\n better answer.\nIn his trouble and fear he went down into the courtyard and took thought\n how to help himself out of his trouble. Now some ducks were sitting\n together quietly by a brook and taking their rest; and, whilst they were\n making their feathers smooth with their bills, they were having a\n confidential conversation together. The servant stood by and listened.\n They were telling one another of all the places where they had been\n waddling about all the morning, and what good food they had found; and one\n said in a pitiful tone: ‘Something lies heavy on my stomach; as I was\n eating in haste I swallowed a ring which lay under the queen’s window.’\n The servant at once seized her by the neck, carried her to the kitchen,\n and said to the cook: ‘Here is a fine duck; pray, kill her.’ ‘Yes,’ said\n the cook, and weighed her in his hand; ‘she has spared no trouble to\n fatten herself, and has been waiting to be roasted long enough.’ So he cut\n off her head, and as she was being dressed for the spit, the queen’s ring\n was found inside her.\nThe servant could now easily prove his innocence; and the king, to make\n amends for the wrong, allowed him to ask a favour, and promised him the\n best place in the court that he could wish for. The servant refused\n everything, and only asked for a horse and some money for travelling, as\n he had a mind to see the world and go about a little. When his request was\n granted he set out on his way, and one day came to a pond, where he saw\n three fishes caught in the reeds and gasping for water. Now, though it is\n said that fishes are dumb, he heard them lamenting that they must perish\n so miserably, and, as he had a kind heart, he got off his horse and put\n the three prisoners back into the water. They leapt with delight, put out\n their heads, and cried to him: ‘We will remember you and repay you for\n saving us!’\nHe rode on, and after a while it seemed to him that he heard a voice in\n the sand at his feet. He listened, and heard an ant-king complain: ‘Why\n cannot folks, with their clumsy beasts, keep off our bodies? That stupid\n horse, with his heavy hoofs, has been treading down my people without\n mercy!’ So he turned on to a side path and the ant-king cried out to him:\n ‘We will remember you—one good turn deserves another!’\nThe path led him into a wood, and there he saw two old ravens standing by\n their nest, and throwing out their young ones. ‘Out with you, you idle,\n good-for-nothing creatures!’ cried they; ‘we cannot find food for you any\n longer; you are big enough, and can provide for yourselves.’ But the poor\n young ravens lay upon the ground, flapping their wings, and crying: ‘Oh,\n what helpless chicks we are! We must shift for ourselves, and yet we\n cannot fly! What can we do, but lie here and starve?’ So the good young\n fellow alighted and killed his horse with his sword, and gave it to them\n for food. Then they came hopping up to it, satisfied their hunger, and\n cried: ‘We will remember you—one good turn deserves another!’\nAnd now he had to use his own legs, and when he had walked a long way, he\n came to a large city. There was a great noise and crowd in the streets,\n and a man rode up on horseback, crying aloud: ‘The king’s daughter wants a\n husband; but whoever seeks her hand must perform a hard task, and if he\n does not succeed he will forfeit his life.’ Many had already made the\n attempt, but in vain; nevertheless when the youth saw the king’s daughter\n he was so overcome by her great beauty that he forgot all danger, went\n before the king, and declared himself a suitor.\nSo he was led out to the sea, and a gold ring was thrown into it, before\n his eyes; then the king ordered him to fetch this ring up from the bottom\n of the sea, and added: ‘If you come up again without it you will be thrown\n in again and again until you perish amid the waves.’ All the people\n grieved for the handsome youth; then they went away, leaving him alone by\n the sea.\nHe stood on the shore and considered what he should do, when suddenly he\n saw three fishes come swimming towards him, and they were the very fishes\n whose lives he had saved. The one in the middle held a mussel in its\n mouth, which it laid on the shore at the youth’s feet, and when he had\n taken it up and opened it, there lay the gold ring in the shell. Full of\n joy he took it to the king and expected that he would grant him the\n promised reward.\nBut when the proud princess perceived that he was not her equal in birth,\n she scorned him, and required him first to perform another task. She went\n down into the garden and strewed with her own hands ten sacksful of\n millet-seed on the grass; then she said: ‘Tomorrow morning before sunrise\n these must be picked up, and not a single grain be wanting.’\nThe youth sat down in the garden and considered how it might be possible\n to perform this task, but he could think of nothing, and there he sat\n sorrowfully awaiting the break of day, when he should be led to death. But\n as soon as the first rays of the sun shone into the garden he saw all the\n ten sacks standing side by side, quite full, and not a single grain was\n missing. The ant-king had come in the night with thousands and thousands\n of ants, and the grateful creatures had by great industry picked up all\n the millet-seed and gathered them into the sacks.\nPresently the king’s daughter herself came down into the garden, and was\n amazed to see that the young man had done the task she had given him. But\n she could not yet conquer her proud heart, and said: ‘Although he has\n performed both the tasks, he shall not be my husband until he had brought\n me an apple from the Tree of Life.’ The youth did not know where the Tree\n of Life stood, but he set out, and would have gone on for ever, as long as\n his legs would carry him, though he had no hope of finding it. After he\n had wandered through three kingdoms, he came one evening to a wood, and\n lay down under a tree to sleep. But he heard a rustling in the branches,\n and a golden apple fell into his hand. At the same time three ravens flew\n down to him, perched themselves upon his knee, and said: ‘We are the three\n young ravens whom you saved from starving; when we had grown big, and\n heard that you were seeking the Golden Apple, we flew over the sea to the\n end of the world, where the Tree of Life stands, and have brought you the\n apple.’ The youth, full of joy, set out homewards, and took the Golden\n Apple to the king’s beautiful daughter, who had now no more excuses left\n to make. They cut the Apple of Life in two and ate it together; and then\n her heart became full of love for him, and they lived in undisturbed\n happiness to a great age.', 'IRON HANS\n\nThere was once upon a time a king who had a great forest near his palace,\n full of all kinds of wild animals. One day he sent out a huntsman to shoot\n him a roe, but he did not come back. ‘Perhaps some accident has befallen\n him,’ said the king, and the next day he sent out two more huntsmen who\n were to search for him, but they too stayed away. Then on the third day,\n he sent for all his huntsmen, and said: ‘Scour the whole forest through,\n and do not give up until you have found all three.’ But of these also,\n none came home again, none were seen again. From that time forth, no one\n would any longer venture into the forest, and it lay there in deep\n stillness and solitude, and nothing was seen of it, but sometimes an eagle\n or a hawk flying over it. This lasted for many years, when an unknown\n huntsman announced himself to the king as seeking a situation, and offered\n to go into the dangerous forest. The king, however, would not give his\n consent, and said: ‘It is not safe in there; I fear it would fare with you\n no better than with the others, and you would never come out again.’ The\n huntsman replied: ‘Lord, I will venture it at my own risk, of fear I know\n nothing.’\nThe huntsman therefore betook himself with his dog to the forest. It was\n not long before the dog fell in with some game on the way, and wanted to\n pursue it; but hardly had the dog run two steps when it stood before a\n deep pool, could go no farther, and a naked arm stretched itself out of\n the water, seized it, and drew it under. When the huntsman saw that, he\n went back and fetched three men to come with buckets and bale out the\n water. When they could see to the bottom there lay a wild man whose body\n was brown like rusty iron, and whose hair hung over his face down to his\n knees. They bound him with cords, and led him away to the castle. There\n was great astonishment over the wild man; the king, however, had him put\n in an iron cage in his courtyard, and forbade the door to be opened on\n pain of death, and the queen herself was to take the key into her keeping.\n And from this time forth everyone could again go into the forest with\n safety.\nThe king had a son of eight years, who was once playing in the courtyard,\n and while he was playing, his golden ball fell into the cage. The boy ran\n thither and said: ‘Give me my ball out.’ ‘Not till you have opened the\n door for me,’ answered the man. ‘No,’ said the boy, ‘I will not do that;\n the king has forbidden it,’ and ran away. The next day he again went and\n asked for his ball; the wild man said: ‘Open my door,’ but the boy would\n not. On the third day the king had ridden out hunting, and the boy went\n once more and said: ‘I cannot open the door even if I wished, for I have\n not the key.’ Then the wild man said: ‘It lies under your mother’s pillow,\n you can get it there.’ The boy, who wanted to have his ball back, cast all\n thought to the winds, and brought the key. The door opened with\n difficulty, and the boy pinched his fingers. When it was open the wild man\n stepped out, gave him the golden ball, and hurried away. The boy had\n become afraid; he called and cried after him: ‘Oh, wild man, do not go\n away, or I shall be beaten!’ The wild man turned back, took him up, set\n him on his shoulder, and went with hasty steps into the forest. When the\n king came home, he observed the empty cage, and asked the queen how that\n had happened. She knew nothing about it, and sought the key, but it was\n gone. She called the boy, but no one answered. The king sent out people to\n seek for him in the fields, but they did not find him. Then he could\n easily guess what had happened, and much grief reigned in the royal court.\nWhen the wild man had once more reached the dark forest, he took the boy\n down from his shoulder, and said to him: ‘You will never see your father\n and mother again, but I will keep you with me, for you have set me free,\n and I have compassion on you. If you do all I bid you, you shall fare\n well. Of treasure and gold have I enough, and more than anyone in the\n world.’ He made a bed of moss for the boy on which he slept, and the next\n morning the man took him to a well, and said: ‘Behold, the gold well is as\n bright and clear as crystal, you shall sit beside it, and take care that\n nothing falls into it, or it will be polluted. I will come every evening\n to see if you have obeyed my order.’ The boy placed himself by the brink\n of the well, and often saw a golden fish or a golden snake show itself\n therein, and took care that nothing fell in. As he was thus sitting, his\n finger hurt him so violently that he involuntarily put it in the water. He\n drew it quickly out again, but saw that it was quite gilded, and\n whatsoever pains he took to wash the gold off again, all was to no\n purpose. In the evening Iron Hans came back, looked at the boy, and said:\n ‘What has happened to the well?’ ‘Nothing nothing,’ he answered, and held\n his finger behind his back, that the man might not see it. But he said:\n ‘You have dipped your finger into the water, this time it may pass, but\n take care you do not again let anything go in.’ By daybreak the boy was\n already sitting by the well and watching it. His finger hurt him again and\n he passed it over his head, and then unhappily a hair fell down into the\n well. He took it quickly out, but it was already quite gilded. Iron Hans\n came, and already knew what had happened. ‘You have let a hair fall into\n the well,’ said he. ‘I will allow you to watch by it once more, but if\n this happens for the third time then the well is polluted and you can no\n longer remain with me.’\nOn the third day, the boy sat by the well, and did not stir his finger,\n however much it hurt him. But the time was long to him, and he looked at\n the reflection of his face on the surface of the water. And as he still\n bent down more and more while he was doing so, and trying to look straight\n into the eyes, his long hair fell down from his shoulders into the water.\n He raised himself up quickly, but the whole of the hair of his head was\n already golden and shone like the sun. You can imagine how terrified the\n poor boy was! He took his pocket-handkerchief and tied it round his head,\n in order that the man might not see it. When he came he already knew\n everything, and said: ‘Take the handkerchief off.’ Then the golden hair\n streamed forth, and let the boy excuse himself as he might, it was of no\n use. ‘You have not stood the trial and can stay here no longer. Go forth\n into the world, there you will learn what poverty is. But as you have not\n a bad heart, and as I mean well by you, there is one thing I will grant\n you; if you fall into any difficulty, come to the forest and cry: “Iron\n Hans,” and then I will come and help you. My power is great, greater than\n you think, and I have gold and silver in abundance.’\nThen the king’s son left the forest, and walked by beaten and unbeaten\n paths ever onwards until at length he reached a great city. There he\n looked for work, but could find none, and he learnt nothing by which he\n could help himself. At length he went to the palace, and asked if they\n would take him in. The people about court did not at all know what use\n they could make of him, but they liked him, and told him to stay. At\n length the cook took him into his service, and said he might carry wood\n and water, and rake the cinders together. Once when it so happened that no\n one else was at hand, the cook ordered him to carry the food to the royal\n table, but as he did not like to let his golden hair be seen, he kept his\n little cap on. Such a thing as that had never yet come under the king’s\n notice, and he said: ‘When you come to the royal table you must take your\n hat off.’ He answered: ‘Ah, Lord, I cannot; I have a bad sore place on my\n head.’ Then the king had the cook called before him and scolded him, and\n asked how he could take such a boy as that into his service; and that he\n was to send him away at once. The cook, however, had pity on him, and\n exchanged him for the gardener’s boy.\nAnd now the boy had to plant and water the garden, hoe and dig, and bear\n the wind and bad weather. Once in summer when he was working alone in the\n garden, the day was so warm he took his little cap off that the air might\n cool him. As the sun shone on his hair it glittered and flashed so that\n the rays fell into the bedroom of the king’s daughter, and up she sprang\n to see what that could be. Then she saw the boy, and cried to him: ‘Boy,\n bring me a wreath of flowers.’ He put his cap on with all haste, and\n gathered wild field-flowers and bound them together. When he was ascending\n the stairs with them, the gardener met him, and said: ‘How can you take\n the king’s daughter a garland of such common flowers? Go quickly, and get\n another, and seek out the prettiest and rarest.’ ‘Oh, no,’ replied the\n boy, ‘the wild ones have more scent, and will please her better.’ When he\n got into the room, the king’s daughter said: ‘Take your cap off, it is not\n seemly to keep it on in my presence.’ He again said: ‘I may not, I have a\n sore head.’ She, however, caught at his cap and pulled it off, and then\n his golden hair rolled down on his shoulders, and it was splendid to\n behold. He wanted to run out, but she held him by the arm, and gave him a\n handful of ducats. With these he departed, but he cared nothing for the\n gold pieces. He took them to the gardener, and said: ‘I present them to\n your children, they can play with them.’ The following day the king’s\n daughter again called to him that he was to bring her a wreath of\n field-flowers, and then he went in with it, she instantly snatched at his\n cap, and wanted to take it away from him, but he held it fast with both\n hands. She again gave him a handful of ducats, but he would not keep them,\n and gave them to the gardener for playthings for his children. On the\n third day things went just the same; she could not get his cap away from\n him, and he would not have her money.\nNot long afterwards, the country was overrun by war. The king gathered\n together his people, and did not know whether or not he could offer any\n opposition to the enemy, who was superior in strength and had a mighty\n army. Then said the gardener’s boy: ‘I am grown up, and will go to the\n wars also, only give me a horse.’ The others laughed, and said: ‘Seek one\n for yourself when we are gone, we will leave one behind us in the stable\n for you.’ When they had gone forth, he went into the stable, and led the\n horse out; it was lame of one foot, and limped hobblety jib, hobblety jib;\n nevertheless he mounted it, and rode away to the dark forest. When he came\n to the outskirts, he called ‘Iron Hans’ three times so loudly that it\n echoed through the trees. Thereupon the wild man appeared immediately, and\n said: ‘What do you desire?’ ‘I want a strong steed, for I am going to the\n wars.’ ‘That you shall have, and still more than you ask for.’ Then the\n wild man went back into the forest, and it was not long before a\n stable-boy came out of it, who led a horse that snorted with its nostrils,\n and could hardly be restrained, and behind them followed a great troop of\n warriors entirely equipped in iron, and their swords flashed in the sun.\n The youth made over his three-legged horse to the stable-boy, mounted the\n other, and rode at the head of the soldiers. When he got near the\n battlefield a great part of the king’s men had already fallen, and little\n was wanting to make the rest give way. Then the youth galloped thither\n with his iron soldiers, broke like a hurricane over the enemy, and beat\n down all who opposed him. They began to flee, but the youth pursued, and\n never stopped, until there was not a single man left. Instead of returning\n to the king, however, he conducted his troop by byways back to the forest,\n and called forth Iron Hans. ‘What do you desire?’ asked the wild man.\n ‘Take back your horse and your troops, and give me my three-legged horse\n again.’ All that he asked was done, and soon he was riding on his\n three-legged horse. When the king returned to his palace, his daughter\n went to meet him, and wished him joy of his victory. ‘I am not the one who\n carried away the victory,’ said he, ‘but a strange knight who came to my\n assistance with his soldiers.’ The daughter wanted to hear who the strange\n knight was, but the king did not know, and said: ‘He followed the enemy,\n and I did not see him again.’ She inquired of the gardener where his boy\n was, but he smiled, and said: ‘He has just come home on his three-legged\n horse, and the others have been mocking him, and crying: “Here comes our\n hobblety jib back again!” They asked, too: “Under what hedge have you been\n lying sleeping all the time?” So he said: “I did the best of all, and it\n would have gone badly without me.” And then he was still more ridiculed.’\nThe king said to his daughter: ‘I will proclaim a great feast that shall\n last for three days, and you shall throw a golden apple. Perhaps the\n unknown man will show himself.’ When the feast was announced, the youth\n went out to the forest, and called Iron Hans. ‘What do you desire?’ asked\n he. ‘That I may catch the king’s daughter’s golden apple.’ ‘It is as safe\n as if you had it already,’ said Iron Hans. ‘You shall likewise have a suit\n of red armour for the occasion, and ride on a spirited chestnut-horse.’\n When the day came, the youth galloped to the spot, took his place amongst\n the knights, and was recognized by no one. The king’s daughter came\n forward, and threw a golden apple to the knights, but none of them caught\n it but he, only as soon as he had it he galloped away.\nOn the second day Iron Hans equipped him as a white knight, and gave him a\n white horse. Again he was the only one who caught the apple, and he did\n not linger an instant, but galloped off with it. The king grew angry, and\n said: ‘That is not allowed; he must appear before me and tell his name.’\n He gave the order that if the knight who caught the apple, should go away\n again they should pursue him, and if he would not come back willingly,\n they were to cut him down and stab him.\nOn the third day, he received from Iron Hans a suit of black armour and a\n black horse, and again he caught the apple. But when he was riding off\n with it, the king’s attendants pursued him, and one of them got so near\n him that he wounded the youth’s leg with the point of his sword. The youth\n nevertheless escaped from them, but his horse leapt so violently that the\n helmet fell from the youth’s head, and they could see that he had golden\n hair. They rode back and announced this to the king.\nThe following day the king’s daughter asked the gardener about his boy.\n ‘He is at work in the garden; the queer creature has been at the festival\n too, and only came home yesterday evening; he has likewise shown my\n children three golden apples which he has won.’\nThe king had him summoned into his presence, and he came and again had his\n little cap on his head. But the king’s daughter went up to him and took it\n off, and then his golden hair fell down over his shoulders, and he was so\n handsome that all were amazed. ‘Are you the knight who came every day to\n the festival, always in different colours, and who caught the three golden\n apples?’ asked the king. ‘Yes,’ answered he, ‘and here the apples are,’\n and he took them out of his pocket, and returned them to the king. ‘If you\n desire further proof, you may see the wound which your people gave me when\n they followed me. But I am likewise the knight who helped you to your\n victory over your enemies.’ ‘If you can perform such deeds as that, you\n are no gardener’s boy; tell me, who is your father?’ ‘My father is a\n mighty king, and gold have I in plenty as great as I require.’ ‘I well\n see,’ said the king, ‘that I owe my thanks to you; can I do anything to\n please you?’ ‘Yes,’ answered he, ‘that indeed you can. Give me your\n daughter to wife.’ The maiden laughed, and said: ‘He does not stand much\n on ceremony, but I have already seen by his golden hair that he was no\n gardener’s boy,’ and then she went and kissed him. His father and mother\n came to the wedding, and were in great delight, for they had given up all\n hope of ever seeing their dear son again. And as they were sitting at the\n marriage-feast, the music suddenly stopped, the doors opened, and a\n stately king came in with a great retinue. He went up to the youth,\n embraced him and said: ‘I am Iron Hans, and was by enchantment a wild man,\n but you have set me free; all the treasures which I possess, shall be your\n property.’', 'THE GOLDEN BIRD\n\nA certain king had a beautiful garden, and in the garden stood a tree\n which bore golden apples. These apples were always counted, and about the\n time when they began to grow ripe it was found that every night one of\n them was gone. The king became very angry at this, and ordered the\n gardener to keep watch all night under the tree. The gardener set his\n eldest son to watch; but about twelve o’clock he fell asleep, and in the\n morning another of the apples was missing. Then the second son was ordered\n to watch; and at midnight he too fell asleep, and in the morning another\n apple was gone. Then the third son offered to keep watch; but the gardener\n at first would not let him, for fear some harm should come to him:\n however, at last he consented, and the young man laid himself under the\n tree to watch. As the clock struck twelve he heard a rustling noise in the\n air, and a bird came flying that was of pure gold; and as it was snapping\n at one of the apples with its beak, the gardener’s son jumped up and shot\n an arrow at it. But the arrow did the bird no harm; only it dropped a\n golden feather from its tail, and then flew away. The golden feather was\n brought to the king in the morning, and all the council was called\n together. Everyone agreed that it was worth more than all the wealth of\n the kingdom: but the king said, ‘One feather is of no use to me, I must\n have the whole bird.’\nThen the gardener’s eldest son set out and thought to find the golden bird\n very easily; and when he had gone but a little way, he came to a wood, and\n by the side of the wood he saw a fox sitting; so he took his bow and made\n ready to shoot at it. Then the fox said, ‘Do not shoot me, for I will give\n you good counsel; I know what your business is, and that you want to find\n the golden bird. You will reach a village in the evening; and when you get\n there, you will see two inns opposite to each other, one of which is very\n pleasant and beautiful to look at: go not in there, but rest for the night\n in the other, though it may appear to you to be very poor and mean.’ But\n the son thought to himself, ‘What can such a beast as this know about the\n matter?’ So he shot his arrow at the fox; but he missed it, and it set up\n its tail above its back and ran into the wood. Then he went his way, and\n in the evening came to the village where the two inns were; and in one of\n these were people singing, and dancing, and feasting; but the other looked\n very dirty, and poor. ‘I should be very silly,’ said he, ‘if I went to\n that shabby house, and left this charming place’; so he went into the\n smart house, and ate and drank at his ease, and forgot the bird, and his\n country too.\nTime passed on; and as the eldest son did not come back, and no tidings\n were heard of him, the second son set out, and the same thing happened to\n him. He met the fox, who gave him the good advice: but when he came to the\n two inns, his eldest brother was standing at the window where the\n merrymaking was, and called to him to come in; and he could not withstand\n the temptation, but went in, and forgot the golden bird and his country in\n the same manner.\nTime passed on again, and the youngest son too wished to set out into the\n wide world to seek for the golden bird; but his father would not listen to\n it for a long while, for he was very fond of his son, and was afraid that\n some ill luck might happen to him also, and prevent his coming back.\n However, at last it was agreed he should go, for he would not rest at\n home; and as he came to the wood, he met the fox, and heard the same good\n counsel. But he was thankful to the fox, and did not attempt his life as\n his brothers had done; so the fox said, ‘Sit upon my tail, and you will\n travel faster.’ So he sat down, and the fox began to run, and away they\n went over stock and stone so quick that their hair whistled in the wind.\nWhen they came to the village, the son followed the fox’s counsel, and\n without looking about him went to the shabby inn and rested there all\n night at his ease. In the morning came the fox again and met him as he was\n beginning his journey, and said, ‘Go straight forward, till you come to a\n castle, before which lie a whole troop of soldiers fast asleep and\n snoring: take no notice of them, but go into the castle and pass on and on\n till you come to a room, where the golden bird sits in a wooden cage;\n close by it stands a beautiful golden cage; but do not try to take the\n bird out of the shabby cage and put it into the handsome one, otherwise\n you will repent it.’ Then the fox stretched out his tail again, and the\n young man sat himself down, and away they went over stock and stone till\n their hair whistled in the wind.\nBefore the castle gate all was as the fox had said: so the son went in and\n found the chamber where the golden bird hung in a wooden cage, and below\n stood the golden cage, and the three golden apples that had been lost were\n lying close by it. Then thought he to himself, ‘It will be a very droll\n thing to bring away such a fine bird in this shabby cage’; so he opened\n the door and took hold of it and put it into the golden cage. But the bird\n set up such a loud scream that all the soldiers awoke, and they took him\n prisoner and carried him before the king. The next morning the court sat\n to judge him; and when all was heard, it sentenced him to die, unless he\n should bring the king the golden horse which could run as swiftly as the\n wind; and if he did this, he was to have the golden bird given him for his\n own.\nSo he set out once more on his journey, sighing, and in great despair,\n when on a sudden his friend the fox met him, and said, ‘You see now what\n has happened on account of your not listening to my counsel. I will still,\n however, tell you how to find the golden horse, if you will do as I bid\n you. You must go straight on till you come to the castle where the horse\n stands in his stall: by his side will lie the groom fast asleep and\n snoring: take away the horse quietly, but be sure to put the old leathern\n saddle upon him, and not the golden one that is close by it.’ Then the son\n sat down on the fox’s tail, and away they went over stock and stone till\n their hair whistled in the wind.\nAll went right, and the groom lay snoring with his hand upon the golden\n saddle. But when the son looked at the horse, he thought it a great pity\n to put the leathern saddle upon it. ‘I will give him the good one,’ said\n he; ‘I am sure he deserves it.’ As he took up the golden saddle the groom\n awoke and cried out so loud, that all the guards ran in and took him\n prisoner, and in the morning he was again brought before the court to be\n judged, and was sentenced to die. But it was agreed, that, if he could\n bring thither the beautiful princess, he should live, and have the bird\n and the horse given him for his own.\nThen he went his way very sorrowful; but the old fox came and said, ‘Why\n did not you listen to me? If you had, you would have carried away both the\n bird and the horse; yet will I once more give you counsel. Go straight on,\n and in the evening you will arrive at a castle. At twelve o’clock at night\n the princess goes to the bathing-house: go up to her and give her a kiss,\n and she will let you lead her away; but take care you do not suffer her to\n go and take leave of her father and mother.’ Then the fox stretched out\n his tail, and so away they went over stock and stone till their hair\n whistled again.\nAs they came to the castle, all was as the fox had said, and at twelve\n o’clock the young man met the princess going to the bath and gave her the\n kiss, and she agreed to run away with him, but begged with many tears that\n he would let her take leave of her father. At first he refused, but she\n wept still more and more, and fell at his feet, till at last he consented;\n but the moment she came to her father’s house the guards awoke and he was\n taken prisoner again.\nThen he was brought before the king, and the king said, ‘You shall never\n have my daughter unless in eight days you dig away the hill that stops the\n view from my window.’ Now this hill was so big that the whole world could\n not take it away: and when he had worked for seven days, and had done very\n little, the fox came and said. ‘Lie down and go to sleep; I will work for\n you.’ And in the morning he awoke and the hill was gone; so he went\n merrily to the king, and told him that now that it was removed he must\n give him the princess.\nThen the king was obliged to keep his word, and away went the young man\n and the princess; and the fox came and said to him, ‘We will have all\n three, the princess, the horse, and the bird.’ ‘Ah!’ said the young man,\n ‘that would be a great thing, but how can you contrive it?’\n‘If you will only listen,’ said the fox, ‘it can be done. When you come to\n the king, and he asks for the beautiful princess, you must say, “Here she\n is!” Then he will be very joyful; and you will mount the golden horse that\n they are to give you, and put out your hand to take leave of them; but\n shake hands with the princess last. Then lift her quickly on to the horse\n behind you; clap your spurs to his side, and gallop away as fast as you\n can.’\nAll went right: then the fox said, ‘When you come to the castle where the\n bird is, I will stay with the princess at the door, and you will ride in\n and speak to the king; and when he sees that it is the right horse, he\n will bring out the bird; but you must sit still, and say that you want to\n look at it, to see whether it is the true golden bird; and when you get it\n into your hand, ride away.’\nThis, too, happened as the fox said; they carried off the bird, the\n princess mounted again, and they rode on to a great wood. Then the fox\n came, and said, ‘Pray kill me, and cut off my head and my feet.’ But the\n young man refused to do it: so the fox said, ‘I will at any rate give you\n good counsel: beware of two things; ransom no one from the gallows, and\n sit down by the side of no river.’ Then away he went. ‘Well,’ thought the\n young man, ‘it is no hard matter to keep that advice.’\nHe rode on with the princess, till at last he came to the village where he\n had left his two brothers. And there he heard a great noise and uproar;\n and when he asked what was the matter, the people said, ‘Two men are going\n to be hanged.’ As he came nearer, he saw that the two men were his\n brothers, who had turned robbers; so he said, ‘Cannot they in any way be\n saved?’ But the people said ‘No,’ unless he would bestow all his money\n upon the rascals and buy their liberty. Then he did not stay to think\n about the matter, but paid what was asked, and his brothers were given up,\n and went on with him towards their home.\nAnd as they came to the wood where the fox first met them, it was so cool\n and pleasant that the two brothers said, ‘Let us sit down by the side of\n the river, and rest a while, to eat and drink.’ So he said, ‘Yes,’ and\n forgot the fox’s counsel, and sat down on the side of the river; and while\n he suspected nothing, they came behind, and threw him down the bank, and\n took the princess, the horse, and the bird, and went home to the king\n their master, and said. ‘All this have we won by our labour.’ Then there\n was great rejoicing made; but the horse would not eat, the bird would not\n sing, and the princess wept.\nThe youngest son fell to the bottom of the river’s bed: luckily it was\n nearly dry, but his bones were almost broken, and the bank was so steep\n that he could find no way to get out. Then the old fox came once more, and\n scolded him for not following his advice; otherwise no evil would have\n befallen him: ‘Yet,’ said he, ‘I cannot leave you here, so lay hold of my\n tail and hold fast.’ Then he pulled him out of the river, and said to him,\n as he got upon the bank, ‘Your brothers have set watch to kill you, if\n they find you in the kingdom.’ So he dressed himself as a poor man, and\n came secretly to the king’s court, and was scarcely within the doors when\n the horse began to eat, and the bird to sing, and the princess left off\n weeping. Then he went to the king, and told him all his brothers’ roguery;\n and they were seized and punished, and he had the princess given to him\n again; and after the king’s death he was heir to his kingdom.\nA long while after, he went to walk one day in the wood, and the old fox\n met him, and besought him with tears in his eyes to kill him, and cut off\n his head and feet. And at last he did so, and in a moment the fox was\n changed into a man, and turned out to be the brother of the princess, who\n had been lost a great many many years.']","- The trouble was that one golden apple disappeared every night because a golden bird was stealing them.
- The story does not say what happened to the golden apples after the adventures. I don’t know.","The kingdom had trouble because every night one of the golden apples from the king's garden would go missing, making the king very angry and leading him to order the gardener and his sons to keep watch. After many adventures involving the search for the golden bird, a golden horse, and a princess, the youngest son, with the help of a fox, succeeded in overcoming many challenges. In the end, after his brothers betrayed him and he was rescued by the fox, the youngest son returned to the kingdom in disguise. When he arrived, the horse began to eat, the bird to sing, and the princess stopped weeping. He revealed his brothers' wrongdoing, they were punished, and he was given the princess. After the king's death, the youngest son became heir to the kingdom.",1.0,0.4,0.21
wut did the butcher do wen he met hans?,"['CLEVER HANS\n\nThe mother of Hans said: ‘Whither away, Hans?’ Hans answered: ‘To Gretel.’\n ‘Behave well, Hans.’ ‘Oh, I’ll behave well. Goodbye, mother.’ ‘Goodbye,\n Hans.’ Hans comes to Gretel. ‘Good day, Gretel.’ ‘Good day, Hans. What do\n you bring that is good?’ ‘I bring nothing, I want to have something given\n me.’ Gretel presents Hans with a needle, Hans says: ‘Goodbye, Gretel.’\n ‘Goodbye, Hans.’\nHans takes the needle, sticks it into a hay-cart, and follows the cart\n home. ‘Good evening, mother.’ ‘Good evening, Hans. Where have you been?’\n ‘With Gretel.’ ‘What did you take her?’ ‘Took nothing; had something given\n me.’ ‘What did Gretel give you?’ ‘Gave me a needle.’ ‘Where is the needle,\n Hans?’ ‘Stuck in the hay-cart.’ ‘That was ill done, Hans. You should have\n stuck the needle in your sleeve.’ ‘Never mind, I’ll do better next time.’\n‘Whither away, Hans?’ ‘To Gretel, mother.’ ‘Behave well, Hans.’ ‘Oh, I’ll\n behave well. Goodbye, mother.’ ‘Goodbye, Hans.’ Hans comes to Gretel.\n ‘Good day, Gretel.’ ‘Good day, Hans. What do you bring that is good?’ ‘I\n bring nothing. I want to have something given to me.’ Gretel presents Hans\n with a knife. ‘Goodbye, Gretel.’ ‘Goodbye, Hans.’ Hans takes the knife,\n sticks it in his sleeve, and goes home. ‘Good evening, mother.’ ‘Good\n evening, Hans. Where have you been?’ ‘With Gretel.’ What did you take\n her?’ ‘Took her nothing, she gave me something.’ ‘What did Gretel give\n you?’ ‘Gave me a knife.’ ‘Where is the knife, Hans?’ ‘Stuck in my sleeve.’\n ‘That’s ill done, Hans, you should have put the knife in your pocket.’\n ‘Never mind, will do better next time.’\n‘Whither away, Hans?’ ‘To Gretel, mother.’ ‘Behave well, Hans.’ ‘Oh, I’ll\n behave well. Goodbye, mother.’ ‘Goodbye, Hans.’ Hans comes to Gretel.\n ‘Good day, Gretel.’ ‘Good day, Hans. What good thing do you bring?’ ‘I\n bring nothing, I want something given me.’ Gretel presents Hans with a\n young goat. ‘Goodbye, Gretel.’ ‘Goodbye, Hans.’ Hans takes the goat, ties\n its legs, and puts it in his pocket. When he gets home it is suffocated.\n ‘Good evening, mother.’ ‘Good evening, Hans. Where have you been?’ ‘With\n Gretel.’ ‘What did you take her?’ ‘Took nothing, she gave me something.’\n ‘What did Gretel give you?’ ‘She gave me a goat.’ ‘Where is the goat,\n Hans?’ ‘Put it in my pocket.’ ‘That was ill done, Hans, you should have\n put a rope round the goat’s neck.’ ‘Never mind, will do better next time.’\n‘Whither away, Hans?’ ‘To Gretel, mother.’ ‘Behave well, Hans.’ ‘Oh, I’ll\n behave well. Goodbye, mother.’ ‘Goodbye, Hans.’ Hans comes to Gretel.\n ‘Good day, Gretel.’ ‘Good day, Hans. What good thing do you bring?’ ‘I\n bring nothing, I want something given me.’ Gretel presents Hans with a\n piece of bacon. ‘Goodbye, Gretel.’ ‘Goodbye, Hans.’\nHans takes the bacon, ties it to a rope, and drags it away behind him. The\n dogs come and devour the bacon. When he gets home, he has the rope in his\n hand, and there is no longer anything hanging on to it. ‘Good evening,\n mother.’ ‘Good evening, Hans. Where have you been?’ ‘With Gretel.’ ‘What\n did you take her?’ ‘I took her nothing, she gave me something.’ ‘What did\n Gretel give you?’ ‘Gave me a bit of bacon.’ ‘Where is the bacon, Hans?’ ‘I\n tied it to a rope, brought it home, dogs took it.’ ‘That was ill done,\n Hans, you should have carried the bacon on your head.’ ‘Never mind, will\n do better next time.’\n‘Whither away, Hans?’ ‘To Gretel, mother.’ ‘Behave well, Hans.’ ‘I’ll\n behave well. Goodbye, mother.’ ‘Goodbye, Hans.’ Hans comes to Gretel.\n ‘Good day, Gretel.’ ‘Good day, Hans, What good thing do you bring?’ ‘I\n bring nothing, but would have something given.’ Gretel presents Hans with\n a calf. ‘Goodbye, Gretel.’ ‘Goodbye, Hans.’\nHans takes the calf, puts it on his head, and the calf kicks his face.\n ‘Good evening, mother.’ ‘Good evening, Hans. Where have you been?’ ‘With\n Gretel.’ ‘What did you take her?’ ‘I took nothing, but had something given\n me.’ ‘What did Gretel give you?’ ‘A calf.’ ‘Where have you the calf,\n Hans?’ ‘I set it on my head and it kicked my face.’ ‘That was ill done,\n Hans, you should have led the calf, and put it in the stall.’ ‘Never mind,\n will do better next time.’\n‘Whither away, Hans?’ ‘To Gretel, mother.’ ‘Behave well, Hans.’ ‘I’ll\n behave well. Goodbye, mother.’ ‘Goodbye, Hans.’\nHans comes to Gretel. ‘Good day, Gretel.’ ‘Good day, Hans. What good thing\n do you bring?’ ‘I bring nothing, but would have something given.’ Gretel\n says to Hans: ‘I will go with you.’\nHans takes Gretel, ties her to a rope, leads her to the rack, and binds\n her fast. Then Hans goes to his mother. ‘Good evening, mother.’ ‘Good\n evening, Hans. Where have you been?’ ‘With Gretel.’ ‘What did you take\n her?’ ‘I took her nothing.’ ‘What did Gretel give you?’ ‘She gave me\n nothing, she came with me.’ ‘Where have you left Gretel?’ ‘I led her by\n the rope, tied her to the rack, and scattered some grass for her.’ ‘That\n was ill done, Hans, you should have cast friendly eyes on her.’ ‘Never\n mind, will do better.’\nHans went into the stable, cut out all the calves’ and sheep’s eyes, and\n threw them in Gretel’s face. Then Gretel became angry, tore herself loose\n and ran away, and was no longer the bride of Hans.', 'CLEVER GRETEL\n\nThere was once a cook named Gretel, who wore shoes with red heels, and\n when she walked out with them on, she turned herself this way and that,\n was quite happy and thought: ‘You certainly are a pretty girl!’ And when\n she came home she drank, in her gladness of heart, a draught of wine, and\n as wine excites a desire to eat, she tasted the best of whatever she was\n cooking until she was satisfied, and said: ‘The cook must know what the\n food is like.’\nIt came to pass that the master one day said to her: ‘Gretel, there is a\n guest coming this evening; prepare me two fowls very daintily.’ ‘I will\n see to it, master,’ answered Gretel. She killed two fowls, scalded them,\n plucked them, put them on the spit, and towards evening set them before\n the fire, that they might roast. The fowls began to turn brown, and were\n nearly ready, but the guest had not yet arrived. Then Gretel called out to\n her master: ‘If the guest does not come, I must take the fowls away from\n the fire, but it will be a sin and a shame if they are not eaten the\n moment they are at their juiciest.’ The master said: ‘I will run myself,\n and fetch the guest.’ When the master had turned his back, Gretel laid the\n spit with the fowls on one side, and thought: ‘Standing so long by the\n fire there, makes one sweat and thirsty; who knows when they will come?\n Meanwhile, I will run into the cellar, and take a drink.’ She ran down,\n set a jug, said: ‘God bless it for you, Gretel,’ and took a good drink,\n and thought that wine should flow on, and should not be interrupted, and\n took yet another hearty draught.\nThen she went and put the fowls down again to the fire, basted them, and\n drove the spit merrily round. But as the roast meat smelt so good, Gretel\n thought: ‘Something might be wrong, it ought to be tasted!’ She touched it\n with her finger, and said: ‘Ah! how good fowls are! It certainly is a sin\n and a shame that they are not eaten at the right time!’ She ran to the\n window, to see if the master was not coming with his guest, but she saw no\n one, and went back to the fowls and thought: ‘One of the wings is burning!\n I had better take it off and eat it.’ So she cut it off, ate it, and\n enjoyed it, and when she had done, she thought: ‘The other must go down\n too, or else master will observe that something is missing.’ When the two\n wings were eaten, she went and looked for her master, and did not see him.\n It suddenly occurred to her: ‘Who knows? They are perhaps not coming at\n all, and have turned in somewhere.’ Then she said: ‘Well, Gretel, enjoy\n yourself, one fowl has been cut into, take another drink, and eat it up\n entirely; when it is eaten you will have some peace, why should God’s good\n gifts be spoilt?’ So she ran into the cellar again, took an enormous drink\n and ate up the one chicken in great glee. When one of the chickens was\n swallowed down, and still her master did not come, Gretel looked at the\n other and said: ‘What one is, the other should be likewise, the two go\n together; what’s right for the one is right for the other; I think if I\n were to take another draught it would do me no harm.’ So she took another\n hearty drink, and let the second chicken follow the first.\nWhile she was making the most of it, her master came and cried: ‘Hurry up,\n Gretel, the guest is coming directly after me!’ ‘Yes, sir, I will soon\n serve up,’ answered Gretel. Meantime the master looked to see that the\n table was properly laid, and took the great knife, wherewith he was going\n to carve the chickens, and sharpened it on the steps. Presently the guest\n came, and knocked politely and courteously at the house-door. Gretel ran,\n and looked to see who was there, and when she saw the guest, she put her\n finger to her lips and said: ‘Hush! hush! go away as quickly as you can,\n if my master catches you it will be the worse for you; he certainly did\n ask you to supper, but his intention is to cut off your two ears. Just\n listen how he is sharpening the knife for it!’ The guest heard the\n sharpening, and hurried down the steps again as fast as he could. Gretel\n was not idle; she ran screaming to her master, and cried: ‘You have\n invited a fine guest!’ ‘Why, Gretel? What do you mean by that?’ ‘Yes,’\n said she, ‘he has taken the chickens which I was just going to serve up,\n off the dish, and has run away with them!’ ‘That’s a nice trick!’ said her\n master, and lamented the fine chickens. ‘If he had but left me one, so\n that something remained for me to eat.’ He called to him to stop, but the\n guest pretended not to hear. Then he ran after him with the knife still in\n his hand, crying: ‘Just one, just one,’ meaning that the guest should\n leave him just one chicken, and not take both. The guest, however, thought\n no otherwise than that he was to give up one of his ears, and ran as if\n fire were burning under him, in order to take them both with him.', 'THE MOUSE, THE BIRD, AND THE SAUSAGE\n\nOnce upon a time, a mouse, a bird, and a sausage, entered into partnership\n and set up house together. For a long time all went well; they lived in\n great comfort, and prospered so far as to be able to add considerably to\n their stores. The bird’s duty was to fly daily into the wood and bring in\n fuel; the mouse fetched the water, and the sausage saw to the cooking.\nWhen people are too well off they always begin to long for something new.\n And so it came to pass, that the bird, while out one day, met a fellow\n bird, to whom he boastfully expatiated on the excellence of his household\n arrangements. But the other bird sneered at him for being a poor\n simpleton, who did all the hard work, while the other two stayed at home\n and had a good time of it. For, when the mouse had made the fire and\n fetched in the water, she could retire into her little room and rest until\n it was time to set the table. The sausage had only to watch the pot to see\n that the food was properly cooked, and when it was near dinner-time, he\n just threw himself into the broth, or rolled in and out among the\n vegetables three or four times, and there they were, buttered, and salted,\n and ready to be served. Then, when the bird came home and had laid aside\n his burden, they sat down to table, and when they had finished their meal,\n they could sleep their fill till the following morning: and that was\n really a very delightful life.\nInfluenced by those remarks, the bird next morning refused to bring in the\n wood, telling the others that he had been their servant long enough, and\n had been a fool into the bargain, and that it was now time to make a\n change, and to try some other way of arranging the work. Beg and pray as\n the mouse and the sausage might, it was of no use; the bird remained\n master of the situation, and the venture had to be made. They therefore\n drew lots, and it fell to the sausage to bring in the wood, to the mouse\n to cook, and to the bird to fetch the water.\nAnd now what happened? The sausage started in search of wood, the bird\n made the fire, and the mouse put on the pot, and then these two waited\n till the sausage returned with the fuel for the following day. But the\n sausage remained so long away, that they became uneasy, and the bird flew\n out to meet him. He had not flown far, however, when he came across a dog\n who, having met the sausage, had regarded him as his legitimate booty, and\n so seized and swallowed him. The bird complained to the dog of this\n bare-faced robbery, but nothing he said was of any avail, for the dog\n answered that he found false credentials on the sausage, and that was the\n reason his life had been forfeited.\nHe picked up the wood, and flew sadly home, and told the mouse all he had\n seen and heard. They were both very unhappy, but agreed to make the best\n of things and to remain with one another.\nSo now the bird set the table, and the mouse looked after the food and,\n wishing to prepare it in the same way as the sausage, by rolling in and\n out among the vegetables to salt and butter them, she jumped into the pot;\n but she stopped short long before she reached the bottom, having already\n parted not only with her skin and hair, but also with life.\nPresently the bird came in and wanted to serve up the dinner, but he could\n nowhere see the cook. In his alarm and flurry, he threw the wood here and\n there about the floor, called and searched, but no cook was to be found.\n Then some of the wood that had been carelessly thrown down, caught fire\n and began to blaze. The bird hastened to fetch some water, but his pail\n fell into the well, and he after it, and as he was unable to recover\n himself, he was drowned.']",I don't know,"When the butcher met Hans, he helped him up after Hans had been knocked down by the cow. The butcher gave Hans a flask of ale to drink and told him that his cow was good for nothing but the slaughter-house. Then, the butcher offered to exchange his fine fat pig for Hans's cow, and Hans agreed to the trade.",0.0,0.0,0.0
What role does the castle play in the story of Jorinda and Jorindel?,"['JORINDA AND JORINDEL\n\nThere was once an old castle, that stood in the middle of a deep gloomy\n wood, and in the castle lived an old fairy. Now this fairy could take any\n shape she pleased. All the day long she flew about in the form of an owl,\n or crept about the country like a cat; but at night she always became an\n old woman again. When any young man came within a hundred paces of her\n castle, he became quite fixed, and could not move a step till she came and\n set him free; which she would not do till he had given her his word never\n to come there again: but when any pretty maiden came within that space she\n was changed into a bird, and the fairy put her into a cage, and hung her\n up in a chamber in the castle. There were seven hundred of these cages\n hanging in the castle, and all with beautiful birds in them.\nNow there was once a maiden whose name was Jorinda. She was prettier than\n all the pretty girls that ever were seen before, and a shepherd lad, whose\n name was Jorindel, was very fond of her, and they were soon to be married.\n One day they went to walk in the wood, that they might be alone; and\n Jorindel said, ‘We must take care that we don’t go too near to the fairy’s\n castle.’ It was a beautiful evening; the last rays of the setting sun\n shone bright through the long stems of the trees upon the green underwood\n beneath, and the turtle-doves sang from the tall birches.\nJorinda sat down to gaze upon the sun; Jorindel sat by her side; and both\n felt sad, they knew not why; but it seemed as if they were to be parted\n from one another for ever. They had wandered a long way; and when they\n looked to see which way they should go home, they found themselves at a\n loss to know what path to take.\nThe sun was setting fast, and already half of its circle had sunk behind\n the hill: Jorindel on a sudden looked behind him, and saw through the\n bushes that they had, without knowing it, sat down close under the old\n walls of the castle. Then he shrank for fear, turned pale, and trembled.\n Jorinda was just singing,\n‘The ring-dove sang from the willow spray,\n Well-a-day! Well-a-day!\n He mourn’d for the fate of his darling mate,\n Well-a-day!’\nwhen her song stopped suddenly. Jorindel turned to see the reason, and\n beheld his Jorinda changed into a nightingale, so that her song ended with\n a mournful\njug, jug\n. An owl with fiery eyes flew three times round\n them, and three times screamed:\n‘Tu whu! Tu whu! Tu whu!’\nJorindel could not move; he stood fixed as a stone, and could neither\n weep, nor speak, nor stir hand or foot. And now the sun went quite down;\n the gloomy night came; the owl flew into a bush; and a moment after the\n old fairy came forth pale and meagre, with staring eyes, and a nose and\n chin that almost met one another.\nShe mumbled something to herself, seized the nightingale, and went away\n with it in her hand. Poor Jorindel saw the nightingale was gone—but\n what could he do? He could not speak, he could not move from the spot\n where he stood. At last the fairy came back and sang with a hoarse voice:\n‘Till the prisoner is fast,\n And her doom is cast,\n There stay! Oh, stay!\n When the charm is around her,\n And the spell has bound her,\n Hie away! away!’\nOn a sudden Jorindel found himself free. Then he fell on his knees before\n the fairy, and prayed her to give him back his dear Jorinda: but she\n laughed at him, and said he should never see her again; then she went her\n way.\nHe prayed, he wept, he sorrowed, but all in vain. ‘Alas!’ he said, ‘what\n will become of me?’ He could not go back to his own home, so he went to a\n strange village, and employed himself in keeping sheep. Many a time did he\n walk round and round as near to the hated castle as he dared go, but all\n in vain; he heard or saw nothing of Jorinda.\nAt last he dreamt one night that he found a beautiful purple flower, and\n that in the middle of it lay a costly pearl; and he dreamt that he plucked\n the flower, and went with it in his hand into the castle, and that\n everything he touched with it was disenchanted, and that there he found\n his Jorinda again.\nIn the morning when he awoke, he began to search over hill and dale for\n this pretty flower; and eight long days he sought for it in vain: but on\n the ninth day, early in the morning, he found the beautiful purple flower;\n and in the middle of it was a large dewdrop, as big as a costly pearl.\n Then he plucked the flower, and set out and travelled day and night, till\n he came again to the castle.\nHe walked nearer than a hundred paces to it, and yet he did not become\n fixed as before, but found that he could go quite close up to the door.\n Jorindel was very glad indeed to see this. Then he touched the door with\n the flower, and it sprang open; so that he went in through the court, and\n listened when he heard so many birds singing. At last he came to the\n chamber where the fairy sat, with the seven hundred birds singing in the\n seven hundred cages. When she saw Jorindel she was very angry, and\n screamed with rage; but she could not come within two yards of him, for\n the flower he held in his hand was his safeguard. He looked around at the\n birds, but alas! there were many, many nightingales, and how then should\n he find out which was his Jorinda? While he was thinking what to do, he\n saw the fairy had taken down one of the cages, and was making the best of\n her way off through the door. He ran or flew after her, touched the cage\n with the flower, and Jorinda stood before him, and threw her arms round\n his neck looking as beautiful as ever, as beautiful as when they walked\n together in the wood.\nThen he touched all the other birds with the flower, so that they all took\n their old forms again; and he took Jorinda home, where they were married,\n and lived happily together many years: and so did a good many other lads,\n whose maidens had been forced to sing in the old fairy’s cages by\n themselves, much longer than they liked.', 'THE RAVEN\n\nThere was once a queen who had a little daughter, still too young to run\n alone. One day the child was very troublesome, and the mother could not\n quiet it, do what she would. She grew impatient, and seeing the ravens\n flying round the castle, she opened the window, and said: ‘I wish you were\n a raven and would fly away, then I should have a little peace.’ Scarcely\n were the words out of her mouth, when the child in her arms was turned\n into a raven, and flew away from her through the open window. The bird\n took its flight to a dark wood and remained there for a long time, and\n meanwhile the parents could hear nothing of their child.\nLong after this, a man was making his way through the wood when he heard a\n raven calling, and he followed the sound of the voice. As he drew near,\n the raven said, ‘I am by birth a king’s daughter, but am now under the\n spell of some enchantment; you can, however, set me free.’ ‘What am I to\n do?’ he asked. She replied, ‘Go farther into the wood until you come to a\n house, wherein lives an old woman; she will offer you food and drink, but\n you must not take of either; if you do, you will fall into a deep sleep,\n and will not be able to help me. In the garden behind the house is a large\n tan-heap, and on that you must stand and watch for me. I shall drive there\n in my carriage at two o’clock in the afternoon for three successive days;\n the first day it will be drawn by four white, the second by four chestnut,\n and the last by four black horses; but if you fail to keep awake and I\n find you sleeping, I shall not be set free.’\nThe man promised to do all that she wished, but the raven said, ‘Alas! I\n know even now that you will take something from the woman and be unable to\n save me.’ The man assured her again that he would on no account touch a\n thing to eat or drink.\nWhen he came to the house and went inside, the old woman met him, and\n said, ‘Poor man! how tired you are! Come in and rest and let me give you\n something to eat and drink.’\n‘No,’ answered the man, ‘I will neither eat not drink.’\nBut she would not leave him alone, and urged him saying, ‘If you will not\n eat anything, at least you might take a draught of wine; one drink counts\n for nothing,’ and at last he allowed himself to be persuaded, and drank.\nAs it drew towards the appointed hour, he went outside into the garden and\n mounted the tan-heap to await the raven. Suddenly a feeling of fatigue\n came over him, and unable to resist it, he lay down for a little while,\n fully determined, however, to keep awake; but in another minute his eyes\n closed of their own accord, and he fell into such a deep sleep, that all\n the noises in the world would not have awakened him. At two o’clock the\n raven came driving along, drawn by her four white horses; but even before\n she reached the spot, she said to herself, sighing, ‘I know he has fallen\n asleep.’ When she entered the garden, there she found him as she had\n feared, lying on the tan-heap, fast asleep. She got out of her carriage\n and went to him; she called him and shook him, but it was all in vain, he\n still continued sleeping.\nThe next day at noon, the old woman came to him again with food and drink\n which he at first refused. At last, overcome by her persistent entreaties\n that he would take something, he lifted the glass and drank again.\nTowards two o’clock he went into the garden and on to the tan-heap to\n watch for the raven. He had not been there long before he began to feel so\n tired that his limbs seemed hardly able to support him, and he could not\n stand upright any longer; so again he lay down and fell fast asleep. As\n the raven drove along her four chestnut horses, she said sorrowfully to\n herself, ‘I know he has fallen asleep.’ She went as before to look for\n him, but he slept, and it was impossible to awaken him.\nThe following day the old woman said to him, ‘What is this? You are not\n eating or drinking anything, do you want to kill yourself?’\nHe answered, ‘I may not and will not either eat or drink.’\nBut she put down the dish of food and the glass of wine in front of him,\n and when he smelt the wine, he was unable to resist the temptation, and\n took a deep draught.\nWhen the hour came round again he went as usual on to the tan-heap in the\n garden to await the king’s daughter, but he felt even more overcome with\n weariness than on the two previous days, and throwing himself down, he\n slept like a log. At two o’clock the raven could be seen approaching, and\n this time her coachman and everything about her, as well as her horses,\n were black.\nShe was sadder than ever as she drove along, and said mournfully, ‘I know\n he has fallen asleep, and will not be able to set me free.’ She found him\n sleeping heavily, and all her efforts to awaken him were of no avail. Then\n she placed beside him a loaf, and some meat, and a flask of wine, of such\n a kind, that however much he took of them, they would never grow less.\n After that she drew a gold ring, on which her name was engraved, off her\n finger, and put it upon one of his. Finally, she laid a letter near him,\n in which, after giving him particulars of the food and drink she had left\n for him, she finished with the following words: ‘I see that as long as you\n remain here you will never be able to set me free; if, however, you still\n wish to do so, come to the golden castle of Stromberg; this is well within\n your power to accomplish.’ She then returned to her carriage and drove to\n the golden castle of Stromberg.\nWhen the man awoke and found that he had been sleeping, he was grieved at\n heart, and said, ‘She has no doubt been here and driven away again, and it\n is now too late for me to save her.’ Then his eyes fell on the things\n which were lying beside him; he read the letter, and knew from it all that\n had happened. He rose up without delay, eager to start on his way and to\n reach the castle of Stromberg, but he had no idea in which direction he\n ought to go. He travelled about a long time in search of it and came at\n last to a dark forest, through which he went on walking for fourteen days\n and still could not find a way out. Once more the night came on, and worn\n out he lay down under a bush and fell asleep. Again the next day he\n pursued his way through the forest, and that evening, thinking to rest\n again, he lay down as before, but he heard such a howling and wailing that\n he found it impossible to sleep. He waited till it was darker and people\n had begun to light up their houses, and then seeing a little glimmer ahead\n of him, he went towards it.\nHe found that the light came from a house which looked smaller than it\n really was, from the contrast of its height with that of an immense giant\n who stood in front of it. He thought to himself, ‘If the giant sees me\n going in, my life will not be worth much.’ However, after a while he\n summoned up courage and went forward. When the giant saw him, he called\n out, ‘It is lucky for that you have come, for I have not had anything to\n eat for a long time. I can have you now for my supper.’ ‘I would rather\n you let that alone,’ said the man, ‘for I do not willingly give myself up\n to be eaten; if you are wanting food I have enough to satisfy your\n hunger.’ ‘If that is so,’ replied the giant, ‘I will leave you in peace; I\n only thought of eating you because I had nothing else.’\nSo they went indoors together and sat down, and the man brought out the\n bread, meat, and wine, which although he had eaten and drunk of them, were\n still unconsumed. The giant was pleased with the good cheer, and ate and\n drank to his heart’s content. When he had finished his supper the man\n asked him if he could direct him to the castle of Stromberg. The giant\n said, ‘I will look on my map; on it are marked all the towns, villages,\n and houses.’ So he fetched his map, and looked for the castle, but could\n not find it. ‘Never mind,’ he said, ‘I have larger maps upstairs in the\n cupboard, we will look on those,’ but they searched in vain, for the\n castle was not marked even on these. The man now thought he should like to\n continue his journey, but the giant begged him to remain for a day or two\n longer until the return of his brother, who was away in search of\n provisions. When the brother came home, they asked him about the castle of\n Stromberg, and he told them he would look on his own maps as soon as he\n had eaten and appeased his hunger. Accordingly, when he had finished his\n supper, they all went up together to his room and looked through his maps,\n but the castle was not to be found. Then he fetched other older maps, and\n they went on looking for the castle until at last they found it, but it\n was many thousand miles away. ‘How shall I be able to get there?’ asked\n the man. ‘I have two hours to spare,’ said the giant, ‘and I will carry\n you into the neighbourhood of the castle; I must then return to look after\n the child who is in our care.’\nThe giant, thereupon, carried the man to within about a hundred leagues of\n the castle, where he left him, saying, ‘You will be able to walk the\n remainder of the way yourself.’ The man journeyed on day and night till he\n reached the golden castle of Stromberg. He found it situated, however, on\n a glass mountain, and looking up from the foot he saw the enchanted maiden\n drive round her castle and then go inside. He was overjoyed to see her,\n and longed to get to the top of the mountain, but the sides were so\n slippery that every time he attempted to climb he fell back again. When he\n saw that it was impossible to reach her, he was greatly grieved, and said\n to himself, ‘I will remain here and wait for her,’ so he built himself a\n little hut, and there he sat and watched for a whole year, and every day\n he saw the king’s daughter driving round her castle, but still was unable\n to get nearer to her.\nLooking out from his hut one day he saw three robbers fighting and he\n called out to them, ‘God be with you.’ They stopped when they heard the\n call, but looking round and seeing nobody, they went on again with their\n fighting, which now became more furious. ‘God be with you,’ he cried\n again, and again they paused and looked about, but seeing no one went back\n to their fighting. A third time he called out, ‘God be with you,’ and then\n thinking he should like to know the cause of dispute between the three\n men, he went out and asked them why they were fighting so angrily with one\n another. One of them said that he had found a stick, and that he had but\n to strike it against any door through which he wished to pass, and it\n immediately flew open. Another told him that he had found a cloak which\n rendered its wearer invisible; and the third had caught a horse which\n would carry its rider over any obstacle, and even up the glass mountain.\n They had been unable to decide whether they would keep together and have\n the things in common, or whether they would separate. On hearing this, the\n man said, ‘I will give you something in exchange for those three things;\n not money, for that I have not got, but something that is of far more\n value. I must first, however, prove whether all you have told me about\n your three things is true.’ The robbers, therefore, made him get on the\n horse, and handed him the stick and the cloak, and when he had put this\n round him he was no longer visible. Then he fell upon them with the stick\n and beat them one after another, crying, ‘There, you idle vagabonds, you\n have got what you deserve; are you satisfied now!’\nAfter this he rode up the glass mountain. When he reached the gate of the\n castle, he found it closed, but he gave it a blow with his stick, and it\n flew wide open at once and he passed through. He mounted the steps and\n entered the room where the maiden was sitting, with a golden goblet full\n of wine in front of her. She could not see him for he still wore his\n cloak. He took the ring which she had given him off his finger, and threw\n it into the goblet, so that it rang as it touched the bottom. ‘That is my\n own ring,’ she exclaimed, ‘and if that is so the man must also be here who\n is coming to set me free.’\nShe sought for him about the castle, but could find him nowhere. Meanwhile\n he had gone outside again and mounted his horse and thrown off the cloak.\n When therefore she came to the castle gate she saw him, and cried aloud\n for joy. Then he dismounted and took her in his arms; and she kissed him,\n and said, ‘Now you have indeed set me free, and tomorrow we will celebrate\n our marriage.’', 'THE KING OF THE GOLDEN MOUNTAIN\n\nThere was once a merchant who had only one child, a son, that was very\n young, and barely able to run alone. He had two richly laden ships then\n making a voyage upon the seas, in which he had embarked all his wealth, in\n the hope of making great gains, when the news came that both were lost.\n Thus from being a rich man he became all at once so very poor that nothing\n was left to him but one small plot of land; and there he often went in an\n evening to take his walk, and ease his mind of a little of his trouble.\nOne day, as he was roaming along in a brown study, thinking with no great\n comfort on what he had been and what he now was, and was like to be, all\n on a sudden there stood before him a little, rough-looking, black dwarf.\n ‘Prithee, friend, why so sorrowful?’ said he to the merchant; ‘what is it\n you take so deeply to heart?’ ‘If you would do me any good I would\n willingly tell you,’ said the merchant. ‘Who knows but I may?’ said the\n little man: ‘tell me what ails you, and perhaps you will find I may be of\n some use.’ Then the merchant told him how all his wealth was gone to the\n bottom of the sea, and how he had nothing left but that little plot of\n land. ‘Oh, trouble not yourself about that,’ said the dwarf; ‘only\n undertake to bring me here, twelve years hence, whatever meets you first\n on your going home, and I will give you as much as you please.’ The\n merchant thought this was no great thing to ask; that it would most likely\n be his dog or his cat, or something of that sort, but forgot his little\n boy Heinel; so he agreed to the bargain, and signed and sealed the bond to\n do what was asked of him.\nBut as he drew near home, his little boy was so glad to see him that he\n crept behind him, and laid fast hold of his legs, and looked up in his\n face and laughed. Then the father started, trembling with fear and horror,\n and saw what it was that he had bound himself to do; but as no gold was\n come, he made himself easy by thinking that it was only a joke that the\n dwarf was playing him, and that, at any rate, when the money came, he\n should see the bearer, and would not take it in.\nAbout a month afterwards he went upstairs into a lumber-room to look for\n some old iron, that he might sell it and raise a little money; and there,\n instead of his iron, he saw a large pile of gold lying on the floor. At\n the sight of this he was overjoyed, and forgetting all about his son, went\n into trade again, and became a richer merchant than before.\nMeantime little Heinel grew up, and as the end of the twelve years drew\n near the merchant began to call to mind his bond, and became very sad and\n thoughtful; so that care and sorrow were written upon his face. The boy\n one day asked what was the matter, but his father would not tell for some\n time; at last, however, he said that he had, without knowing it, sold him\n for gold to a little, ugly-looking, black dwarf, and that the twelve years\n were coming round when he must keep his word. Then Heinel said, ‘Father,\n give yourself very little trouble about that; I shall be too much for the\n little man.’\nWhen the time came, the father and son went out together to the place\n agreed upon: and the son drew a circle on the ground, and set himself and\n his father in the middle of it. The little black dwarf soon came, and\n walked round and round about the circle, but could not find any way to get\n into it, and he either could not, or dared not, jump over it. At last the\n boy said to him. ‘Have you anything to say to us, my friend, or what do\n you want?’ Now Heinel had found a friend in a good fairy, that was fond of\n him, and had told him what to do; for this fairy knew what good luck was\n in store for him. ‘Have you brought me what you said you would?’ said the\n dwarf to the merchant. The old man held his tongue, but Heinel said again,\n ‘What do you want here?’ The dwarf said, ‘I come to talk with your father,\n not with you.’ ‘You have cheated and taken in my father,’ said the son;\n ‘pray give him up his bond at once.’ ‘Fair and softly,’ said the little\n old man; ‘right is right; I have paid my money, and your father has had\n it, and spent it; so be so good as to let me have what I paid it for.’\n ‘You must have my consent to that first,’ said Heinel, ‘so please to step\n in here, and let us talk it over.’ The old man grinned, and showed his\n teeth, as if he should have been very glad to get into the circle if he\n could. Then at last, after a long talk, they came to terms. Heinel agreed\n that his father must give him up, and that so far the dwarf should have\n his way: but, on the other hand, the fairy had told Heinel what fortune\n was in store for him, if he followed his own course; and he did not choose\n to be given up to his hump-backed friend, who seemed so anxious for his\n company.\nSo, to make a sort of drawn battle of the matter, it was settled that\n Heinel should be put into an open boat, that lay on the sea-shore hard by;\n that the father should push him off with his own hand, and that he should\n thus be set adrift, and left to the bad or good luck of wind and weather.\n Then he took leave of his father, and set himself in the boat, but before\n it got far off a wave struck it, and it fell with one side low in the\n water, so the merchant thought that poor Heinel was lost, and went home\n very sorrowful, while the dwarf went his way, thinking that at any rate he\n had had his revenge.\nThe boat, however, did not sink, for the good fairy took care of her\n friend, and soon raised the boat up again, and it went safely on. The\n young man sat safe within, till at length it ran ashore upon an unknown\n land. As he jumped upon the shore he saw before him a beautiful castle but\n empty and dreary within, for it was enchanted. ‘Here,’ said he to himself,\n ‘must I find the prize the good fairy told me of.’ So he once more\n searched the whole palace through, till at last he found a white snake,\n lying coiled up on a cushion in one of the chambers.\nNow the white snake was an enchanted princess; and she was very glad to\n see him, and said, ‘Are you at last come to set me free? Twelve long years\n have I waited here for the fairy to bring you hither as she promised, for\n you alone can save me. This night twelve men will come: their faces will\n be black, and they will be dressed in chain armour. They will ask what you\n do here, but give no answer; and let them do what they will—beat,\n whip, pinch, prick, or torment you—bear all; only speak not a word,\n and at twelve o’clock they must go away. The second night twelve others\n will come: and the third night twenty-four, who will even cut off your\n head; but at the twelfth hour of that night their power is gone, and I\n shall be free, and will come and bring you the Water of Life, and will\n wash you with it, and bring you back to life and health.’ And all came to\n pass as she had said; Heinel bore all, and spoke not a word; and the third\n night the princess came, and fell on his neck and kissed him. Joy and\n gladness burst forth throughout the castle, the wedding was celebrated,\n and he was crowned king of the Golden Mountain.\nThey lived together very happily, and the queen had a son. And thus eight\n years had passed over their heads, when the king thought of his father;\n and he began to long to see him once again. But the queen was against his\n going, and said, ‘I know well that misfortunes will come upon us if you\n go.’ However, he gave her no rest till she agreed. At his going away she\n gave him a wishing-ring, and said, ‘Take this ring, and put it on your\n finger; whatever you wish it will bring you; only promise never to make\n use of it to bring me hence to your father’s house.’ Then he said he would\n do what she asked, and put the ring on his finger, and wished himself near\n the town where his father lived.\nHeinel found himself at the gates in a moment; but the guards would not\n let him go in, because he was so strangely clad. So he went up to a\n neighbouring hill, where a shepherd dwelt, and borrowed his old frock, and\n thus passed unknown into the town. When he came to his father’s house, he\n said he was his son; but the merchant would not believe him, and said he\n had had but one son, his poor Heinel, who he knew was long since dead: and\n as he was only dressed like a poor shepherd, he would not even give him\n anything to eat. The king, however, still vowed that he was his son, and\n said, ‘Is there no mark by which you would know me if I am really your\n son?’ ‘Yes,’ said his mother, ‘our Heinel had a mark like a raspberry on\n his right arm.’ Then he showed them the mark, and they knew that what he\n had said was true.\nHe next told them how he was king of the Golden Mountain, and was married\n to a princess, and had a son seven years old. But the merchant said, ‘that\n can never be true; he must be a fine king truly who travels about in a\n shepherd’s frock!’ At this the son was vexed; and forgetting his word,\n turned his ring, and wished for his queen and son. In an instant they\n stood before him; but the queen wept, and said he had broken his word, and\n bad luck would follow. He did all he could to soothe her, and she at last\n seemed to be appeased; but she was not so in truth, and was only thinking\n how she should punish him.\nOne day he took her to walk with him out of the town, and showed her the\n spot where the boat was set adrift upon the wide waters. Then he sat\n himself down, and said, ‘I am very much tired; sit by me, I will rest my\n head in your lap, and sleep a while.’ As soon as he had fallen asleep,\n however, she drew the ring from his finger, and crept softly away, and\n wished herself and her son at home in their kingdom. And when he awoke he\n found himself alone, and saw that the ring was gone from his finger. ‘I\n can never go back to my father’s house,’ said he; ‘they would say I am a\n sorcerer: I will journey forth into the world, till I come again to my\n kingdom.’\nSo saying he set out and travelled till he came to a hill, where three\n giants were sharing their father’s goods; and as they saw him pass they\n cried out and said, ‘Little men have sharp wits; he shall part the goods\n between us.’ Now there was a sword that cut off an enemy’s head whenever\n the wearer gave the words, ‘Heads off!’; a cloak that made the owner\n invisible, or gave him any form he pleased; and a pair of boots that\n carried the wearer wherever he wished. Heinel said they must first let him\n try these wonderful things, then he might know how to set a value upon\n them. Then they gave him the cloak, and he wished himself a fly, and in a\n moment he was a fly. ‘The cloak is very well,’ said he: ‘now give me the\n sword.’ ‘No,’ said they; ‘not unless you undertake not to say, “Heads\n off!” for if you do we are all dead men.’ So they gave it him, charging\n him to try it on a tree. He next asked for the boots also; and the moment\n he had all three in his power, he wished himself at the Golden Mountain;\n and there he was at once. So the giants were left behind with no goods to\n share or quarrel about.\nAs Heinel came near his castle he heard the sound of merry music; and the\n people around told him that his queen was about to marry another husband.\n Then he threw his cloak around him, and passed through the castle hall,\n and placed himself by the side of the queen, where no one saw him. But\n when anything to eat was put upon her plate, he took it away and ate it\n himself; and when a glass of wine was handed to her, he took it and drank\n it; and thus, though they kept on giving her meat and drink, her plate and\n cup were always empty.\nUpon this, fear and remorse came over her, and she went into her chamber\n alone, and sat there weeping; and he followed her there. ‘Alas!’ said she\n to herself, ‘was I not once set free? Why then does this enchantment still\n seem to bind me?’\n‘False and fickle one!’ said he. ‘One indeed came who set thee free, and\n he is now near thee again; but how have you used him? Ought he to have had\n such treatment from thee?’ Then he went out and sent away the company, and\n said the wedding was at an end, for that he was come back to the kingdom.\n But the princes, peers, and great men mocked at him. However, he would\n enter into no parley with them, but only asked them if they would go in\n peace or not. Then they turned upon him and tried to seize him; but he\n drew his sword. ‘Heads Off!’ cried he; and with the word the traitors’\n heads fell before him, and Heinel was once more king of the Golden\n Mountain.']",The castle is the fairy’s dwelling and prison: it contains the enchanted birds (including Jorinda when she’s turned into a nightingale) and is the place where the fairy captures and keeps maidens. It becomes the target of Jorindel’s rescue using the disenchanted flower.,"The castle stands in the middle of a deep gloomy wood and is the home of an old fairy who captures maidens and turns them into birds, keeping them in cages within the castle.",1.0,0.875,0.46
Who is Chanticleer in the story?,"['THE ADVENTURES OF CHANTICLEER AND PARTLET\n\n1. HOW THEY WENT TO THE MOUNTAINS TO EAT NUTS\n‘The nuts are quite ripe now,’ said Chanticleer to his wife Partlet,\n ‘suppose we go together to the mountains, and eat as many as we can,\n before the squirrel takes them all away.’ ‘With all my heart,’ said\n Partlet, ‘let us go and make a holiday of it together.’\nSo they went to the mountains; and as it was a lovely day, they stayed\n there till the evening. Now, whether it was that they had eaten so many\n nuts that they could not walk, or whether they were lazy and would not, I\n do not know: however, they took it into their heads that it did not become\n them to go home on foot. So Chanticleer began to build a little carriage\n of nutshells: and when it was finished, Partlet jumped into it and sat\n down, and bid Chanticleer harness himself to it and draw her home. ‘That’s\n a good joke!’ said Chanticleer; ‘no, that will never do; I had rather by\n half walk home; I’ll sit on the box and be coachman, if you like, but I’ll\n not draw.’ While this was passing, a duck came quacking up and cried out,\n ‘You thieving vagabonds, what business have you in my grounds? I’ll give\n it you well for your insolence!’ and upon that she fell upon Chanticleer\n most lustily. But Chanticleer was no coward, and returned the duck’s blows\n with his sharp spurs so fiercely that she soon began to cry out for mercy;\n which was only granted her upon condition that she would draw the carriage\n home for them. This she agreed to do; and Chanticleer got upon the box,\n and drove, crying, ‘Now, duck, get on as fast as you can.’ And away they\n went at a pretty good pace.\nAfter they had travelled along a little way, they met a needle and a pin\n walking together along the road: and the needle cried out, ‘Stop, stop!’\n and said it was so dark that they could hardly find their way, and such\n dirty walking they could not get on at all: he told them that he and his\n friend, the pin, had been at a public-house a few miles off, and had sat\n drinking till they had forgotten how late it was; he begged therefore that\n the travellers would be so kind as to give them a lift in their carriage.\n Chanticleer observing that they were but thin fellows, and not likely to\n take up much room, told them they might ride, but made them promise not to\n dirty the wheels of the carriage in getting in, nor to tread on Partlet’s\n toes.\nLate at night they arrived at an inn; and as it was bad travelling in the\n dark, and the duck seemed much tired, and waddled about a good deal from\n one side to the other, they made up their minds to fix their quarters\n there: but the landlord at first was unwilling, and said his house was\n full, thinking they might not be very respectable company: however, they\n spoke civilly to him, and gave him the egg which Partlet had laid by the\n way, and said they would give him the duck, who was in the habit of laying\n one every day: so at last he let them come in, and they bespoke a handsome\n supper, and spent the evening very jollily.\nEarly in the morning, before it was quite light, and when nobody was\n stirring in the inn, Chanticleer awakened his wife, and, fetching the egg,\n they pecked a hole in it, ate it up, and threw the shells into the\n fireplace: they then went to the pin and needle, who were fast asleep, and\n seizing them by the heads, stuck one into the landlord’s easy chair and\n the other into his handkerchief; and, having done this, they crept away as\n softly as possible. However, the duck, who slept in the open air in the\n yard, heard them coming, and jumping into the brook which ran close by the\n inn, soon swam out of their reach.\nAn hour or two afterwards the landlord got up, and took his handkerchief\n to wipe his face, but the pin ran into him and pricked him: then he walked\n into the kitchen to light his pipe at the fire, but when he stirred it up\n the eggshells flew into his eyes, and almost blinded him. ‘Bless me!’ said\n he, ‘all the world seems to have a design against my head this morning’:\n and so saying, he threw himself sulkily into his easy chair; but, oh dear!\n the needle ran into him; and this time the pain was not in his head. He\n now flew into a very great passion, and, suspecting the company who had\n come in the night before, he went to look after them, but they were all\n off; so he swore that he never again would take in such a troop of\n vagabonds, who ate a great deal, paid no reckoning, and gave him nothing\n for his trouble but their apish tricks.\n2. HOW CHANTICLEER AND PARTLET WENT TO VISIT MR KORBES\nAnother day, Chanticleer and Partlet wished to ride out together; so\n Chanticleer built a handsome carriage with four red wheels, and harnessed\n six mice to it; and then he and Partlet got into the carriage, and away\n they drove. Soon afterwards a cat met them, and said, ‘Where are you\n going?’ And Chanticleer replied,\n‘All on our way\n A visit to pay\n To Mr Korbes, the fox, today.’\nThen the cat said, ‘Take me with you,’ Chanticleer said, ‘With all my\n heart: get up behind, and be sure you do not fall off.’\n‘Take care of this handsome coach of mine,\n Nor dirty my pretty red wheels so fine!\n Now, mice, be ready,\n And, wheels, run steady!\n For we are going a visit to pay\n To Mr Korbes, the fox, today.’\nSoon after came up a millstone, an egg, a duck, and a pin; and Chanticleer\n gave them all leave to get into the carriage and go with them.\nWhen they arrived at Mr Korbes’s house, he was not at home; so the mice\n drew the carriage into the coach-house, Chanticleer and Partlet flew upon\n a beam, the cat sat down in the fireplace, the duck got into the washing\n cistern, the pin stuck himself into the bed pillow, the millstone laid\n himself over the house door, and the egg rolled himself up in the towel.\nWhen Mr Korbes came home, he went to the fireplace to make a fire; but the\n cat threw all the ashes in his eyes: so he ran to the kitchen to wash\n himself; but there the duck splashed all the water in his face; and when\n he tried to wipe himself, the egg broke to pieces in the towel all over\n his face and eyes. Then he was very angry, and went without his supper to\n bed; but when he laid his head on the pillow, the pin ran into his cheek:\n at this he became quite furious, and, jumping up, would have run out of\n the house; but when he came to the door, the millstone fell down on his\n head, and killed him on the spot.\n3. HOW PARTLET DIED AND WAS BURIED, AND HOW CHANTICLEER DIED OF GRIEF\nAnother day Chanticleer and Partlet agreed to go again to the mountains to\n eat nuts; and it was settled that all the nuts which they found should be\n shared equally between them. Now Partlet found a very large nut; but she\n said nothing about it to Chanticleer, and kept it all to herself: however,\n it was so big that she could not swallow it, and it stuck in her throat.\n Then she was in a great fright, and cried out to Chanticleer, ‘Pray run as\n fast as you can, and fetch me some water, or I shall be choked.’\n Chanticleer ran as fast as he could to the river, and said, ‘River, give\n me some water, for Partlet lies in the mountain, and will be choked by a\n great nut.’ The river said, ‘Run first to the bride, and ask her for a\n silken cord to draw up the water.’ Chanticleer ran to the bride, and said,\n ‘Bride, you must give me a silken cord, for then the river will give me\n water, and the water I will carry to Partlet, who lies on the mountain,\n and will be choked by a great nut.’ But the bride said, ‘Run first, and\n bring me my garland that is hanging on a willow in the garden.’ Then\n Chanticleer ran to the garden, and took the garland from the bough where\n it hung, and brought it to the bride; and then the bride gave him the\n silken cord, and he took the silken cord to the river, and the river gave\n him water, and he carried the water to Partlet; but in the meantime she\n was choked by the great nut, and lay quite dead, and never moved any more.\nThen Chanticleer was very sorry, and cried bitterly; and all the beasts\n came and wept with him over poor Partlet. And six mice built a little\n hearse to carry her to her grave; and when it was ready they harnessed\n themselves before it, and Chanticleer drove them. On the way they met the\n fox. ‘Where are you going, Chanticleer?’ said he. ‘To bury my Partlet,’\n said the other. ‘May I go with you?’ said the fox. ‘Yes; but you must get\n up behind, or my horses will not be able to draw you.’ Then the fox got up\n behind; and presently the wolf, the bear, the goat, and all the beasts of\n the wood, came and climbed upon the hearse.\nSo on they went till they came to a rapid stream. ‘How shall we get over?’\n said Chanticleer. Then said a straw, ‘I will lay myself across, and you\n may pass over upon me.’ But as the mice were going over, the straw slipped\n away and fell into the water, and the six mice all fell in and were\n drowned. What was to be done? Then a large log of wood came and said, ‘I\n am big enough; I will lay myself across the stream, and you shall pass\n over upon me.’ So he laid himself down; but they managed so clumsily, that\n the log of wood fell in and was carried away by the stream. Then a stone,\n who saw what had happened, came up and kindly offered to help poor\n Chanticleer by laying himself across the stream; and this time he got\n safely to the other side with the hearse, and managed to get Partlet out\n of it; but the fox and the other mourners, who were sitting behind, were\n too heavy, and fell back into the water and were all carried away by the\n stream and drowned.\nThus Chanticleer was left alone with his dead Partlet; and having dug a\n grave for her, he laid her in it, and made a little hillock over her. Then\n he sat down by the grave, and wept and mourned, till at last he died too;\n and so all were dead.', 'THE TRAVELLING MUSICIANS\n\nAn honest farmer had once an ass that had been a faithful servant to him a\n great many years, but was now growing old and every day more and more\n unfit for work. His master therefore was tired of keeping him and began to\n think of putting an end to him; but the ass, who saw that some mischief\n was in the wind, took himself slyly off, and began his journey towards the\n great city, ‘For there,’ thought he, ‘I may turn musician.’\nAfter he had travelled a little way, he spied a dog lying by the roadside\n and panting as if he were tired. ‘What makes you pant so, my friend?’ said\n the ass. ‘Alas!’ said the dog, ‘my master was going to knock me on the\n head, because I am old and weak, and can no longer make myself useful to\n him in hunting; so I ran away; but what can I do to earn my livelihood?’\n ‘Hark ye!’ said the ass, ‘I am going to the great city to turn musician:\n suppose you go with me, and try what you can do in the same way?’ The dog\n said he was willing, and they jogged on together.\nThey had not gone far before they saw a cat sitting in the middle of the\n road and making a most rueful face. ‘Pray, my good lady,’ said the ass,\n ‘what’s the matter with you? You look quite out of spirits!’ ‘Ah, me!’\n said the cat, ‘how can one be in good spirits when one’s life is in\n danger? Because I am beginning to grow old, and had rather lie at my ease\n by the fire than run about the house after the mice, my mistress laid hold\n of me, and was going to drown me; and though I have been lucky enough to\n get away from her, I do not know what I am to live upon.’ ‘Oh,’ said the\n ass, ‘by all means go with us to the great city; you are a good night\n singer, and may make your fortune as a musician.’ The cat was pleased with\n the thought, and joined the party.\nSoon afterwards, as they were passing by a farmyard, they saw a cock\n perched upon a gate, and screaming out with all his might and main.\n ‘Bravo!’ said the ass; ‘upon my word, you make a famous noise; pray what\n is all this about?’ ‘Why,’ said the cock, ‘I was just now saying that we\n should have fine weather for our washing-day, and yet my mistress and the\n cook don’t thank me for my pains, but threaten to cut off my head\n tomorrow, and make broth of me for the guests that are coming on Sunday!’\n ‘Heaven forbid!’ said the ass, ‘come with us Master Chanticleer; it will\n be better, at any rate, than staying here to have your head cut off!\n Besides, who knows? If we care to sing in tune, we may get up some kind of\n a concert; so come along with us.’ ‘With all my heart,’ said the cock: so\n they all four went on jollily together.\nThey could not, however, reach the great city the first day; so when night\n came on, they went into a wood to sleep. The ass and the dog laid\n themselves down under a great tree, and the cat climbed up into the\n branches; while the cock, thinking that the higher he sat the safer he\n should be, flew up to the very top of the tree, and then, according to his\n custom, before he went to sleep, looked out on all sides of him to see\n that everything was well. In doing this, he saw afar off something bright\n and shining and calling to his companions said, ‘There must be a house no\n great way off, for I see a light.’ ‘If that be the case,’ said the ass,\n ‘we had better change our quarters, for our lodging is not the best in the\n world!’ ‘Besides,’ added the dog, ‘I should not be the worse for a bone or\n two, or a bit of meat.’ So they walked off together towards the spot where\n Chanticleer had seen the light, and as they drew near it became larger and\n brighter, till they at last came close to a house in which a gang of\n robbers lived.\nThe ass, being the tallest of the company, marched up to the window and\n peeped in. ‘Well, Donkey,’ said Chanticleer, ‘what do you see?’ ‘What do I\n see?’ replied the ass. ‘Why, I see a table spread with all kinds of good\n things, and robbers sitting round it making merry.’ ‘That would be a noble\n lodging for us,’ said the cock. ‘Yes,’ said the ass, ‘if we could only get\n in’; so they consulted together how they should contrive to get the\n robbers out; and at last they hit upon a plan. The ass placed himself\n upright on his hind legs, with his forefeet resting against the window;\n the dog got upon his back; the cat scrambled up to the dog’s shoulders,\n and the cock flew up and sat upon the cat’s head. When all was ready a\n signal was given, and they began their music. The ass brayed, the dog\n barked, the cat mewed, and the cock screamed; and then they all broke\n through the window at once, and came tumbling into the room, amongst the\n broken glass, with a most hideous clatter! The robbers, who had been not a\n little frightened by the opening concert, had now no doubt that some\n frightful hobgoblin had broken in upon them, and scampered away as fast as\n they could.\nThe coast once clear, our travellers soon sat down and dispatched what the\n robbers had left, with as much eagerness as if they had not expected to\n eat again for a month. As soon as they had satisfied themselves, they put\n out the lights, and each once more sought out a resting-place to his own\n liking. The donkey laid himself down upon a heap of straw in the yard, the\n dog stretched himself upon a mat behind the door, the cat rolled herself\n up on the hearth before the warm ashes, and the cock perched upon a beam\n on the top of the house; and, as they were all rather tired with their\n journey, they soon fell asleep.\nBut about midnight, when the robbers saw from afar that the lights were\n out and that all seemed quiet, they began to think that they had been in\n too great a hurry to run away; and one of them, who was bolder than the\n rest, went to see what was going on. Finding everything still, he marched\n into the kitchen, and groped about till he found a match in order to light\n a candle; and then, espying the glittering fiery eyes of the cat, he\n mistook them for live coals, and held the match to them to light it. But\n the cat, not understanding this joke, sprang at his face, and spat, and\n scratched at him. This frightened him dreadfully, and away he ran to the\n back door; but there the dog jumped up and bit him in the leg; and as he\n was crossing over the yard the ass kicked him; and the cock, who had been\n awakened by the noise, crowed with all his might. At this the robber ran\n back as fast as he could to his comrades, and told the captain how a\n horrid witch had got into the house, and had spat at him and scratched his\n face with her long bony fingers; how a man with a knife in his hand had\n hidden himself behind the door, and stabbed him in the leg; how a black\n monster stood in the yard and struck him with a club, and how the devil\n had sat upon the top of the house and cried out, ‘Throw the rascal up\n here!’ After this the robbers never dared to go back to the house; but the\n musicians were so pleased with their quarters that they took up their\n abode there; and there they are, I dare say, at this very day.', 'THE GOLDEN BIRD\n\nA certain king had a beautiful garden, and in the garden stood a tree\n which bore golden apples. These apples were always counted, and about the\n time when they began to grow ripe it was found that every night one of\n them was gone. The king became very angry at this, and ordered the\n gardener to keep watch all night under the tree. The gardener set his\n eldest son to watch; but about twelve o’clock he fell asleep, and in the\n morning another of the apples was missing. Then the second son was ordered\n to watch; and at midnight he too fell asleep, and in the morning another\n apple was gone. Then the third son offered to keep watch; but the gardener\n at first would not let him, for fear some harm should come to him:\n however, at last he consented, and the young man laid himself under the\n tree to watch. As the clock struck twelve he heard a rustling noise in the\n air, and a bird came flying that was of pure gold; and as it was snapping\n at one of the apples with its beak, the gardener’s son jumped up and shot\n an arrow at it. But the arrow did the bird no harm; only it dropped a\n golden feather from its tail, and then flew away. The golden feather was\n brought to the king in the morning, and all the council was called\n together. Everyone agreed that it was worth more than all the wealth of\n the kingdom: but the king said, ‘One feather is of no use to me, I must\n have the whole bird.’\nThen the gardener’s eldest son set out and thought to find the golden bird\n very easily; and when he had gone but a little way, he came to a wood, and\n by the side of the wood he saw a fox sitting; so he took his bow and made\n ready to shoot at it. Then the fox said, ‘Do not shoot me, for I will give\n you good counsel; I know what your business is, and that you want to find\n the golden bird. You will reach a village in the evening; and when you get\n there, you will see two inns opposite to each other, one of which is very\n pleasant and beautiful to look at: go not in there, but rest for the night\n in the other, though it may appear to you to be very poor and mean.’ But\n the son thought to himself, ‘What can such a beast as this know about the\n matter?’ So he shot his arrow at the fox; but he missed it, and it set up\n its tail above its back and ran into the wood. Then he went his way, and\n in the evening came to the village where the two inns were; and in one of\n these were people singing, and dancing, and feasting; but the other looked\n very dirty, and poor. ‘I should be very silly,’ said he, ‘if I went to\n that shabby house, and left this charming place’; so he went into the\n smart house, and ate and drank at his ease, and forgot the bird, and his\n country too.\nTime passed on; and as the eldest son did not come back, and no tidings\n were heard of him, the second son set out, and the same thing happened to\n him. He met the fox, who gave him the good advice: but when he came to the\n two inns, his eldest brother was standing at the window where the\n merrymaking was, and called to him to come in; and he could not withstand\n the temptation, but went in, and forgot the golden bird and his country in\n the same manner.\nTime passed on again, and the youngest son too wished to set out into the\n wide world to seek for the golden bird; but his father would not listen to\n it for a long while, for he was very fond of his son, and was afraid that\n some ill luck might happen to him also, and prevent his coming back.\n However, at last it was agreed he should go, for he would not rest at\n home; and as he came to the wood, he met the fox, and heard the same good\n counsel. But he was thankful to the fox, and did not attempt his life as\n his brothers had done; so the fox said, ‘Sit upon my tail, and you will\n travel faster.’ So he sat down, and the fox began to run, and away they\n went over stock and stone so quick that their hair whistled in the wind.\nWhen they came to the village, the son followed the fox’s counsel, and\n without looking about him went to the shabby inn and rested there all\n night at his ease. In the morning came the fox again and met him as he was\n beginning his journey, and said, ‘Go straight forward, till you come to a\n castle, before which lie a whole troop of soldiers fast asleep and\n snoring: take no notice of them, but go into the castle and pass on and on\n till you come to a room, where the golden bird sits in a wooden cage;\n close by it stands a beautiful golden cage; but do not try to take the\n bird out of the shabby cage and put it into the handsome one, otherwise\n you will repent it.’ Then the fox stretched out his tail again, and the\n young man sat himself down, and away they went over stock and stone till\n their hair whistled in the wind.\nBefore the castle gate all was as the fox had said: so the son went in and\n found the chamber where the golden bird hung in a wooden cage, and below\n stood the golden cage, and the three golden apples that had been lost were\n lying close by it. Then thought he to himself, ‘It will be a very droll\n thing to bring away such a fine bird in this shabby cage’; so he opened\n the door and took hold of it and put it into the golden cage. But the bird\n set up such a loud scream that all the soldiers awoke, and they took him\n prisoner and carried him before the king. The next morning the court sat\n to judge him; and when all was heard, it sentenced him to die, unless he\n should bring the king the golden horse which could run as swiftly as the\n wind; and if he did this, he was to have the golden bird given him for his\n own.\nSo he set out once more on his journey, sighing, and in great despair,\n when on a sudden his friend the fox met him, and said, ‘You see now what\n has happened on account of your not listening to my counsel. I will still,\n however, tell you how to find the golden horse, if you will do as I bid\n you. You must go straight on till you come to the castle where the horse\n stands in his stall: by his side will lie the groom fast asleep and\n snoring: take away the horse quietly, but be sure to put the old leathern\n saddle upon him, and not the golden one that is close by it.’ Then the son\n sat down on the fox’s tail, and away they went over stock and stone till\n their hair whistled in the wind.\nAll went right, and the groom lay snoring with his hand upon the golden\n saddle. But when the son looked at the horse, he thought it a great pity\n to put the leathern saddle upon it. ‘I will give him the good one,’ said\n he; ‘I am sure he deserves it.’ As he took up the golden saddle the groom\n awoke and cried out so loud, that all the guards ran in and took him\n prisoner, and in the morning he was again brought before the court to be\n judged, and was sentenced to die. But it was agreed, that, if he could\n bring thither the beautiful princess, he should live, and have the bird\n and the horse given him for his own.\nThen he went his way very sorrowful; but the old fox came and said, ‘Why\n did not you listen to me? If you had, you would have carried away both the\n bird and the horse; yet will I once more give you counsel. Go straight on,\n and in the evening you will arrive at a castle. At twelve o’clock at night\n the princess goes to the bathing-house: go up to her and give her a kiss,\n and she will let you lead her away; but take care you do not suffer her to\n go and take leave of her father and mother.’ Then the fox stretched out\n his tail, and so away they went over stock and stone till their hair\n whistled again.\nAs they came to the castle, all was as the fox had said, and at twelve\n o’clock the young man met the princess going to the bath and gave her the\n kiss, and she agreed to run away with him, but begged with many tears that\n he would let her take leave of her father. At first he refused, but she\n wept still more and more, and fell at his feet, till at last he consented;\n but the moment she came to her father’s house the guards awoke and he was\n taken prisoner again.\nThen he was brought before the king, and the king said, ‘You shall never\n have my daughter unless in eight days you dig away the hill that stops the\n view from my window.’ Now this hill was so big that the whole world could\n not take it away: and when he had worked for seven days, and had done very\n little, the fox came and said. ‘Lie down and go to sleep; I will work for\n you.’ And in the morning he awoke and the hill was gone; so he went\n merrily to the king, and told him that now that it was removed he must\n give him the princess.\nThen the king was obliged to keep his word, and away went the young man\n and the princess; and the fox came and said to him, ‘We will have all\n three, the princess, the horse, and the bird.’ ‘Ah!’ said the young man,\n ‘that would be a great thing, but how can you contrive it?’\n‘If you will only listen,’ said the fox, ‘it can be done. When you come to\n the king, and he asks for the beautiful princess, you must say, “Here she\n is!” Then he will be very joyful; and you will mount the golden horse that\n they are to give you, and put out your hand to take leave of them; but\n shake hands with the princess last. Then lift her quickly on to the horse\n behind you; clap your spurs to his side, and gallop away as fast as you\n can.’\nAll went right: then the fox said, ‘When you come to the castle where the\n bird is, I will stay with the princess at the door, and you will ride in\n and speak to the king; and when he sees that it is the right horse, he\n will bring out the bird; but you must sit still, and say that you want to\n look at it, to see whether it is the true golden bird; and when you get it\n into your hand, ride away.’\nThis, too, happened as the fox said; they carried off the bird, the\n princess mounted again, and they rode on to a great wood. Then the fox\n came, and said, ‘Pray kill me, and cut off my head and my feet.’ But the\n young man refused to do it: so the fox said, ‘I will at any rate give you\n good counsel: beware of two things; ransom no one from the gallows, and\n sit down by the side of no river.’ Then away he went. ‘Well,’ thought the\n young man, ‘it is no hard matter to keep that advice.’\nHe rode on with the princess, till at last he came to the village where he\n had left his two brothers. And there he heard a great noise and uproar;\n and when he asked what was the matter, the people said, ‘Two men are going\n to be hanged.’ As he came nearer, he saw that the two men were his\n brothers, who had turned robbers; so he said, ‘Cannot they in any way be\n saved?’ But the people said ‘No,’ unless he would bestow all his money\n upon the rascals and buy their liberty. Then he did not stay to think\n about the matter, but paid what was asked, and his brothers were given up,\n and went on with him towards their home.\nAnd as they came to the wood where the fox first met them, it was so cool\n and pleasant that the two brothers said, ‘Let us sit down by the side of\n the river, and rest a while, to eat and drink.’ So he said, ‘Yes,’ and\n forgot the fox’s counsel, and sat down on the side of the river; and while\n he suspected nothing, they came behind, and threw him down the bank, and\n took the princess, the horse, and the bird, and went home to the king\n their master, and said. ‘All this have we won by our labour.’ Then there\n was great rejoicing made; but the horse would not eat, the bird would not\n sing, and the princess wept.\nThe youngest son fell to the bottom of the river’s bed: luckily it was\n nearly dry, but his bones were almost broken, and the bank was so steep\n that he could find no way to get out. Then the old fox came once more, and\n scolded him for not following his advice; otherwise no evil would have\n befallen him: ‘Yet,’ said he, ‘I cannot leave you here, so lay hold of my\n tail and hold fast.’ Then he pulled him out of the river, and said to him,\n as he got upon the bank, ‘Your brothers have set watch to kill you, if\n they find you in the kingdom.’ So he dressed himself as a poor man, and\n came secretly to the king’s court, and was scarcely within the doors when\n the horse began to eat, and the bird to sing, and the princess left off\n weeping. Then he went to the king, and told him all his brothers’ roguery;\n and they were seized and punished, and he had the princess given to him\n again; and after the king’s death he was heir to his kingdom.\nA long while after, he went to walk one day in the wood, and the old fox\n met him, and besought him with tears in his eyes to kill him, and cut off\n his head and feet. And at last he did so, and in a moment the fox was\n changed into a man, and turned out to be the brother of the princess, who\n had been lost a great many many years.']",Chanticleer is a rooster (the male chicken) and Partlet’s husband.,"Chanticleer is the cock who joins the ass, dog, and cat on their journey to the great city after his mistress threatens to cut off his head and make broth of him for the guests.",1.0,0.6666666666666666,0.4
wut did the shepherd do to sultan?,"['OLD SULTAN\n\nA shepherd had a faithful dog, called Sultan, who was grown very old, and\n had lost all his teeth. And one day when the shepherd and his wife were\n standing together before the house the shepherd said, ‘I will shoot old\n Sultan tomorrow morning, for he is of no use now.’ But his wife said,\n ‘Pray let the poor faithful creature live; he has served us well a great\n many years, and we ought to give him a livelihood for the rest of his\n days.’ ‘But what can we do with him?’ said the shepherd, ‘he has not a\n tooth in his head, and the thieves don’t care for him at all; to be sure\n he has served us, but then he did it to earn his livelihood; tomorrow\n shall be his last day, depend upon it.’\nPoor Sultan, who was lying close by them, heard all that the shepherd and\n his wife said to one another, and was very much frightened to think\n tomorrow would be his last day; so in the evening he went to his good\n friend the wolf, who lived in the wood, and told him all his sorrows, and\n how his master meant to kill him in the morning. ‘Make yourself easy,’\n said the wolf, ‘I will give you some good advice. Your master, you know,\n goes out every morning very early with his wife into the field; and they\n take their little child with them, and lay it down behind the hedge in the\n shade while they are at work. Now do you lie down close by the child, and\n pretend to be watching it, and I will come out of the wood and run away\n with it; you must run after me as fast as you can, and I will let it drop;\n then you may carry it back, and they will think you have saved their\n child, and will be so thankful to you that they will take care of you as\n long as you live.’ The dog liked this plan very well; and accordingly so\n it was managed. The wolf ran with the child a little way; the shepherd and\n his wife screamed out; but Sultan soon overtook him, and carried the poor\n little thing back to his master and mistress. Then the shepherd patted him\n on the head, and said, ‘Old Sultan has saved our child from the wolf, and\n therefore he shall live and be well taken care of, and have plenty to eat.\n Wife, go home, and give him a good dinner, and let him have my old cushion\n to sleep on as long as he lives.’ So from this time forward Sultan had all\n that he could wish for.\nSoon afterwards the wolf came and wished him joy, and said, ‘Now, my good\n fellow, you must tell no tales, but turn your head the other way when I\n want to taste one of the old shepherd’s fine fat sheep.’ ‘No,’ said the\n Sultan; ‘I will be true to my master.’ However, the wolf thought he was in\n joke, and came one night to get a dainty morsel. But Sultan had told his\n master what the wolf meant to do; so he laid wait for him behind the barn\n door, and when the wolf was busy looking out for a good fat sheep, he had\n a stout cudgel laid about his back, that combed his locks for him finely.\nThen the wolf was very angry, and called Sultan ‘an old rogue,’ and swore\n he would have his revenge. So the next morning the wolf sent the boar to\n challenge Sultan to come into the wood to fight the matter. Now Sultan had\n nobody he could ask to be his second but the shepherd’s old three-legged\n cat; so he took her with him, and as the poor thing limped along with some\n trouble, she stuck up her tail straight in the air.\nThe wolf and the wild boar were first on the ground; and when they espied\n their enemies coming, and saw the cat’s long tail standing straight in the\n air, they thought she was carrying a sword for Sultan to fight with; and\n every time she limped, they thought she was picking up a stone to throw at\n them; so they said they should not like this way of fighting, and the boar\n lay down behind a bush, and the wolf jumped up into a tree. Sultan and the\n cat soon came up, and looked about and wondered that no one was there. The\n boar, however, had not quite hidden himself, for his ears stuck out of the\n bush; and when he shook one of them a little, the cat, seeing something\n move, and thinking it was a mouse, sprang upon it, and bit and scratched\n it, so that the boar jumped up and grunted, and ran away, roaring out,\n ‘Look up in the tree, there sits the one who is to blame.’ So they looked\n up, and espied the wolf sitting amongst the branches; and they called him\n a cowardly rascal, and would not suffer him to come down till he was\n heartily ashamed of himself, and had promised to be good friends again\n with old Sultan.', 'THE SALAD\n\nAs a merry young huntsman was once going briskly along through a wood,\n there came up a little old woman, and said to him, ‘Good day, good day;\n you seem merry enough, but I am hungry and thirsty; do pray give me\n something to eat.’ The huntsman took pity on her, and put his hand in his\n pocket and gave her what he had. Then he wanted to go his way; but she\n took hold of him, and said, ‘Listen, my friend, to what I am going to tell\n you; I will reward you for your kindness; go your way, and after a little\n time you will come to a tree where you will see nine birds sitting on a\n cloak. Shoot into the midst of them, and one will fall down dead: the\n cloak will fall too; take it, it is a wishing-cloak, and when you wear it\n you will find yourself at any place where you may wish to be. Cut open the\n dead bird, take out its heart and keep it, and you will find a piece of\n gold under your pillow every morning when you rise. It is the bird’s heart\n that will bring you this good luck.’\nThe huntsman thanked her, and thought to himself, ‘If all this does\n happen, it will be a fine thing for me.’ When he had gone a hundred steps\n or so, he heard a screaming and chirping in the branches over him, and\n looked up and saw a flock of birds pulling a cloak with their bills and\n feet; screaming, fighting, and tugging at each other as if each wished to\n have it himself. ‘Well,’ said the huntsman, ‘this is wonderful; this\n happens just as the old woman said’; then he shot into the midst of them\n so that their feathers flew all about. Off went the flock chattering away;\n but one fell down dead, and the cloak with it. Then the huntsman did as\n the old woman told him, cut open the bird, took out the heart, and carried\n the cloak home with him.\nThe next morning when he awoke he lifted up his pillow, and there lay the\n piece of gold glittering underneath; the same happened next day, and\n indeed every day when he arose. He heaped up a great deal of gold, and at\n last thought to himself, ‘Of what use is this gold to me whilst I am at\n home? I will go out into the world and look about me.’\nThen he took leave of his friends, and hung his bag and bow about his\n neck, and went his way. It so happened that his road one day led through a\n thick wood, at the end of which was a large castle in a green meadow, and\n at one of the windows stood an old woman with a very beautiful young lady\n by her side looking about them. Now the old woman was a witch, and said to\n the young lady, ‘There is a young man coming out of the wood who carries a\n wonderful prize; we must get it away from him, my dear child, for it is\n more fit for us than for him. He has a bird’s heart that brings a piece of\n gold under his pillow every morning.’ Meantime the huntsman came nearer\n and looked at the lady, and said to himself, ‘I have been travelling so\n long that I should like to go into this castle and rest myself, for I have\n money enough to pay for anything I want’; but the real reason was, that he\n wanted to see more of the beautiful lady. Then he went into the house, and\n was welcomed kindly; and it was not long before he was so much in love\n that he thought of nothing else but looking at the lady’s eyes, and doing\n everything that she wished. Then the old woman said, ‘Now is the time for\n getting the bird’s heart.’ So the lady stole it away, and he never found\n any more gold under his pillow, for it lay now under the young lady’s, and\n the old woman took it away every morning; but he was so much in love that\n he never missed his prize.\n‘Well,’ said the old witch, ‘we have got the bird’s heart, but not the\n wishing-cloak yet, and that we must also get.’ ‘Let us leave him that,’\n said the young lady; ‘he has already lost his wealth.’ Then the witch was\n very angry, and said, ‘Such a cloak is a very rare and wonderful thing,\n and I must and will have it.’ So she did as the old woman told her, and\n set herself at the window, and looked about the country and seemed very\n sorrowful; then the huntsman said, ‘What makes you so sad?’ ‘Alas! dear\n sir,’ said she, ‘yonder lies the granite rock where all the costly\n diamonds grow, and I want so much to go there, that whenever I think of it\n I cannot help being sorrowful, for who can reach it? only the birds and\n the flies—man cannot.’ ‘If that’s all your grief,’ said the\n huntsman, ‘I’ll take you there with all my heart’; so he drew her under his\n cloak, and the moment he wished to be on the granite mountain they were\n both there. The diamonds glittered so on all sides that they were\n delighted with the sight and picked up the finest. But the old witch made\n a deep sleep come upon him, and he said to the young lady, ‘Let us sit\n down and rest ourselves a little, I am so tired that I cannot stand any\n longer.’ So they sat down, and he laid his head in her lap and fell\n asleep; and whilst he was sleeping on she took the cloak from his\n shoulders, hung it on her own, picked up the diamonds, and wished herself\n home again.\nWhen he awoke and found that his lady had tricked him, and left him alone\n on the wild rock, he said, ‘Alas! what roguery there is in the world!’ and\n there he sat in great grief and fear, not knowing what to do. Now this\n rock belonged to fierce giants who lived upon it; and as he saw three of\n them striding about, he thought to himself, ‘I can only save myself by\n feigning to be asleep’; so he laid himself down as if he were in a sound\n sleep. When the giants came up to him, the first pushed him with his foot,\n and said, ‘What worm is this that lies here curled up?’ ‘Tread upon him\n and kill him,’ said the second. ‘It’s not worth the trouble,’ said the\n third; ‘let him live, he’ll go climbing higher up the mountain, and some\n cloud will come rolling and carry him away.’ And they passed on. But the\n huntsman had heard all they said; and as soon as they were gone, he\n climbed to the top of the mountain, and when he had sat there a short time\n a cloud came rolling around him, and caught him in a whirlwind and bore\n him along for some time, till it settled in a garden, and he fell quite\n gently to the ground amongst the greens and cabbages.\nThen he looked around him, and said, ‘I wish I had something to eat, if\n not I shall be worse off than before; for here I see neither apples nor\n pears, nor any kind of fruits, nothing but vegetables.’ At last he thought\n to himself, ‘I can eat salad, it will refresh and strengthen me.’ So he\n picked out a fine head and ate of it; but scarcely had he swallowed two\n bites when he felt himself quite changed, and saw with horror that he was\n turned into an ass. However, he still felt very hungry, and the salad\n tasted very nice; so he ate on till he came to another kind of salad, and\n scarcely had he tasted it when he felt another change come over him, and\n soon saw that he was lucky enough to have found his old shape again.\nThen he laid himself down and slept off a little of his weariness; and\n when he awoke the next morning he broke off a head both of the good and\n the bad salad, and thought to himself, ‘This will help me to my fortune\n again, and enable me to pay off some folks for their treachery.’ So he\n went away to try and find the castle of his friends; and after wandering\n about a few days he luckily found it. Then he stained his face all over\n brown, so that even his mother would not have known him, and went into the\n castle and asked for a lodging; ‘I am so tired,’ said he, ‘that I can go\n no farther.’ ‘Countryman,’ said the witch, ‘who are you? and what is your\n business?’ ‘I am,’ said he, ‘a messenger sent by the king to find the\n finest salad that grows under the sun. I have been lucky enough to find\n it, and have brought it with me; but the heat of the sun scorches so that\n it begins to wither, and I don’t know that I can carry it farther.’\nWhen the witch and the young lady heard of his beautiful salad, they\n longed to taste it, and said, ‘Dear countryman, let us just taste it.’ ‘To\n be sure,’ answered he; ‘I have two heads of it with me, and will give you\n one’; so he opened his bag and gave them the bad. Then the witch herself\n took it into the kitchen to be dressed; and when it was ready she could\n not wait till it was carried up, but took a few leaves immediately and put\n them in her mouth, and scarcely were they swallowed when she lost her own\n form and ran braying down into the court in the form of an ass. Now the\n servant-maid came into the kitchen, and seeing the salad ready, was going\n to carry it up; but on the way she too felt a wish to taste it as the old\n woman had done, and ate some leaves; so she also was turned into an ass\n and ran after the other, letting the dish with the salad fall on the\n ground. The messenger sat all this time with the beautiful young lady, and\n as nobody came with the salad and she longed to taste it, she said, ‘I\n don’t know where the salad can be.’ Then he thought something must have\n happened, and said, ‘I will go into the kitchen and see.’ And as he went\n he saw two asses in the court running about, and the salad lying on the\n ground. ‘All right!’ said he; ‘those two have had their share.’ Then he\n took up the rest of the leaves, laid them on the dish and brought them to\n the young lady, saying, ‘I bring you the dish myself that you may not wait\n any longer.’ So she ate of it, and like the others ran off into the court\n braying away.\nThen the huntsman washed his face and went into the court that they might\n know him. ‘Now you shall be paid for your roguery,’ said he; and tied them\n all three to a rope and took them along with him till he came to a mill\n and knocked at the window. ‘What’s the matter?’ said the miller. ‘I have\n three tiresome beasts here,’ said the other; ‘if you will take them, give\n them food and room, and treat them as I tell you, I will pay you whatever\n you ask.’ ‘With all my heart,’ said the miller; ‘but how shall I treat\n them?’ Then the huntsman said, ‘Give the old one stripes three times a day\n and hay once; give the next (who was the servant-maid) stripes once a day\n and hay three times; and give the youngest (who was the beautiful lady)\n hay three times a day and no stripes’: for he could not find it in his\n heart to have her beaten. After this he went back to the castle, where he\n found everything he wanted.\nSome days after, the miller came to him and told him that the old ass was\n dead; ‘The other two,’ said he, ‘are alive and eat, but are so sorrowful\n that they cannot last long.’ Then the huntsman pitied them, and told the\n miller to drive them back to him, and when they came, he gave them some of\n the good salad to eat. And the beautiful young lady fell upon her knees\n before him, and said, ‘O dearest huntsman! forgive me all the ill I have\n done you; my mother forced me to it, it was against my will, for I always\n loved you very much. Your wishing-cloak hangs up in the closet, and as for\n the bird’s heart, I will give it you too.’ But he said, ‘Keep it, it will\n be just the same thing, for I mean to make you my wife.’ So they were\n married, and lived together very happily till they died.', 'THE TWELVE HUNTSMEN\n\nThere was once a king’s son who had a bride whom he loved very much. And\n when he was sitting beside her and very happy, news came that his father\n lay sick unto death, and desired to see him once again before his end.\n Then he said to his beloved: ‘I must now go and leave you, I give you a\n ring as a remembrance of me. When I am king, I will return and fetch you.’\n So he rode away, and when he reached his father, the latter was\n dangerously ill, and near his death. He said to him: ‘Dear son, I wished\n to see you once again before my end, promise me to marry as I wish,’ and\n he named a certain king’s daughter who was to be his wife. The son was in\n such trouble that he did not think what he was doing, and said: ‘Yes, dear\n father, your will shall be done,’ and thereupon the king shut his eyes,\n and died.\nWhen therefore the son had been proclaimed king, and the time of mourning\n was over, he was forced to keep the promise which he had given his father,\n and caused the king’s daughter to be asked in marriage, and she was\n promised to him. His first betrothed heard of this, and fretted so much\n about his faithfulness that she nearly died. Then her father said to her:\n ‘Dearest child, why are you so sad? You shall have whatsoever you will.’\n She thought for a moment and said: ‘Dear father, I wish for eleven girls\n exactly like myself in face, figure, and size.’ The father said: ‘If it be\n possible, your desire shall be fulfilled,’ and he caused a search to be\n made in his whole kingdom, until eleven young maidens were found who\n exactly resembled his daughter in face, figure, and size.\nWhen they came to the king’s daughter, she had twelve suits of huntsmen’s\n clothes made, all alike, and the eleven maidens had to put on the\n huntsmen’s clothes, and she herself put on the twelfth suit. Thereupon she\n took her leave of her father, and rode away with them, and rode to the\n court of her former betrothed, whom she loved so dearly. Then she asked if\n he required any huntsmen, and if he would take all of them into his\n service. The king looked at her and did not know her, but as they were\n such handsome fellows, he said: ‘Yes,’ and that he would willingly take\n them, and now they were the king’s twelve huntsmen.\nThe king, however, had a lion which was a wondrous animal, for he knew all\n concealed and secret things. It came to pass that one evening he said to\n the king: ‘You think you have twelve huntsmen?’ ‘Yes,’ said the king,\n ‘they are twelve huntsmen.’ The lion continued: ‘You are mistaken, they\n are twelve girls.’ The king said: ‘That cannot be true! How will you prove\n that to me?’ ‘Oh, just let some peas be strewn in the ante-chamber,’\n answered the lion, ‘and then you will soon see. Men have a firm step, and\n when they walk over peas none of them stir, but girls trip and skip, and\n drag their feet, and the peas roll about.’ The king was well pleased with\n the counsel, and caused the peas to be strewn.\nThere was, however, a servant of the king’s who favoured the huntsmen, and\n when he heard that they were going to be put to this test he went to them\n and repeated everything, and said: ‘The lion wants to make the king\n believe that you are girls.’ Then the king’s daughter thanked him, and\n said to her maidens: ‘Show some strength, and step firmly on the peas.’ So\n next morning when the king had the twelve huntsmen called before him, and\n they came into the ante-chamber where the peas were lying, they stepped so\n firmly on them, and had such a strong, sure walk, that not one of the peas\n either rolled or stirred. Then they went away again, and the king said to\n the lion: ‘You have lied to me, they walk just like men.’ The lion said:\n ‘They have been informed that they were going to be put to the test, and\n have assumed some strength. Just let twelve spinning-wheels be brought\n into the ante-chamber, and they will go to them and be pleased with them,\n and that is what no man would do.’ The king liked the advice, and had the\n spinning-wheels placed in the ante-chamber.\nBut the servant, who was well disposed to the huntsmen, went to them, and\n disclosed the project. So when they were alone the king’s daughter said to\n her eleven girls: ‘Show some constraint, and do not look round at the\n spinning-wheels.’ And next morning when the king had his twelve huntsmen\n summoned, they went through the ante-chamber, and never once looked at the\n spinning-wheels. Then the king again said to the lion: ‘You have deceived\n me, they are men, for they have not looked at the spinning-wheels.’ The\n lion replied: ‘They have restrained themselves.’ The king, however, would\n no longer believe the lion.\nThe twelve huntsmen always followed the king to the chase, and his liking\n for them continually increased. Now it came to pass that once when they\n were out hunting, news came that the king’s bride was approaching. When\n the true bride heard that, it hurt her so much that her heart was almost\n broken, and she fell fainting to the ground. The king thought something\n had happened to his dear huntsman, ran up to him, wanted to help him, and\n drew his glove off. Then he saw the ring which he had given to his first\n bride, and when he looked in her face he recognized her. Then his heart\n was so touched that he kissed her, and when she opened her eyes he said:\n ‘You are mine, and I am yours, and no one in the world can alter that.’ He\n sent a messenger to the other bride, and entreated her to return to her\n own kingdom, for he had a wife already, and someone who had just found an\n old key did not require a new one. Thereupon the wedding was celebrated,\n and the lion was again taken into favour, because, after all, he had told\n the truth.']",He planned to shoot Old Sultan the next morning.,"The shepherd said he would shoot old Sultan in the morning because he was of no use now, but after Sultan saved their child from the wolf, the shepherd decided that Sultan should live, be well taken care of, have plenty to eat, and sleep on his old cushion as long as he lived.",1.0,1.0,0.22
"How does the brook influence the journey of the straw, coal, and bean in the story?","['THE STRAW, THE COAL, AND THE BEAN\n\nIn a village dwelt a poor old woman, who had gathered together a dish of\n beans and wanted to cook them. So she made a fire on her hearth, and that\n it might burn the quicker, she lighted it with a handful of straw. When\n she was emptying the beans into the pan, one dropped without her observing\n it, and lay on the ground beside a straw, and soon afterwards a burning\n coal from the fire leapt down to the two. Then the straw began and said:\n ‘Dear friends, from whence do you come here?’ The coal replied: ‘I\n fortunately sprang out of the fire, and if I had not escaped by sheer\n force, my death would have been certain,—I should have been burnt to\n ashes.’ The bean said: ‘I too have escaped with a whole skin, but if the\n old woman had got me into the pan, I should have been made into broth\n without any mercy, like my comrades.’ ‘And would a better fate have fallen\n to my lot?’ said the straw. ‘The old woman has destroyed all my brethren\n in fire and smoke; she seized sixty of them at once, and took their lives.\n I luckily slipped through her fingers.’\n‘But what are we to do now?’ said the coal.\n‘I think,’ answered the bean, ‘that as we have so fortunately escaped\n death, we should keep together like good companions, and lest a new\n mischance should overtake us here, we should go away together, and repair\n to a foreign country.’\nThe proposition pleased the two others, and they set out on their way\n together. Soon, however, they came to a little brook, and as there was no\n bridge or foot-plank, they did not know how they were to get over it. The\n straw hit on a good idea, and said: ‘I will lay myself straight across,\n and then you can walk over on me as on a bridge.’ The straw therefore\n stretched itself from one bank to the other, and the coal, who was of an\n impetuous disposition, tripped quite boldly on to the newly-built bridge.\n But when she had reached the middle, and heard the water rushing beneath\n her, she was after all, afraid, and stood still, and ventured no farther.\n The straw, however, began to burn, broke in two pieces, and fell into the\n stream. The coal slipped after her, hissed when she got into the water,\n and breathed her last. The bean, who had prudently stayed behind on the\n shore, could not but laugh at the event, was unable to stop, and laughed\n so heartily that she burst. It would have been all over with her,\n likewise, if, by good fortune, a tailor who was travelling in search of\n work, had not sat down to rest by the brook. As he had a compassionate\n heart he pulled out his needle and thread, and sewed her together. The\n bean thanked him most prettily, but as the tailor used black thread, all\n beans since then have a black seam.', 'THE LITTLE PEASANT\n\nThere was a certain village wherein no one lived but really rich peasants,\n and just one poor one, whom they called the little peasant. He had not\n even so much as a cow, and still less money to buy one, and yet he and his\n wife did so wish to have one. One day he said to her: ‘Listen, I have a\n good idea, there is our gossip the carpenter, he shall make us a wooden\n calf, and paint it brown, so that it looks like any other, and in time it\n will certainly get big and be a cow.’ the woman also liked the idea, and\n their gossip the carpenter cut and planed the calf, and painted it as it\n ought to be, and made it with its head hanging down as if it were eating.\nNext morning when the cows were being driven out, the little peasant\n called the cow-herd in and said: ‘Look, I have a little calf there, but it\n is still small and has to be carried.’ The cow-herd said: ‘All right,’ and\n took it in his arms and carried it to the pasture, and set it among the\n grass. The little calf always remained standing like one which was eating,\n and the cow-herd said: ‘It will soon run by itself, just look how it eats\n already!’ At night when he was going to drive the herd home again, he said\n to the calf: ‘If you can stand there and eat your fill, you can also go on\n your four legs; I don’t care to drag you home again in my arms.’ But the\n little peasant stood at his door, and waited for his little calf, and when\n the cow-herd drove the cows through the village, and the calf was missing,\n he inquired where it was. The cow-herd answered: ‘It is still standing out\n there eating. It would not stop and come with us.’ But the little peasant\n said: ‘Oh, but I must have my beast back again.’ Then they went back to\n the meadow together, but someone had stolen the calf, and it was gone. The\n cow-herd said: ‘It must have run away.’ The peasant, however, said: ‘Don’t\n tell me that,’ and led the cow-herd before the mayor, who for his\n carelessness condemned him to give the peasant a cow for the calf which\n had run away.\nAnd now the little peasant and his wife had the cow for which they had so\n long wished, and they were heartily glad, but they had no food for it, and\n could give it nothing to eat, so it soon had to be killed. They salted the\n flesh, and the peasant went into the town and wanted to sell the skin\n there, so that he might buy a new calf with the proceeds. On the way he\n passed by a mill, and there sat a raven with broken wings, and out of pity\n he took him and wrapped him in the skin. But as the weather grew so bad\n and there was a storm of rain and wind, he could go no farther, and turned\n back to the mill and begged for shelter. The miller’s wife was alone in\n the house, and said to the peasant: ‘Lay yourself on the straw there,’ and\n gave him a slice of bread and cheese. The peasant ate it, and lay down\n with his skin beside him, and the woman thought: ‘He is tired and has gone\n to sleep.’ In the meantime came the parson; the miller’s wife received him\n well, and said: ‘My husband is out, so we will have a feast.’ The peasant\n listened, and when he heard them talk about feasting he was vexed that he\n had been forced to make shift with a slice of bread and cheese. Then the\n woman served up four different things, roast meat, salad, cakes, and wine.\nJust as they were about to sit down and eat, there was a knocking outside.\n The woman said: ‘Oh, heavens! It is my husband!’ she quickly hid the roast\n meat inside the tiled stove, the wine under the pillow, the salad on the\n bed, the cakes under it, and the parson in the closet on the porch. Then\n she opened the door for her husband, and said: ‘Thank heaven, you are back\n again! There is such a storm, it looks as if the world were coming to an\n end.’ The miller saw the peasant lying on the straw, and asked, ‘What is\n that fellow doing there?’ ‘Ah,’ said the wife, ‘the poor knave came in the\n storm and rain, and begged for shelter, so I gave him a bit of bread and\n cheese, and showed him where the straw was.’ The man said: ‘I have no\n objection, but be quick and get me something to eat.’ The woman said: ‘But\n I have nothing but bread and cheese.’ ‘I am contented with anything,’\n replied the husband, ‘so far as I am concerned, bread and cheese will do,’\n and looked at the peasant and said: ‘Come and eat some more with me.’ The\n peasant did not require to be invited twice, but got up and ate. After\n this the miller saw the skin in which the raven was, lying on the ground,\n and asked: ‘What have you there?’ The peasant answered: ‘I have a\n soothsayer inside it.’ ‘Can he foretell anything to me?’ said the miller.\n ‘Why not?’ answered the peasant: ‘but he only says four things, and the\n fifth he keeps to himself.’ The miller was curious, and said: ‘Let him\n foretell something for once.’ Then the peasant pinched the raven’s head,\n so that he croaked and made a noise like krr, krr. The miller said: ‘What\n did he say?’ The peasant answered: ‘In the first place, he says that there\n is some wine hidden under the pillow.’ ‘Bless me!’ cried the miller, and\n went there and found the wine. ‘Now go on,’ said he. The peasant made the\n raven croak again, and said: ‘In the second place, he says that there is\n some roast meat in the tiled stove.’ ‘Upon my word!’ cried the miller, and\n went thither, and found the roast meat. The peasant made the raven\n prophesy still more, and said: ‘Thirdly, he says that there is some salad\n on the bed.’ ‘That would be a fine thing!’ cried the miller, and went\n there and found the salad. At last the peasant pinched the raven once more\n till he croaked, and said: ‘Fourthly, he says that there are some cakes\n under the bed.’ ‘That would be a fine thing!’ cried the miller, and looked\n there, and found the cakes.\nAnd now the two sat down to the table together, but the miller’s wife was\n frightened to death, and went to bed and took all the keys with her. The\n miller would have liked much to know the fifth, but the little peasant\n said: ‘First, we will quickly eat the four things, for the fifth is\n something bad.’ So they ate, and after that they bargained how much the\n miller was to give for the fifth prophecy, until they agreed on three\n hundred talers. Then the peasant once more pinched the raven’s head till\n he croaked loudly. The miller asked: ‘What did he say?’ The peasant\n replied: ‘He says that the Devil is hiding outside there in the closet on\n the porch.’ The miller said: ‘The Devil must go out,’ and opened the\n house-door; then the woman was forced to give up the keys, and the peasant\n unlocked the closet. The parson ran out as fast as he could, and the\n miller said: ‘It was true; I saw the black rascal with my own eyes.’ The\n peasant, however, made off next morning by daybreak with the three hundred\n talers.\nAt home the small peasant gradually launched out; he built a beautiful\n house, and the peasants said: ‘The small peasant has certainly been to the\n place where golden snow falls, and people carry the gold home in shovels.’\n Then the small peasant was brought before the mayor, and bidden to say\n from whence his wealth came. He answered: ‘I sold my cow’s skin in the\n town, for three hundred talers.’ When the peasants heard that, they too\n wished to enjoy this great profit, and ran home, killed all their cows,\n and stripped off their skins in order to sell them in the town to the\n greatest advantage. The mayor, however, said: ‘But my servant must go\n first.’ When she came to the merchant in the town, he did not give her\n more than two talers for a skin, and when the others came, he did not give\n them so much, and said: ‘What can I do with all these skins?’\nThen the peasants were vexed that the small peasant should have thus\n outwitted them, wanted to take vengeance on him, and accused him of this\n treachery before the mayor. The innocent little peasant was unanimously\n sentenced to death, and was to be rolled into the water, in a barrel\n pierced full of holes. He was led forth, and a priest was brought who was\n to say a mass for his soul. The others were all obliged to retire to a\n distance, and when the peasant looked at the priest, he recognized the man\n who had been with the miller’s wife. He said to him: ‘I set you free from\n the closet, set me free from the barrel.’ At this same moment up came,\n with a flock of sheep, the very shepherd whom the peasant knew had long\n been wishing to be mayor, so he cried with all his might: ‘No, I will not\n do it; if the whole world insists on it, I will not do it!’ The shepherd\n hearing that, came up to him, and asked: ‘What are you about? What is it\n that you will not do?’ The peasant said: ‘They want to make me mayor, if I\n will but put myself in the barrel, but I will not do it.’ The shepherd\n said: ‘If nothing more than that is needful in order to be mayor, I would\n get into the barrel at once.’ The peasant said: ‘If you will get in, you\n will be mayor.’ The shepherd was willing, and got in, and the peasant shut\n the top down on him; then he took the shepherd’s flock for himself, and\n drove it away. The parson went to the crowd, and declared that the mass\n had been said. Then they came and rolled the barrel towards the water.\n When the barrel began to roll, the shepherd cried: ‘I am quite willing to\n be mayor.’ They believed no otherwise than that it was the peasant who was\n saying this, and answered: ‘That is what we intend, but first you shall\n look about you a little down below there,’ and they rolled the barrel down\n into the water.\nAfter that the peasants went home, and as they were entering the village,\n the small peasant also came quietly in, driving a flock of sheep and\n looking quite contented. Then the peasants were astonished, and said:\n ‘Peasant, from whence do you come? Have you come out of the water?’ ‘Yes,\n truly,’ replied the peasant, ‘I sank deep, deep down, until at last I got\n to the bottom; I pushed the bottom out of the barrel, and crept out, and\n there were pretty meadows on which a number of lambs were feeding, and\n from thence I brought this flock away with me.’ Said the peasants: ‘Are\n there any more there?’ ‘Oh, yes,’ said he, ‘more than I could want.’ Then\n the peasants made up their minds that they too would fetch some sheep for\n themselves, a flock apiece, but the mayor said: ‘I come first.’ So they\n went to the water together, and just then there were some of the small\n fleecy clouds in the blue sky, which are called little lambs, and they\n were reflected in the water, whereupon the peasants cried: ‘We already see\n the sheep down below!’ The mayor pressed forward and said: ‘I will go down\n first, and look about me, and if things promise well I’ll call you.’ So he\n jumped in; splash! went the water; it sounded as if he were calling them,\n and the whole crowd plunged in after him as one man. Then the entire\n village was dead, and the small peasant, as sole heir, became a rich man.', 'THE TURNIP\n\nThere were two brothers who were both soldiers; the one was rich and the\n other poor. The poor man thought he would try to better himself; so,\n pulling off his red coat, he became a gardener, and dug his ground well,\n and sowed turnips.\nWhen the seed came up, there was one plant bigger than all the rest; and\n it kept getting larger and larger, and seemed as if it would never cease\n growing; so that it might have been called the prince of turnips for there\n never was such a one seen before, and never will again. At last it was so\n big that it filled a cart, and two oxen could hardly draw it; and the\n gardener knew not what in the world to do with it, nor whether it would be\n a blessing or a curse to him. One day he said to himself, ‘What shall I do\n with it? if I sell it, it will bring no more than another; and for eating,\n the little turnips are better than this; the best thing perhaps is to\n carry it and give it to the king as a mark of respect.’\nThen he yoked his oxen, and drew the turnip to the court, and gave it to\n the king. ‘What a wonderful thing!’ said the king; ‘I have seen many\n strange things, but such a monster as this I never saw. Where did you get\n the seed? or is it only your good luck? If so, you are a true child of\n fortune.’ ‘Ah, no!’ answered the gardener, ‘I am no child of fortune; I am\n a poor soldier, who never could get enough to live upon; so I laid aside\n my red coat, and set to work, tilling the ground. I have a brother, who is\n rich, and your majesty knows him well, and all the world knows him; but\n because I am poor, everybody forgets me.’\nThe king then took pity on him, and said, ‘You shall be poor no longer. I\n will give you so much that you shall be even richer than your brother.’\n Then he gave him gold and lands and flocks, and made him so rich that his\n brother’s fortune could not at all be compared with his.\nWhen the brother heard of all this, and how a turnip had made the gardener\n so rich, he envied him sorely, and bethought himself how he could contrive\n to get the same good fortune for himself. However, he determined to manage\n more cleverly than his brother, and got together a rich present of gold\n and fine horses for the king; and thought he must have a much larger gift\n in return; for if his brother had received so much for only a turnip, what\n must his present be worth?\nThe king took the gift very graciously, and said he knew not what to give\n in return more valuable and wonderful than the great turnip; so the\n soldier was forced to put it into a cart, and drag it home with him. When\n he reached home, he knew not upon whom to vent his rage and spite; and at\n length wicked thoughts came into his head, and he resolved to kill his\n brother.\nSo he hired some villains to murder him; and having shown them where to\n lie in ambush, he went to his brother, and said, ‘Dear brother, I have\n found a hidden treasure; let us go and dig it up, and share it between\n us.’ The other had no suspicions of his roguery: so they went out\n together, and as they were travelling along, the murderers rushed out upon\n him, bound him, and were going to hang him on a tree.\nBut whilst they were getting all ready, they heard the trampling of a\n horse at a distance, which so frightened them that they pushed their\n prisoner neck and shoulders together into a sack, and swung him up by a\n cord to the tree, where they left him dangling, and ran away. Meantime he\n worked and worked away, till he made a hole large enough to put out his\n head.\nWhen the horseman came up, he proved to be a student, a merry fellow, who\n was journeying along on his nag, and singing as he went. As soon as the\n man in the sack saw him passing under the tree, he cried out, ‘Good\n morning! good morning to thee, my friend!’ The student looked about\n everywhere; and seeing no one, and not knowing where the voice came from,\n cried out, ‘Who calls me?’\nThen the man in the tree answered, ‘Lift up thine eyes, for behold here I\n sit in the sack of wisdom; here have I, in a short time, learned great and\n wondrous things. Compared to this seat, all the learning of the schools is\n as empty air. A little longer, and I shall know all that man can know, and\n shall come forth wiser than the wisest of mankind. Here I discern the\n signs and motions of the heavens and the stars; the laws that control the\n winds; the number of the sands on the seashore; the healing of the sick;\n the virtues of all simples, of birds, and of precious stones. Wert thou\n but once here, my friend, though wouldst feel and own the power of\n knowledge.\nThe student listened to all this and wondered much; at last he said,\n ‘Blessed be the day and hour when I found you; cannot you contrive to let\n me into the sack for a little while?’ Then the other answered, as if very\n unwillingly, ‘A little space I may allow thee to sit here, if thou wilt\n reward me well and entreat me kindly; but thou must tarry yet an hour\n below, till I have learnt some little matters that are yet unknown to me.’\nSo the student sat himself down and waited a while; but the time hung\n heavy upon him, and he begged earnestly that he might ascend forthwith,\n for his thirst for knowledge was great. Then the other pretended to give\n way, and said, ‘Thou must let the sack of wisdom descend, by untying\n yonder cord, and then thou shalt enter.’ So the student let him down,\n opened the sack, and set him free. ‘Now then,’ cried he, ‘let me ascend\n quickly.’ As he began to put himself into the sack heels first, ‘Wait a\n while,’ said the gardener, ‘that is not the way.’ Then he pushed him in\n head first, tied up the sack, and soon swung up the searcher after wisdom\n dangling in the air. ‘How is it with thee, friend?’ said he, ‘dost thou\n not feel that wisdom comes unto thee? Rest there in peace, till thou art a\n wiser man than thou wert.’\nSo saying, he trotted off on the student’s nag, and left the poor fellow\n to gather wisdom till somebody should come and let him down.']","The brook presents a crossing obstacle. The straw tries to bridge it but burns and breaks, causing both the straw and the coal to fall and perish, while the bean stays ashore and survives.","The brook presents an obstacle to the straw, coal, and bean, as there is no bridge or foot-plank for them to cross. The straw offers to lay itself across the brook as a bridge, allowing the others to walk over. However, when the coal attempts to cross, the straw begins to burn, breaks in two, and both the straw and coal fall into the stream. The bean, who stays behind on the shore, laughs at the event. Thus, the brook is the setting for the turning point in their journey, leading to the downfall of the straw and coal.",1.0,0.9,0.53
Why queen go by river?,"['THE FISHERMAN AND HIS WIFE\n\nThere was once a fisherman who lived with his wife in a pigsty, close by\n the seaside. The fisherman used to go out all day long a-fishing; and one\n day, as he sat on the shore with his rod, looking at the sparkling waves\n and watching his line, all on a sudden his float was dragged away deep\n into the water: and in drawing it up he pulled out a great fish. But the\n fish said, ‘Pray let me live! I am not a real fish; I am an enchanted\n prince: put me in the water again, and let me go!’ ‘Oh, ho!’ said the man,\n ‘you need not make so many words about the matter; I will have nothing to\n do with a fish that can talk: so swim away, sir, as soon as you please!’\n Then he put him back into the water, and the fish darted straight down to\n the bottom, and left a long streak of blood behind him on the wave.\nWhen the fisherman went home to his wife in the pigsty, he told her how he\n had caught a great fish, and how it had told him it was an enchanted\n prince, and how, on hearing it speak, he had let it go again. ‘Did not you\n ask it for anything?’ said the wife, ‘we live very wretchedly here, in\n this nasty dirty pigsty; do go back and tell the fish we want a snug\n little cottage.’\nThe fisherman did not much like the business: however, he went to the\n seashore; and when he came back there the water looked all yellow and\n green. And he stood at the water’s edge, and said:\n‘O man of the sea!\n Hearken to me!\n My wife Ilsabill\n Will have her own will,\n And hath sent me to beg a boon of thee!’\nThen the fish came swimming to him, and said, ‘Well, what is her will?\n What does your wife want?’ ‘Ah!’ said the fisherman, ‘she says that when I\n had caught you, I ought to have asked you for something before I let you\n go; she does not like living any longer in the pigsty, and wants a snug\n little cottage.’ ‘Go home, then,’ said the fish; ‘she is in the cottage\n already!’ So the man went home, and saw his wife standing at the door of a\n nice trim little cottage. ‘Come in, come in!’ said she; ‘is not this much\n better than the filthy pigsty we had?’ And there was a parlour, and a\n bedchamber, and a kitchen; and behind the cottage there was a little\n garden, planted with all sorts of flowers and fruits; and there was a\n courtyard behind, full of ducks and chickens. ‘Ah!’ said the fisherman,\n ‘how happily we shall live now!’ ‘We will try to do so, at least,’ said\n his wife.\nEverything went right for a week or two, and then Dame Ilsabill said,\n ‘Husband, there is not near room enough for us in this cottage; the\n courtyard and the garden are a great deal too small; I should like to have\n a large stone castle to live in: go to the fish again and tell him to give\n us a castle.’ ‘Wife,’ said the fisherman, ‘I don’t like to go to him\n again, for perhaps he will be angry; we ought to be easy with this pretty\n cottage to live in.’ ‘Nonsense!’ said the wife; ‘he will do it very\n willingly, I know; go along and try!’\nThe fisherman went, but his heart was very heavy: and when he came to the\n sea, it looked blue and gloomy, though it was very calm; and he went close\n to the edge of the waves, and said:\n‘O man of the sea!\n Hearken to me!\n My wife Ilsabill\n Will have her own will,\n And hath sent me to beg a boon of thee!’\n‘Well, what does she want now?’ said the fish. ‘Ah!’ said the man,\n dolefully, ‘my wife wants to live in a stone castle.’ ‘Go home, then,’\n said the fish; ‘she is standing at the gate of it already.’ So away went\n the fisherman, and found his wife standing before the gate of a great\n castle. ‘See,’ said she, ‘is not this grand?’ With that they went into the\n castle together, and found a great many servants there, and the rooms all\n richly furnished, and full of golden chairs and tables; and behind the\n castle was a garden, and around it was a park half a mile long, full of\n sheep, and goats, and hares, and deer; and in the courtyard were stables\n and cow-houses. ‘Well,’ said the man, ‘now we will live cheerful and happy\n in this beautiful castle for the rest of our lives.’ ‘Perhaps we may,’\n said the wife; ‘but let us sleep upon it, before we make up our minds to\n that.’ So they went to bed.\nThe next morning when Dame Ilsabill awoke it was broad daylight, and she\n jogged the fisherman with her elbow, and said, ‘Get up, husband, and\n bestir yourself, for we must be king of all the land.’ ‘Wife, wife,’ said\n the man, ‘why should we wish to be the king? I will not be king.’ ‘Then I\n will,’ said she. ‘But, wife,’ said the fisherman, ‘how can you be king—the\n fish cannot make you a king?’ ‘Husband,’ said she, ‘say no more about it,\n but go and try! I will be king.’ So the man went away quite sorrowful to\n think that his wife should want to be king. This time the sea looked a\n dark grey colour, and was overspread with curling waves and the ridges of\n foam as he cried out:\n‘O man of the sea!\n Hearken to me!\n My wife Ilsabill\n Will have her own will,\n And hath sent me to beg a boon of thee!’\n‘Well, what would she have now?’ said the fish. ‘Alas!’ said the poor man,\n ‘my wife wants to be king.’ ‘Go home,’ said the fish; ‘she is king\n already.’\nThen the fisherman went home; and as he came close to the palace he saw a\n troop of soldiers, and heard the sound of drums and trumpets. And when he\n went in he saw his wife sitting on a throne of gold and diamonds, with a\n golden crown upon her head; and on each side of her stood six fair\n maidens, each a head taller than the other. ‘Well, wife,’ said the\n fisherman, ‘are you king?’ ‘Yes,’ said she, ‘I am king.’ And when he had\n looked at her for a long time, he said, ‘Ah, wife! what a fine thing it is\n to be king! Now we shall never have anything more to wish for as long as\n we live.’ ‘I don’t know how that may be,’ said she; ‘never is a long time.\n I am king, it is true; but I begin to be tired of that, and I think I\n should like to be emperor.’ ‘Alas, wife! why should you wish to be\n emperor?’ said the fisherman. ‘Husband,’ said she, ‘go to the fish! I say\n I will be emperor.’ ‘Ah, wife!’ replied the fisherman, ‘the fish cannot\n make an emperor, I am sure, and I should not like to ask him for such a\n thing.’ ‘I am king,’ said Ilsabill, ‘and you are my slave; so go at once!’\nSo the fisherman was forced to go; and he muttered as he went along, ‘This\n will come to no good, it is too much to ask; the fish will be tired at\n last, and then we shall be sorry for what we have done.’ He soon came to\n the seashore; and the water was quite black and muddy, and a mighty\n whirlwind blew over the waves and rolled them about, but he went as near\n as he could to the water’s brink, and said:\n‘O man of the sea!\n Hearken to me!\n My wife Ilsabill\n Will have her own will,\n And hath sent me to beg a boon of thee!’\n‘What would she have now?’ said the fish. ‘Ah!’ said the fisherman, ‘she\n wants to be emperor.’ ‘Go home,’ said the fish; ‘she is emperor already.’\nSo he went home again; and as he came near he saw his wife Ilsabill\n sitting on a very lofty throne made of solid gold, with a great crown on\n her head full two yards high; and on each side of her stood her guards and\n attendants in a row, each one smaller than the other, from the tallest\n giant down to a little dwarf no bigger than my finger. And before her\n stood princes, and dukes, and earls: and the fisherman went up to her and\n said, ‘Wife, are you emperor?’ ‘Yes,’ said she, ‘I am emperor.’ ‘Ah!’ said\n the man, as he gazed upon her, ‘what a fine thing it is to be emperor!’\n ‘Husband,’ said she, ‘why should we stop at being emperor? I will be pope\n next.’ ‘O wife, wife!’ said he, ‘how can you be pope? there is but one\n pope at a time in Christendom.’ ‘Husband,’ said she, ‘I will be pope this\n very day.’ ‘But,’ replied the husband, ‘the fish cannot make you pope.’\n ‘What nonsense!’ said she; ‘if he can make an emperor, he can make a pope:\n go and try him.’\nSo the fisherman went. But when he came to the shore the wind was raging\n and the sea was tossed up and down in boiling waves, and the ships were in\n trouble, and rolled fearfully upon the tops of the billows. In the middle\n of the heavens there was a little piece of blue sky, but towards the south\n all was red, as if a dreadful storm was rising. At this sight the\n fisherman was dreadfully frightened, and he trembled so that his knees\n knocked together: but still he went down near to the shore, and said:\n‘O man of the sea!\n Hearken to me!\n My wife Ilsabill\n Will have her own will,\n And hath sent me to beg a boon of thee!’\n‘What does she want now?’ said the fish. ‘Ah!’ said the fisherman, ‘my\n wife wants to be pope.’ ‘Go home,’ said the fish; ‘she is pope already.’\nThen the fisherman went home, and found Ilsabill sitting on a throne that\n was two miles high. And she had three great crowns on her head, and around\n her stood all the pomp and power of the Church. And on each side of her\n were two rows of burning lights, of all sizes, the greatest as large as\n the highest and biggest tower in the world, and the least no larger than a\n small rushlight. ‘Wife,’ said the fisherman, as he looked at all this\n greatness, ‘are you pope?’ ‘Yes,’ said she, ‘I am pope.’ ‘Well, wife,’\n replied he, ‘it is a grand thing to be pope; and now you must be easy, for\n you can be nothing greater.’ ‘I will think about that,’ said the wife.\n Then they went to bed: but Dame Ilsabill could not sleep all night for\n thinking what she should be next. At last, as she was dropping asleep,\n morning broke, and the sun rose. ‘Ha!’ thought she, as she woke up and\n looked at it through the window, ‘after all I cannot prevent the sun\n rising.’ At this thought she was very angry, and wakened her husband, and\n said, ‘Husband, go to the fish and tell him I must be lord of the sun and\n moon.’ The fisherman was half asleep, but the thought frightened him so\n much that he started and fell out of bed. ‘Alas, wife!’ said he, ‘cannot\n you be easy with being pope?’ ‘No,’ said she, ‘I am very uneasy as long as\n the sun and moon rise without my leave. Go to the fish at once!’\nThen the man went shivering with fear; and as he was going down to the\n shore a dreadful storm arose, so that the trees and the very rocks shook.\n And all the heavens became black with stormy clouds, and the lightnings\n played, and the thunders rolled; and you might have seen in the sea great\n black waves, swelling up like mountains with crowns of white foam upon\n their heads. And the fisherman crept towards the sea, and cried out, as\n well as he could:\n‘O man of the sea!\n Hearken to me!\n My wife Ilsabill\n Will have her own will,\n And hath sent me to beg a boon of thee!’\n‘What does she want now?’ said the fish. ‘Ah!’ said he, ‘she wants to be\n lord of the sun and moon.’ ‘Go home,’ said the fish, ‘to your pigsty\n again.’\nAnd there they live to this very day.', 'THE FROG-PRINCE\n\nOne fine evening a young princess put on her bonnet and clogs, and went\n out to take a walk by herself in a wood; and when she came to a cool\n spring of water, that rose in the midst of it, she sat herself down to\n rest a while. Now she had a golden ball in her hand, which was her\n favourite plaything; and she was always tossing it up into the air, and\n catching it again as it fell. After a time she threw it up so high that\n she missed catching it as it fell; and the ball bounded away, and rolled\n along upon the ground, till at last it fell down into the spring. The\n princess looked into the spring after her ball, but it was very deep, so\n deep that she could not see the bottom of it. Then she began to bewail her\n loss, and said, ‘Alas! if I could only get my ball again, I would give all\n my fine clothes and jewels, and everything that I have in the world.’\nWhilst she was speaking, a frog put its head out of the water, and said,\n ‘Princess, why do you weep so bitterly?’ ‘Alas!’ said she, ‘what can you\n do for me, you nasty frog? My golden ball has fallen into the spring.’ The\n frog said, ‘I want not your pearls, and jewels, and fine clothes; but if\n you will love me, and let me live with you and eat from off your golden\n plate, and sleep upon your bed, I will bring you your ball again.’ ‘What\n nonsense,’ thought the princess, ‘this silly frog is talking! He can never\n even get out of the spring to visit me, though he may be able to get my\n ball for me, and therefore I will tell him he shall have what he asks.’ So\n she said to the frog, ‘Well, if you will bring me my ball, I will do all\n you ask.’ Then the frog put his head down, and dived deep under the water;\n and after a little while he came up again, with the ball in his mouth, and\n threw it on the edge of the spring. As soon as the young princess saw her\n ball, she ran to pick it up; and she was so overjoyed to have it in her\n hand again, that she never thought of the frog, but ran home with it as\n fast as she could. The frog called after her, ‘Stay, princess, and take me\n with you as you said,’ But she did not stop to hear a word.\nThe next day, just as the princess had sat down to dinner, she heard a\n strange noise—tap, tap—plash, plash—as if something was\n coming up the marble staircase: and soon afterwards there was a gentle\n knock at the door, and a little voice cried out and said:\n‘Open the door, my princess dear,\n Open the door to thy true love here!\n And mind the words that thou and I said\n By the fountain cool, in the greenwood shade.’\nThen the princess ran to the door and opened it, and there she saw the\n frog, whom she had quite forgotten. At this sight she was sadly\n frightened, and shutting the door as fast as she could came back to her\n seat. The king, her father, seeing that something had frightened her,\n asked her what was the matter. ‘There is a nasty frog,’ said she, ‘at the\n door, that lifted my ball for me out of the spring this morning: I told\n him that he should live with me here, thinking that he could never get out\n of the spring; but there he is at the door, and he wants to come in.’\nWhile she was speaking the frog knocked again at the door, and said:\n‘Open the door, my princess dear,\n Open the door to thy true love here!\n And mind the words that thou and I said\n By the fountain cool, in the greenwood shade.’\nThen the king said to the young princess, ‘As you have given your word you\n must keep it; so go and let him in.’ She did so, and the frog hopped into\n the room, and then straight on—tap, tap—plash, plash—from\n the bottom of the room to the top, till he came up close to the table\n where the princess sat. ‘Pray lift me upon chair,’ said he to the\n princess, ‘and let me sit next to you.’ As soon as she had done this, the\n frog said, ‘Put your plate nearer to me, that I may eat out of it.’ This\n she did, and when he had eaten as much as he could, he said, ‘Now I am\n tired; carry me upstairs, and put me into your bed.’ And the princess,\n though very unwilling, took him up in her hand, and put him upon the\n pillow of her own bed, where he slept all night long. As soon as it was\n light he jumped up, hopped downstairs, and went out of the house. ‘Now,\n then,’ thought the princess, ‘at last he is gone, and I shall be troubled\n with him no more.’\nBut she was mistaken; for when night came again she heard the same tapping\n at the door; and the frog came once more, and said:\n‘Open the door, my princess dear,\n Open the door to thy true love here!\n And mind the words that thou and I said\n By the fountain cool, in the greenwood shade.’\nAnd when the princess opened the door the frog came in, and slept upon her\n pillow as before, till the morning broke. And the third night he did the\n same. But when the princess awoke on the following morning she was\n astonished to see, instead of the frog, a handsome prince, gazing on her\n with the most beautiful eyes she had ever seen, and standing at the head\n of her bed.\nHe told her that he had been enchanted by a spiteful fairy, who had\n changed him into a frog; and that he had been fated so to abide till some\n princess should take him out of the spring, and let him eat from her\n plate, and sleep upon her bed for three nights. ‘You,’ said the prince,\n ‘have broken his cruel charm, and now I have nothing to wish for but that\n you should go with me into my father’s kingdom, where I will marry you,\n and love you as long as you live.’\nThe young princess, you may be sure, was not long in saying ‘Yes’ to all\n this; and as they spoke a gay coach drove up, with eight beautiful horses,\n decked with plumes of feathers and a golden harness; and behind the coach\n rode the prince’s servant, faithful Heinrich, who had bewailed the\n misfortunes of his dear master during his enchantment so long and so\n bitterly, that his heart had well-nigh burst.\nThey then took leave of the king, and got into the coach with eight\n horses, and all set out, full of joy and merriment, for the prince’s\n kingdom, which they reached safely; and there they lived happily a great\n many years.', 'LILY AND THE LION\n\nA merchant, who had three daughters, was once setting out upon a journey;\n but before he went he asked each daughter what gift he should bring back\n for her. The eldest wished for pearls; the second for jewels; but the\n third, who was called Lily, said, ‘Dear father, bring me a rose.’ Now it\n was no easy task to find a rose, for it was the middle of winter; yet as\n she was his prettiest daughter, and was very fond of flowers, her father\n said he would try what he could do. So he kissed all three, and bid them\n goodbye.\nAnd when the time came for him to go home, he had bought pearls and jewels\n for the two eldest, but he had sought everywhere in vain for the rose; and\n when he went into any garden and asked for such a thing, the people\n laughed at him, and asked him whether he thought roses grew in snow. This\n grieved him very much, for Lily was his dearest child; and as he was\n journeying home, thinking what he should bring her, he came to a fine\n castle; and around the castle was a garden, in one half of which it seemed\n to be summer-time and in the other half winter. On one side the finest\n flowers were in full bloom, and on the other everything looked dreary and\n buried in the snow. ‘A lucky hit!’ said he, as he called to his servant,\n and told him to go to a beautiful bed of roses that was there, and bring\n him away one of the finest flowers.\nThis done, they were riding away well pleased, when up sprang a fierce\n lion, and roared out, ‘Whoever has stolen my roses shall be eaten up\n alive!’ Then the man said, ‘I knew not that the garden belonged to you;\n can nothing save my life?’ ‘No!’ said the lion, ‘nothing, unless you\n undertake to give me whatever meets you on your return home; if you agree\n to this, I will give you your life, and the rose too for your daughter.’\n But the man was unwilling to do so and said, ‘It may be my youngest\n daughter, who loves me most, and always runs to meet me when I go home.’\n Then the servant was greatly frightened, and said, ‘It may perhaps be only\n a cat or a dog.’ And at last the man yielded with a heavy heart, and took\n the rose; and said he would give the lion whatever should meet him first\n on his return.\nAnd as he came near home, it was Lily, his youngest and dearest daughter,\n that met him; she came running, and kissed him, and welcomed him home; and\n when she saw that he had brought her the rose, she was still more glad.\n But her father began to be very sorrowful, and to weep, saying, ‘Alas, my\n dearest child! I have bought this flower at a high price, for I have said\n I would give you to a wild lion; and when he has you, he will tear you in\n pieces, and eat you.’ Then he told her all that had happened, and said she\n should not go, let what would happen.\nBut she comforted him, and said, ‘Dear father, the word you have given\n must be kept; I will go to the lion, and soothe him: perhaps he will let\n me come safe home again.’\nThe next morning she asked the way she was to go, and took leave of her\n father, and went forth with a bold heart into the wood. But the lion was\n an enchanted prince. By day he and all his court were lions, but in the\n evening they took their right forms again. And when Lily came to the\n castle, he welcomed her so courteously that she agreed to marry him. The\n wedding-feast was held, and they lived happily together a long time. The\n prince was only to be seen as soon as evening came, and then he held his\n court; but every morning he left his bride, and went away by himself, she\n knew not whither, till the night came again.\nAfter some time he said to her, ‘Tomorrow there will be a great feast in\n your father’s house, for your eldest sister is to be married; and if you\n wish to go and visit her my lions shall lead you thither.’ Then she\n rejoiced much at the thoughts of seeing her father once more, and set out\n with the lions; and everyone was overjoyed to see her, for they had\n thought her dead long since. But she told them how happy she was, and\n stayed till the feast was over, and then went back to the wood.\nHer second sister was soon after married, and when Lily was asked to go to\n the wedding, she said to the prince, ‘I will not go alone this time—you\n must go with me.’ But he would not, and said that it would be a very\n hazardous thing; for if the least ray of the torch-light should fall upon\n him his enchantment would become still worse, for he should be changed\n into a dove, and be forced to wander about the world for seven long years.\n However, she gave him no rest, and said she would take care no light\n should fall upon him. So at last they set out together, and took with them\n their little child; and she chose a large hall with thick walls for him to\n sit in while the wedding-torches were lighted; but, unluckily, no one saw\n that there was a crack in the door. Then the wedding was held with great\n pomp, but as the train came from the church, and passed with the torches\n before the hall, a very small ray of light fell upon the prince. In a\n moment he disappeared, and when his wife came in and looked for him, she\n found only a white dove; and it said to her, ‘Seven years must I fly up\n and down over the face of the earth, but every now and then I will let\n fall a white feather, that will show you the way I am going; follow it,\n and at last you may overtake and set me free.’\nThis said, he flew out at the door, and poor Lily followed; and every now\n and then a white feather fell, and showed her the way she was to journey.\n Thus she went roving on through the wide world, and looked neither to the\n right hand nor to the left, nor took any rest, for seven years. Then she\n began to be glad, and thought to herself that the time was fast coming\n when all her troubles should end; yet repose was still far off, for one\n day as she was travelling on she missed the white feather, and when she\n lifted up her eyes she could nowhere see the dove. ‘Now,’ thought she to\n herself, ‘no aid of man can be of use to me.’ So she went to the sun and\n said, ‘Thou shinest everywhere, on the hill’s top and the valley’s depth—hast\n thou anywhere seen my white dove?’ ‘No,’ said the sun, ‘I have not seen\n it; but I will give thee a casket—open it when thy hour of need\n comes.’\nSo she thanked the sun, and went on her way till eventide; and when the\n moon arose, she cried unto it, and said, ‘Thou shinest through the night,\n over field and grove—hast thou nowhere seen my white dove?’ ‘No,’\n said the moon, ‘I cannot help thee but I will give thee an egg—break\n it when need comes.’\nThen she thanked the moon, and went on till the night-wind blew; and she\n raised up her voice to it, and said, ‘Thou blowest through every tree and\n under every leaf—hast thou not seen my white dove?’ ‘No,’ said the\n night-wind, ‘but I will ask three other winds; perhaps they have seen it.’\n Then the east wind and the west wind came, and said they too had not seen\n it, but the south wind said, ‘I have seen the white dove—he has fled\n to the Red Sea, and is changed once more into a lion, for the seven years\n are passed away, and there he is fighting with a dragon; and the dragon is\n an enchanted princess, who seeks to separate him from you.’ Then the\n night-wind said, ‘I will give thee counsel. Go to the Red Sea; on the\n right shore stand many rods—count them, and when thou comest to the\n eleventh, break it off, and smite the dragon with it; and so the lion will\n have the victory, and both of them will appear to you in their own forms.\n Then look round and thou wilt see a griffin, winged like bird, sitting by\n the Red Sea; jump on to his back with thy beloved one as quickly as\n possible, and he will carry you over the waters to your home. I will also\n give thee this nut,’ continued the night-wind. ‘When you are half-way\n over, throw it down, and out of the waters will immediately spring up a\n high nut-tree on which the griffin will be able to rest, otherwise he\n would not have the strength to bear you the whole way; if, therefore, thou\n dost forget to throw down the nut, he will let you both fall into the\n sea.’\nSo our poor wanderer went forth, and found all as the night-wind had said;\n and she plucked the eleventh rod, and smote the dragon, and the lion\n forthwith became a prince, and the dragon a princess again. But no sooner\n was the princess released from the spell, than she seized the prince by\n the arm and sprang on to the griffin’s back, and went off carrying the\n prince away with her.\nThus the unhappy traveller was again forsaken and forlorn; but she took\n heart and said, ‘As far as the wind blows, and so long as the cock crows,\n I will journey on, till I find him once again.’ She went on for a long,\n long way, till at length she came to the castle whither the princess had\n carried the prince; and there was a feast got ready, and she heard that\n the wedding was about to be held. ‘Heaven aid me now!’ said she; and she\n took the casket that the sun had given her, and found that within it lay a\n dress as dazzling as the sun itself. So she put it on, and went into the\n palace, and all the people gazed upon her; and the dress pleased the bride\n so much that she asked whether it was to be sold. ‘Not for gold and\n silver.’ said she, ‘but for flesh and blood.’ The princess asked what she\n meant, and she said, ‘Let me speak with the bridegroom this night in his\n chamber, and I will give thee the dress.’ At last the princess agreed, but\n she told her chamberlain to give the prince a sleeping draught, that he\n might not hear or see her. When evening came, and the prince had fallen\n asleep, she was led into his chamber, and she sat herself down at his\n feet, and said: ‘I have followed thee seven years. I have been to the sun,\n the moon, and the night-wind, to seek thee, and at last I have helped thee\n to overcome the dragon. Wilt thou then forget me quite?’ But the prince\n all the time slept so soundly, that her voice only passed over him, and\n seemed like the whistling of the wind among the fir-trees.\nThen poor Lily was led away, and forced to give up the golden dress; and\n when she saw that there was no help for her, she went out into a meadow,\n and sat herself down and wept. But as she sat she bethought herself of the\n egg that the moon had given her; and when she broke it, there ran out a\n hen and twelve chickens of pure gold, that played about, and then nestled\n under the old one’s wings, so as to form the most beautiful sight in the\n world. And she rose up and drove them before her, till the bride saw them\n from her window, and was so pleased that she came forth and asked her if\n she would sell the brood. ‘Not for gold or silver, but for flesh and\n blood: let me again this evening speak with the bridegroom in his chamber,\n and I will give thee the whole brood.’\nThen the princess thought to betray her as before, and agreed to what she\n asked: but when the prince went to his chamber he asked the chamberlain\n why the wind had whistled so in the night. And the chamberlain told him\n all—how he had given him a sleeping draught, and how a poor maiden\n had come and spoken to him in his chamber, and was to come again that\n night. Then the prince took care to throw away the sleeping draught; and\n when Lily came and began again to tell him what woes had befallen her, and\n how faithful and true to him she had been, he knew his beloved wife’s\n voice, and sprang up, and said, ‘You have awakened me as from a dream, for\n the strange princess had thrown a spell around me, so that I had\n altogether forgotten you; but Heaven hath sent you to me in a lucky hour.’\nAnd they stole away out of the palace by night unawares, and seated\n themselves on the griffin, who flew back with them over the Red Sea. When\n they were half-way across Lily let the nut fall into the water, and\n immediately a large nut-tree arose from the sea, whereon the griffin\n rested for a while, and then carried them safely home. There they found\n their child, now grown up to be comely and fair; and after all their\n troubles they lived happily together to the end of their days.']",I don't know.,Queen go by river at bottom of garden and see poor little fish that had thrown itself out of water and lay nearly dead on bank.,0.0,0.0,0.0
"wht exampels of sacrifise and perserverance, as well as virtue and patiense, can be found in the stories of the king's daughter who disguised herself as a huntsman and the princess who became a goose-girl?","['THE PINK\n\nThere was once upon a time a queen to whom God had given no children.\n Every morning she went into the garden and prayed to God in heaven to\n bestow on her a son or a daughter. Then an angel from heaven came to her\n and said: ‘Be at rest, you shall have a son with the power of wishing, so\n that whatsoever in the world he wishes for, that shall he have.’ Then she\n went to the king, and told him the joyful tidings, and when the time was\n come she gave birth to a son, and the king was filled with gladness.\nEvery morning she went with the child to the garden where the wild beasts\n were kept, and washed herself there in a clear stream. It happened once\n when the child was a little older, that it was lying in her arms and she\n fell asleep. Then came the old cook, who knew that the child had the power\n of wishing, and stole it away, and he took a hen, and cut it in pieces,\n and dropped some of its blood on the queen’s apron and on her dress. Then\n he carried the child away to a secret place, where a nurse was obliged to\n suckle it, and he ran to the king and accused the queen of having allowed\n her child to be taken from her by the wild beasts. When the king saw the\n blood on her apron, he believed this, fell into such a passion that he\n ordered a high tower to be built, in which neither sun nor moon could be\n seen and had his wife put into it, and walled up. Here she was to stay for\n seven years without meat or drink, and die of hunger. But God sent two\n angels from heaven in the shape of white doves, which flew to her twice a\n day, and carried her food until the seven years were over.\nThe cook, however, thought to himself: ‘If the child has the power of\n wishing, and I am here, he might very easily get me into trouble.’ So he\n left the palace and went to the boy, who was already big enough to speak,\n and said to him: ‘Wish for a beautiful palace for yourself with a garden,\n and all else that pertains to it.’ Scarcely were the words out of the\n boy’s mouth, when everything was there that he had wished for. After a\n while the cook said to him: ‘It is not well for you to be so alone, wish\n for a pretty girl as a companion.’ Then the king’s son wished for one, and\n she immediately stood before him, and was more beautiful than any painter\n could have painted her. The two played together, and loved each other with\n all their hearts, and the old cook went out hunting like a nobleman. The\n thought occurred to him, however, that the king’s son might some day wish\n to be with his father, and thus bring him into great peril. So he went out\n and took the maiden aside, and said: ‘Tonight when the boy is asleep, go\n to his bed and plunge this knife into his heart, and bring me his heart\n and tongue, and if you do not do it, you shall lose your life.’ Thereupon\n he went away, and when he returned next day she had not done it, and said:\n ‘Why should I shed the blood of an innocent boy who has never harmed\n anyone?’ The cook once more said: ‘If you do not do it, it shall cost you\n your own life.’ When he had gone away, she had a little hind brought to\n her, and ordered her to be killed, and took her heart and tongue, and laid\n them on a plate, and when she saw the old man coming, she said to the boy:\n ‘Lie down in your bed, and draw the clothes over you.’ Then the wicked\n wretch came in and said: ‘Where are the boy’s heart and tongue?’ The girl\n reached the plate to him, but the king’s son threw off the quilt, and\n said: ‘You old sinner, why did you want to kill me? Now will I pronounce\n thy sentence. You shall become a black poodle and have a gold collar round\n your neck, and shall eat burning coals, till the flames burst forth from\n your throat.’ And when he had spoken these words, the old man was changed\n into a poodle dog, and had a gold collar round his neck, and the cooks\n were ordered to bring up some live coals, and these he ate, until the\n flames broke forth from his throat. The king’s son remained there a short\n while longer, and he thought of his mother, and wondered if she were still\n alive. At length he said to the maiden: ‘I will go home to my own country;\n if you will go with me, I will provide for you.’ ‘Ah,’ she replied, ‘the\n way is so long, and what shall I do in a strange land where I am unknown?’\n As she did not seem quite willing, and as they could not be parted from\n each other, he wished that she might be changed into a beautiful pink, and\n took her with him. Then he went away to his own country, and the poodle\n had to run after him. He went to the tower in which his mother was\n confined, and as it was so high, he wished for a ladder which would reach\n up to the very top. Then he mounted up and looked inside, and cried:\n ‘Beloved mother, Lady Queen, are you still alive, or are you dead?’ She\n answered: ‘I have just eaten, and am still satisfied,’ for she thought the\n angels were there. Said he: ‘I am your dear son, whom the wild beasts were\n said to have torn from your arms; but I am alive still, and will soon set\n you free.’ Then he descended again, and went to his father, and caused\n himself to be announced as a strange huntsman, and asked if he could offer\n him service. The king said yes, if he was skilful and could get game for\n him, he should come to him, but that deer had never taken up their\n quarters in any part of the district or country. Then the huntsman\n promised to procure as much game for him as he could possibly use at the\n royal table. So he summoned all the huntsmen together, and bade them go\n out into the forest with him. And he went with them and made them form a\n great circle, open at one end where he stationed himself, and began to\n wish. Two hundred deer and more came running inside the circle at once,\n and the huntsmen shot them. Then they were all placed on sixty country\n carts, and driven home to the king, and for once he was able to deck his\n table with game, after having had none at all for years.\nNow the king felt great joy at this, and commanded that his entire\n household should eat with him next day, and made a great feast. When they\n were all assembled together, he said to the huntsman: ‘As you are so\n clever, you shall sit by me.’ He replied: ‘Lord King, your majesty must\n excuse me, I am a poor huntsman.’ But the king insisted on it, and said:\n ‘You shall sit by me,’ until he did it. Whilst he was sitting there, he\n thought of his dearest mother, and wished that one of the king’s principal\n servants would begin to speak of her, and would ask how it was faring with\n the queen in the tower, and if she were alive still, or had perished.\n Hardly had he formed the wish than the marshal began, and said: ‘Your\n majesty, we live joyously here, but how is the queen living in the tower?\n Is she still alive, or has she died?’ But the king replied: ‘She let my\n dear son be torn to pieces by wild beasts; I will not have her named.’\n Then the huntsman arose and said: ‘Gracious lord father she is alive\n still, and I am her son, and I was not carried away by wild beasts, but by\n that wretch the old cook, who tore me from her arms when she was asleep,\n and sprinkled her apron with the blood of a chicken.’ Thereupon he took\n the dog with the golden collar, and said: ‘That is the wretch!’ and caused\n live coals to be brought, and these the dog was compelled to devour before\n the sight of all, until flames burst forth from its throat. On this the\n huntsman asked the king if he would like to see the dog in his true shape,\n and wished him back into the form of the cook, in which he stood\n immediately, with his white apron, and his knife by his side. When the\n king saw him he fell into a passion, and ordered him to be cast into the\n deepest dungeon. Then the huntsman spoke further and said: ‘Father, will\n you see the maiden who brought me up so tenderly and who was afterwards to\n murder me, but did not do it, though her own life depended on it?’ The\n king replied: ‘Yes, I would like to see her.’ The son said: ‘Most gracious\n father, I will show her to you in the form of a beautiful flower,’ and he\n thrust his hand into his pocket and brought forth the pink, and placed it\n on the royal table, and it was so beautiful that the king had never seen\n one to equal it. Then the son said: ‘Now will I show her to you in her own\n form,’ and wished that she might become a maiden, and she stood there\n looking so beautiful that no painter could have made her look more so.\nAnd the king sent two waiting-maids and two attendants into the tower, to\n fetch the queen and bring her to the royal table. But when she was led in\n she ate nothing, and said: ‘The gracious and merciful God who has\n supported me in the tower, will soon set me free.’ She lived three days\n more, and then died happily, and when she was buried, the two white doves\n which had brought her food to the tower, and were angels of heaven,\n followed her body and seated themselves on her grave. The aged king\n ordered the cook to be torn in four pieces, but grief consumed the king’s\n own heart, and he soon died. His son married the beautiful maiden whom he\n had brought with him as a flower in his pocket, and whether they are still\n alive or not, is known to God.', 'THE GOLDEN BIRD\n\nA certain king had a beautiful garden, and in the garden stood a tree\n which bore golden apples. These apples were always counted, and about the\n time when they began to grow ripe it was found that every night one of\n them was gone. The king became very angry at this, and ordered the\n gardener to keep watch all night under the tree. The gardener set his\n eldest son to watch; but about twelve o’clock he fell asleep, and in the\n morning another of the apples was missing. Then the second son was ordered\n to watch; and at midnight he too fell asleep, and in the morning another\n apple was gone. Then the third son offered to keep watch; but the gardener\n at first would not let him, for fear some harm should come to him:\n however, at last he consented, and the young man laid himself under the\n tree to watch. As the clock struck twelve he heard a rustling noise in the\n air, and a bird came flying that was of pure gold; and as it was snapping\n at one of the apples with its beak, the gardener’s son jumped up and shot\n an arrow at it. But the arrow did the bird no harm; only it dropped a\n golden feather from its tail, and then flew away. The golden feather was\n brought to the king in the morning, and all the council was called\n together. Everyone agreed that it was worth more than all the wealth of\n the kingdom: but the king said, ‘One feather is of no use to me, I must\n have the whole bird.’\nThen the gardener’s eldest son set out and thought to find the golden bird\n very easily; and when he had gone but a little way, he came to a wood, and\n by the side of the wood he saw a fox sitting; so he took his bow and made\n ready to shoot at it. Then the fox said, ‘Do not shoot me, for I will give\n you good counsel; I know what your business is, and that you want to find\n the golden bird. You will reach a village in the evening; and when you get\n there, you will see two inns opposite to each other, one of which is very\n pleasant and beautiful to look at: go not in there, but rest for the night\n in the other, though it may appear to you to be very poor and mean.’ But\n the son thought to himself, ‘What can such a beast as this know about the\n matter?’ So he shot his arrow at the fox; but he missed it, and it set up\n its tail above its back and ran into the wood. Then he went his way, and\n in the evening came to the village where the two inns were; and in one of\n these were people singing, and dancing, and feasting; but the other looked\n very dirty, and poor. ‘I should be very silly,’ said he, ‘if I went to\n that shabby house, and left this charming place’; so he went into the\n smart house, and ate and drank at his ease, and forgot the bird, and his\n country too.\nTime passed on; and as the eldest son did not come back, and no tidings\n were heard of him, the second son set out, and the same thing happened to\n him. He met the fox, who gave him the good advice: but when he came to the\n two inns, his eldest brother was standing at the window where the\n merrymaking was, and called to him to come in; and he could not withstand\n the temptation, but went in, and forgot the golden bird and his country in\n the same manner.\nTime passed on again, and the youngest son too wished to set out into the\n wide world to seek for the golden bird; but his father would not listen to\n it for a long while, for he was very fond of his son, and was afraid that\n some ill luck might happen to him also, and prevent his coming back.\n However, at last it was agreed he should go, for he would not rest at\n home; and as he came to the wood, he met the fox, and heard the same good\n counsel. But he was thankful to the fox, and did not attempt his life as\n his brothers had done; so the fox said, ‘Sit upon my tail, and you will\n travel faster.’ So he sat down, and the fox began to run, and away they\n went over stock and stone so quick that their hair whistled in the wind.\nWhen they came to the village, the son followed the fox’s counsel, and\n without looking about him went to the shabby inn and rested there all\n night at his ease. In the morning came the fox again and met him as he was\n beginning his journey, and said, ‘Go straight forward, till you come to a\n castle, before which lie a whole troop of soldiers fast asleep and\n snoring: take no notice of them, but go into the castle and pass on and on\n till you come to a room, where the golden bird sits in a wooden cage;\n close by it stands a beautiful golden cage; but do not try to take the\n bird out of the shabby cage and put it into the handsome one, otherwise\n you will repent it.’ Then the fox stretched out his tail again, and the\n young man sat himself down, and away they went over stock and stone till\n their hair whistled in the wind.\nBefore the castle gate all was as the fox had said: so the son went in and\n found the chamber where the golden bird hung in a wooden cage, and below\n stood the golden cage, and the three golden apples that had been lost were\n lying close by it. Then thought he to himself, ‘It will be a very droll\n thing to bring away such a fine bird in this shabby cage’; so he opened\n the door and took hold of it and put it into the golden cage. But the bird\n set up such a loud scream that all the soldiers awoke, and they took him\n prisoner and carried him before the king. The next morning the court sat\n to judge him; and when all was heard, it sentenced him to die, unless he\n should bring the king the golden horse which could run as swiftly as the\n wind; and if he did this, he was to have the golden bird given him for his\n own.\nSo he set out once more on his journey, sighing, and in great despair,\n when on a sudden his friend the fox met him, and said, ‘You see now what\n has happened on account of your not listening to my counsel. I will still,\n however, tell you how to find the golden horse, if you will do as I bid\n you. You must go straight on till you come to the castle where the horse\n stands in his stall: by his side will lie the groom fast asleep and\n snoring: take away the horse quietly, but be sure to put the old leathern\n saddle upon him, and not the golden one that is close by it.’ Then the son\n sat down on the fox’s tail, and away they went over stock and stone till\n their hair whistled in the wind.\nAll went right, and the groom lay snoring with his hand upon the golden\n saddle. But when the son looked at the horse, he thought it a great pity\n to put the leathern saddle upon it. ‘I will give him the good one,’ said\n he; ‘I am sure he deserves it.’ As he took up the golden saddle the groom\n awoke and cried out so loud, that all the guards ran in and took him\n prisoner, and in the morning he was again brought before the court to be\n judged, and was sentenced to die. But it was agreed, that, if he could\n bring thither the beautiful princess, he should live, and have the bird\n and the horse given him for his own.\nThen he went his way very sorrowful; but the old fox came and said, ‘Why\n did not you listen to me? If you had, you would have carried away both the\n bird and the horse; yet will I once more give you counsel. Go straight on,\n and in the evening you will arrive at a castle. At twelve o’clock at night\n the princess goes to the bathing-house: go up to her and give her a kiss,\n and she will let you lead her away; but take care you do not suffer her to\n go and take leave of her father and mother.’ Then the fox stretched out\n his tail, and so away they went over stock and stone till their hair\n whistled again.\nAs they came to the castle, all was as the fox had said, and at twelve\n o’clock the young man met the princess going to the bath and gave her the\n kiss, and she agreed to run away with him, but begged with many tears that\n he would let her take leave of her father. At first he refused, but she\n wept still more and more, and fell at his feet, till at last he consented;\n but the moment she came to her father’s house the guards awoke and he was\n taken prisoner again.\nThen he was brought before the king, and the king said, ‘You shall never\n have my daughter unless in eight days you dig away the hill that stops the\n view from my window.’ Now this hill was so big that the whole world could\n not take it away: and when he had worked for seven days, and had done very\n little, the fox came and said. ‘Lie down and go to sleep; I will work for\n you.’ And in the morning he awoke and the hill was gone; so he went\n merrily to the king, and told him that now that it was removed he must\n give him the princess.\nThen the king was obliged to keep his word, and away went the young man\n and the princess; and the fox came and said to him, ‘We will have all\n three, the princess, the horse, and the bird.’ ‘Ah!’ said the young man,\n ‘that would be a great thing, but how can you contrive it?’\n‘If you will only listen,’ said the fox, ‘it can be done. When you come to\n the king, and he asks for the beautiful princess, you must say, “Here she\n is!” Then he will be very joyful; and you will mount the golden horse that\n they are to give you, and put out your hand to take leave of them; but\n shake hands with the princess last. Then lift her quickly on to the horse\n behind you; clap your spurs to his side, and gallop away as fast as you\n can.’\nAll went right: then the fox said, ‘When you come to the castle where the\n bird is, I will stay with the princess at the door, and you will ride in\n and speak to the king; and when he sees that it is the right horse, he\n will bring out the bird; but you must sit still, and say that you want to\n look at it, to see whether it is the true golden bird; and when you get it\n into your hand, ride away.’\nThis, too, happened as the fox said; they carried off the bird, the\n princess mounted again, and they rode on to a great wood. Then the fox\n came, and said, ‘Pray kill me, and cut off my head and my feet.’ But the\n young man refused to do it: so the fox said, ‘I will at any rate give you\n good counsel: beware of two things; ransom no one from the gallows, and\n sit down by the side of no river.’ Then away he went. ‘Well,’ thought the\n young man, ‘it is no hard matter to keep that advice.’\nHe rode on with the princess, till at last he came to the village where he\n had left his two brothers. And there he heard a great noise and uproar;\n and when he asked what was the matter, the people said, ‘Two men are going\n to be hanged.’ As he came nearer, he saw that the two men were his\n brothers, who had turned robbers; so he said, ‘Cannot they in any way be\n saved?’ But the people said ‘No,’ unless he would bestow all his money\n upon the rascals and buy their liberty. Then he did not stay to think\n about the matter, but paid what was asked, and his brothers were given up,\n and went on with him towards their home.\nAnd as they came to the wood where the fox first met them, it was so cool\n and pleasant that the two brothers said, ‘Let us sit down by the side of\n the river, and rest a while, to eat and drink.’ So he said, ‘Yes,’ and\n forgot the fox’s counsel, and sat down on the side of the river; and while\n he suspected nothing, they came behind, and threw him down the bank, and\n took the princess, the horse, and the bird, and went home to the king\n their master, and said. ‘All this have we won by our labour.’ Then there\n was great rejoicing made; but the horse would not eat, the bird would not\n sing, and the princess wept.\nThe youngest son fell to the bottom of the river’s bed: luckily it was\n nearly dry, but his bones were almost broken, and the bank was so steep\n that he could find no way to get out. Then the old fox came once more, and\n scolded him for not following his advice; otherwise no evil would have\n befallen him: ‘Yet,’ said he, ‘I cannot leave you here, so lay hold of my\n tail and hold fast.’ Then he pulled him out of the river, and said to him,\n as he got upon the bank, ‘Your brothers have set watch to kill you, if\n they find you in the kingdom.’ So he dressed himself as a poor man, and\n came secretly to the king’s court, and was scarcely within the doors when\n the horse began to eat, and the bird to sing, and the princess left off\n weeping. Then he went to the king, and told him all his brothers’ roguery;\n and they were seized and punished, and he had the princess given to him\n again; and after the king’s death he was heir to his kingdom.\nA long while after, he went to walk one day in the wood, and the old fox\n met him, and besought him with tears in his eyes to kill him, and cut off\n his head and feet. And at last he did so, and in a moment the fox was\n changed into a man, and turned out to be the brother of the princess, who\n had been lost a great many many years.', 'THE WHITE SNAKE\n\nA long time ago there lived a king who was famed for his wisdom through\n all the land. Nothing was hidden from him, and it seemed as if news of the\n most secret things was brought to him through the air. But he had a\n strange custom; every day after dinner, when the table was cleared, and no\n one else was present, a trusty servant had to bring him one more dish. It\n was covered, however, and even the servant did not know what was in it,\n neither did anyone know, for the king never took off the cover to eat of\n it until he was quite alone.\nThis had gone on for a long time, when one day the servant, who took away\n the dish, was overcome with such curiosity that he could not help carrying\n the dish into his room. When he had carefully locked the door, he lifted\n up the cover, and saw a white snake lying on the dish. But when he saw it\n he could not deny himself the pleasure of tasting it, so he cut of a\n little bit and put it into his mouth. No sooner had it touched his tongue\n than he heard a strange whispering of little voices outside his window. He\n went and listened, and then noticed that it was the sparrows who were\n chattering together, and telling one another of all kinds of things which\n they had seen in the fields and woods. Eating the snake had given him\n power of understanding the language of animals.\nNow it so happened that on this very day the queen lost her most beautiful\n ring, and suspicion of having stolen it fell upon this trusty servant, who\n was allowed to go everywhere. The king ordered the man to be brought\n before him, and threatened with angry words that unless he could before\n the morrow point out the thief, he himself should be looked upon as guilty\n and executed. In vain he declared his innocence; he was dismissed with no\n better answer.\nIn his trouble and fear he went down into the courtyard and took thought\n how to help himself out of his trouble. Now some ducks were sitting\n together quietly by a brook and taking their rest; and, whilst they were\n making their feathers smooth with their bills, they were having a\n confidential conversation together. The servant stood by and listened.\n They were telling one another of all the places where they had been\n waddling about all the morning, and what good food they had found; and one\n said in a pitiful tone: ‘Something lies heavy on my stomach; as I was\n eating in haste I swallowed a ring which lay under the queen’s window.’\n The servant at once seized her by the neck, carried her to the kitchen,\n and said to the cook: ‘Here is a fine duck; pray, kill her.’ ‘Yes,’ said\n the cook, and weighed her in his hand; ‘she has spared no trouble to\n fatten herself, and has been waiting to be roasted long enough.’ So he cut\n off her head, and as she was being dressed for the spit, the queen’s ring\n was found inside her.\nThe servant could now easily prove his innocence; and the king, to make\n amends for the wrong, allowed him to ask a favour, and promised him the\n best place in the court that he could wish for. The servant refused\n everything, and only asked for a horse and some money for travelling, as\n he had a mind to see the world and go about a little. When his request was\n granted he set out on his way, and one day came to a pond, where he saw\n three fishes caught in the reeds and gasping for water. Now, though it is\n said that fishes are dumb, he heard them lamenting that they must perish\n so miserably, and, as he had a kind heart, he got off his horse and put\n the three prisoners back into the water. They leapt with delight, put out\n their heads, and cried to him: ‘We will remember you and repay you for\n saving us!’\nHe rode on, and after a while it seemed to him that he heard a voice in\n the sand at his feet. He listened, and heard an ant-king complain: ‘Why\n cannot folks, with their clumsy beasts, keep off our bodies? That stupid\n horse, with his heavy hoofs, has been treading down my people without\n mercy!’ So he turned on to a side path and the ant-king cried out to him:\n ‘We will remember you—one good turn deserves another!’\nThe path led him into a wood, and there he saw two old ravens standing by\n their nest, and throwing out their young ones. ‘Out with you, you idle,\n good-for-nothing creatures!’ cried they; ‘we cannot find food for you any\n longer; you are big enough, and can provide for yourselves.’ But the poor\n young ravens lay upon the ground, flapping their wings, and crying: ‘Oh,\n what helpless chicks we are! We must shift for ourselves, and yet we\n cannot fly! What can we do, but lie here and starve?’ So the good young\n fellow alighted and killed his horse with his sword, and gave it to them\n for food. Then they came hopping up to it, satisfied their hunger, and\n cried: ‘We will remember you—one good turn deserves another!’\nAnd now he had to use his own legs, and when he had walked a long way, he\n came to a large city. There was a great noise and crowd in the streets,\n and a man rode up on horseback, crying aloud: ‘The king’s daughter wants a\n husband; but whoever seeks her hand must perform a hard task, and if he\n does not succeed he will forfeit his life.’ Many had already made the\n attempt, but in vain; nevertheless when the youth saw the king’s daughter\n he was so overcome by her great beauty that he forgot all danger, went\n before the king, and declared himself a suitor.\nSo he was led out to the sea, and a gold ring was thrown into it, before\n his eyes; then the king ordered him to fetch this ring up from the bottom\n of the sea, and added: ‘If you come up again without it you will be thrown\n in again and again until you perish amid the waves.’ All the people\n grieved for the handsome youth; then they went away, leaving him alone by\n the sea.\nHe stood on the shore and considered what he should do, when suddenly he\n saw three fishes come swimming towards him, and they were the very fishes\n whose lives he had saved. The one in the middle held a mussel in its\n mouth, which it laid on the shore at the youth’s feet, and when he had\n taken it up and opened it, there lay the gold ring in the shell. Full of\n joy he took it to the king and expected that he would grant him the\n promised reward.\nBut when the proud princess perceived that he was not her equal in birth,\n she scorned him, and required him first to perform another task. She went\n down into the garden and strewed with her own hands ten sacksful of\n millet-seed on the grass; then she said: ‘Tomorrow morning before sunrise\n these must be picked up, and not a single grain be wanting.’\nThe youth sat down in the garden and considered how it might be possible\n to perform this task, but he could think of nothing, and there he sat\n sorrowfully awaiting the break of day, when he should be led to death. But\n as soon as the first rays of the sun shone into the garden he saw all the\n ten sacks standing side by side, quite full, and not a single grain was\n missing. The ant-king had come in the night with thousands and thousands\n of ants, and the grateful creatures had by great industry picked up all\n the millet-seed and gathered them into the sacks.\nPresently the king’s daughter herself came down into the garden, and was\n amazed to see that the young man had done the task she had given him. But\n she could not yet conquer her proud heart, and said: ‘Although he has\n performed both the tasks, he shall not be my husband until he had brought\n me an apple from the Tree of Life.’ The youth did not know where the Tree\n of Life stood, but he set out, and would have gone on for ever, as long as\n his legs would carry him, though he had no hope of finding it. After he\n had wandered through three kingdoms, he came one evening to a wood, and\n lay down under a tree to sleep. But he heard a rustling in the branches,\n and a golden apple fell into his hand. At the same time three ravens flew\n down to him, perched themselves upon his knee, and said: ‘We are the three\n young ravens whom you saved from starving; when we had grown big, and\n heard that you were seeking the Golden Apple, we flew over the sea to the\n end of the world, where the Tree of Life stands, and have brought you the\n apple.’ The youth, full of joy, set out homewards, and took the Golden\n Apple to the king’s beautiful daughter, who had now no more excuses left\n to make. They cut the Apple of Life in two and ate it together; and then\n her heart became full of love for him, and they lived in undisturbed\n happiness to a great age.']","- The youngest prince in The Golden Bird: he remains steadfast and virtuous through many trials. He listens to wise counsel (the fox), rescues and helps others (the ant-king, ravens), endures danger and deception by his brothers, and persists until he recovers the three treasures (the princess, the horse, and the bird) and is finally rewarded. This shows perseverance, sacrifice of ease, and steadfast virtue.

- The princess who becomes a goose-girl (the goose-girl motif): she endures humiliation and hardship in disguise, remains faithful and virtuous, and endures until she is rightly recognized and restored to her proper place. This illustrates patience, virtue, and sacrifice in the face of trial.","In the story of the king's daughter who disguised herself as a huntsman (<1-hop>), sacrifice and perseverance are shown when she leaves her home and her royal status behind, dresses in huntsmen's clothes, and serves in the court of her former betrothed to remain close to him, enduring many trials and tests of her identity. Her patience and virtue are evident as she waits for the king to recognize her true self, never revealing her identity until the right moment. In the tale of the princess who became a goose-girl (<2-hop>), virtue and patience are displayed when she endures the betrayal of her waiting-maid, loses her royal position, and humbly works as a goose-girl without complaint. Despite her hardships, she remains gentle and meek, never revealing the truth until asked by the old king. Her perseverance is seen in how she continues on her journey and survives her trials, ultimately leading to her restoration and happiness. Both stories highlight the themes of sacrifice, perseverance, virtue, and patience through the heroines' actions and endurance.",0.0,0.3333333333333333,0.16
"How do the stories show that sacrifice and perseverance, along with virtue and patience, help the main characters find happiness even when they lose their riches or face hard times?","['THE WHITE SNAKE\n\nA long time ago there lived a king who was famed for his wisdom through\n all the land. Nothing was hidden from him, and it seemed as if news of the\n most secret things was brought to him through the air. But he had a\n strange custom; every day after dinner, when the table was cleared, and no\n one else was present, a trusty servant had to bring him one more dish. It\n was covered, however, and even the servant did not know what was in it,\n neither did anyone know, for the king never took off the cover to eat of\n it until he was quite alone.\nThis had gone on for a long time, when one day the servant, who took away\n the dish, was overcome with such curiosity that he could not help carrying\n the dish into his room. When he had carefully locked the door, he lifted\n up the cover, and saw a white snake lying on the dish. But when he saw it\n he could not deny himself the pleasure of tasting it, so he cut of a\n little bit and put it into his mouth. No sooner had it touched his tongue\n than he heard a strange whispering of little voices outside his window. He\n went and listened, and then noticed that it was the sparrows who were\n chattering together, and telling one another of all kinds of things which\n they had seen in the fields and woods. Eating the snake had given him\n power of understanding the language of animals.\nNow it so happened that on this very day the queen lost her most beautiful\n ring, and suspicion of having stolen it fell upon this trusty servant, who\n was allowed to go everywhere. The king ordered the man to be brought\n before him, and threatened with angry words that unless he could before\n the morrow point out the thief, he himself should be looked upon as guilty\n and executed. In vain he declared his innocence; he was dismissed with no\n better answer.\nIn his trouble and fear he went down into the courtyard and took thought\n how to help himself out of his trouble. Now some ducks were sitting\n together quietly by a brook and taking their rest; and, whilst they were\n making their feathers smooth with their bills, they were having a\n confidential conversation together. The servant stood by and listened.\n They were telling one another of all the places where they had been\n waddling about all the morning, and what good food they had found; and one\n said in a pitiful tone: ‘Something lies heavy on my stomach; as I was\n eating in haste I swallowed a ring which lay under the queen’s window.’\n The servant at once seized her by the neck, carried her to the kitchen,\n and said to the cook: ‘Here is a fine duck; pray, kill her.’ ‘Yes,’ said\n the cook, and weighed her in his hand; ‘she has spared no trouble to\n fatten herself, and has been waiting to be roasted long enough.’ So he cut\n off her head, and as she was being dressed for the spit, the queen’s ring\n was found inside her.\nThe servant could now easily prove his innocence; and the king, to make\n amends for the wrong, allowed him to ask a favour, and promised him the\n best place in the court that he could wish for. The servant refused\n everything, and only asked for a horse and some money for travelling, as\n he had a mind to see the world and go about a little. When his request was\n granted he set out on his way, and one day came to a pond, where he saw\n three fishes caught in the reeds and gasping for water. Now, though it is\n said that fishes are dumb, he heard them lamenting that they must perish\n so miserably, and, as he had a kind heart, he got off his horse and put\n the three prisoners back into the water. They leapt with delight, put out\n their heads, and cried to him: ‘We will remember you and repay you for\n saving us!’\nHe rode on, and after a while it seemed to him that he heard a voice in\n the sand at his feet. He listened, and heard an ant-king complain: ‘Why\n cannot folks, with their clumsy beasts, keep off our bodies? That stupid\n horse, with his heavy hoofs, has been treading down my people without\n mercy!’ So he turned on to a side path and the ant-king cried out to him:\n ‘We will remember you—one good turn deserves another!’\nThe path led him into a wood, and there he saw two old ravens standing by\n their nest, and throwing out their young ones. ‘Out with you, you idle,\n good-for-nothing creatures!’ cried they; ‘we cannot find food for you any\n longer; you are big enough, and can provide for yourselves.’ But the poor\n young ravens lay upon the ground, flapping their wings, and crying: ‘Oh,\n what helpless chicks we are! We must shift for ourselves, and yet we\n cannot fly! What can we do, but lie here and starve?’ So the good young\n fellow alighted and killed his horse with his sword, and gave it to them\n for food. Then they came hopping up to it, satisfied their hunger, and\n cried: ‘We will remember you—one good turn deserves another!’\nAnd now he had to use his own legs, and when he had walked a long way, he\n came to a large city. There was a great noise and crowd in the streets,\n and a man rode up on horseback, crying aloud: ‘The king’s daughter wants a\n husband; but whoever seeks her hand must perform a hard task, and if he\n does not succeed he will forfeit his life.’ Many had already made the\n attempt, but in vain; nevertheless when the youth saw the king’s daughter\n he was so overcome by her great beauty that he forgot all danger, went\n before the king, and declared himself a suitor.\nSo he was led out to the sea, and a gold ring was thrown into it, before\n his eyes; then the king ordered him to fetch this ring up from the bottom\n of the sea, and added: ‘If you come up again without it you will be thrown\n in again and again until you perish amid the waves.’ All the people\n grieved for the handsome youth; then they went away, leaving him alone by\n the sea.\nHe stood on the shore and considered what he should do, when suddenly he\n saw three fishes come swimming towards him, and they were the very fishes\n whose lives he had saved. The one in the middle held a mussel in its\n mouth, which it laid on the shore at the youth’s feet, and when he had\n taken it up and opened it, there lay the gold ring in the shell. Full of\n joy he took it to the king and expected that he would grant him the\n promised reward.\nBut when the proud princess perceived that he was not her equal in birth,\n she scorned him, and required him first to perform another task. She went\n down into the garden and strewed with her own hands ten sacksful of\n millet-seed on the grass; then she said: ‘Tomorrow morning before sunrise\n these must be picked up, and not a single grain be wanting.’\nThe youth sat down in the garden and considered how it might be possible\n to perform this task, but he could think of nothing, and there he sat\n sorrowfully awaiting the break of day, when he should be led to death. But\n as soon as the first rays of the sun shone into the garden he saw all the\n ten sacks standing side by side, quite full, and not a single grain was\n missing. The ant-king had come in the night with thousands and thousands\n of ants, and the grateful creatures had by great industry picked up all\n the millet-seed and gathered them into the sacks.\nPresently the king’s daughter herself came down into the garden, and was\n amazed to see that the young man had done the task she had given him. But\n she could not yet conquer her proud heart, and said: ‘Although he has\n performed both the tasks, he shall not be my husband until he had brought\n me an apple from the Tree of Life.’ The youth did not know where the Tree\n of Life stood, but he set out, and would have gone on for ever, as long as\n his legs would carry him, though he had no hope of finding it. After he\n had wandered through three kingdoms, he came one evening to a wood, and\n lay down under a tree to sleep. But he heard a rustling in the branches,\n and a golden apple fell into his hand. At the same time three ravens flew\n down to him, perched themselves upon his knee, and said: ‘We are the three\n young ravens whom you saved from starving; when we had grown big, and\n heard that you were seeking the Golden Apple, we flew over the sea to the\n end of the world, where the Tree of Life stands, and have brought you the\n apple.’ The youth, full of joy, set out homewards, and took the Golden\n Apple to the king’s beautiful daughter, who had now no more excuses left\n to make. They cut the Apple of Life in two and ate it together; and then\n her heart became full of love for him, and they lived in undisturbed\n happiness to a great age.', 'THE FOUR CLEVER BROTHERS\n\n‘Dear children,’ said a poor man to his four sons, ‘I have nothing to give\n you; you must go out into the wide world and try your luck. Begin by\n learning some craft or another, and see how you can get on.’ So the four\n brothers took their walking-sticks in their hands, and their little\n bundles on their shoulders, and after bidding their father goodbye, went\n all out at the gate together. When they had got on some way they came to\n four crossways, each leading to a different country. Then the eldest said,\n ‘Here we must part; but this day four years we will come back to this\n spot, and in the meantime each must try what he can do for himself.’\nSo each brother went his way; and as the eldest was hastening on a man met\n him, and asked him where he was going, and what he wanted. ‘I am going to\n try my luck in the world, and should like to begin by learning some art or\n trade,’ answered he. ‘Then,’ said the man, ‘go with me, and I will teach\n you to become the cunningest thief that ever was.’ ‘No,’ said the other,\n ‘that is not an honest calling, and what can one look to earn by it in the\n end but the gallows?’ ‘Oh!’ said the man, ‘you need not fear the gallows;\n for I will only teach you to steal what will be fair game: I meddle with\n nothing but what no one else can get or care anything about, and where no\n one can find you out.’ So the young man agreed to follow his trade, and he\n soon showed himself so clever, that nothing could escape him that he had\n once set his mind upon.\nThe second brother also met a man, who, when he found out what he was\n setting out upon, asked him what craft he meant to follow. ‘I do not know\n yet,’ said he. ‘Then come with me, and be a star-gazer. It is a noble art,\n for nothing can be hidden from you, when once you understand the stars.’\n The plan pleased him much, and he soon became such a skilful star-gazer,\n that when he had served out his time, and wanted to leave his master, he\n gave him a glass, and said, ‘With this you can see all that is passing in\n the sky and on earth, and nothing can be hidden from you.’\nThe third brother met a huntsman, who took him with him, and taught him so\n well all that belonged to hunting, that he became very clever in the craft\n of the woods; and when he left his master he gave him a bow, and said,\n ‘Whatever you shoot at with this bow you will be sure to hit.’\nThe youngest brother likewise met a man who asked him what he wished to\n do. ‘Would not you like,’ said he, ‘to be a tailor?’ ‘Oh, no!’ said the\n young man; ‘sitting cross-legged from morning to night, working backwards\n and forwards with a needle and goose, will never suit me.’ ‘Oh!’ answered\n the man, ‘that is not my sort of tailoring; come with me, and you will\n learn quite another kind of craft from that.’ Not knowing what better to\n do, he came into the plan, and learnt tailoring from the beginning; and\n when he left his master, he gave him a needle, and said, ‘You can sew\n anything with this, be it as soft as an egg or as hard as steel; and the\n joint will be so fine that no seam will be seen.’\nAfter the space of four years, at the time agreed upon, the four brothers\n met at the four cross-roads; and having welcomed each other, set off\n towards their father’s home, where they told him all that had happened to\n them, and how each had learned some craft.\nThen, one day, as they were sitting before the house under a very high\n tree, the father said, ‘I should like to try what each of you can do in\n this way.’ So he looked up, and said to the second son, ‘At the top of\n this tree there is a chaffinch’s nest; tell me how many eggs there are in\n it.’ The star-gazer took his glass, looked up, and said, ‘Five.’ ‘Now,’\n said the father to the eldest son, ‘take away the eggs without letting the\n bird that is sitting upon them and hatching them know anything of what you\n are doing.’ So the cunning thief climbed up the tree, and brought away to\n his father the five eggs from under the bird; and it never saw or felt\n what he was doing, but kept sitting on at its ease. Then the father took\n the eggs, and put one on each corner of the table, and the fifth in the\n middle, and said to the huntsman, ‘Cut all the eggs in two pieces at one\n shot.’ The huntsman took up his bow, and at one shot struck all the five\n eggs as his father wished.\n‘Now comes your turn,’ said he to the young tailor; ‘sew the eggs and the\n young birds in them together again, so neatly that the shot shall have\n done them no harm.’ Then the tailor took his needle, and sewed the eggs as\n he was told; and when he had done, the thief was sent to take them back to\n the nest, and put them under the bird without its knowing it. Then she\n went on sitting, and hatched them: and in a few days they crawled out, and\n had only a little red streak across their necks, where the tailor had sewn\n them together.\n‘Well done, sons!’ said the old man; ‘you have made good use of your time,\n and learnt something worth the knowing; but I am sure I do not know which\n ought to have the prize. Oh, that a time might soon come for you to turn\n your skill to some account!’\nNot long after this there was a great bustle in the country; for the\n king’s daughter had been carried off by a mighty dragon, and the king\n mourned over his loss day and night, and made it known that whoever\n brought her back to him should have her for a wife. Then the four brothers\n said to each other, ‘Here is a chance for us; let us try what we can do.’\n And they agreed to see whether they could not set the princess free. ‘I\n will soon find out where she is, however,’ said the star-gazer, as he\n looked through his glass; and he soon cried out, ‘I see her afar off,\n sitting upon a rock in the sea, and I can spy the dragon close by,\n guarding her.’ Then he went to the king, and asked for a ship for himself\n and his brothers; and they sailed together over the sea, till they came to\n the right place. There they found the princess sitting, as the star-gazer\n had said, on the rock; and the dragon was lying asleep, with his head upon\n her lap. ‘I dare not shoot at him,’ said the huntsman, ‘for I should kill\n the beautiful young lady also.’ ‘Then I will try my skill,’ said the\n thief, and went and stole her away from under the dragon, so quietly and\n gently that the beast did not know it, but went on snoring.\nThen away they hastened with her full of joy in their boat towards the\n ship; but soon came the dragon roaring behind them through the air; for he\n awoke and missed the princess. But when he got over the boat, and wanted\n to pounce upon them and carry off the princess, the huntsman took up his\n bow and shot him straight through the heart so that he fell down dead.\n They were still not safe; for he was such a great beast that in his fall\n he overset the boat, and they had to swim in the open sea upon a few\n planks. So the tailor took his needle, and with a few large stitches put\n some of the planks together; and he sat down upon these, and sailed about\n and gathered up all pieces of the boat; and then tacked them together so\n quickly that the boat was soon ready, and they then reached the ship and\n got home safe.\nWhen they had brought home the princess to her father, there was great\n rejoicing; and he said to the four brothers, ‘One of you shall marry her,\n but you must settle amongst yourselves which it is to be.’ Then there\n arose a quarrel between them; and the star-gazer said, ‘If I had not found\n the princess out, all your skill would have been of no use; therefore she\n ought to be mine.’ ‘Your seeing her would have been of no use,’ said the\n thief, ‘if I had not taken her away from the dragon; therefore she ought\n to be mine.’ ‘No, she is mine,’ said the huntsman; ‘for if I had not\n killed the dragon, he would, after all, have torn you and the princess\n into pieces.’ ‘And if I had not sewn the boat together again,’ said the\n tailor, ‘you would all have been drowned, therefore she is mine.’ Then the\n king put in a word, and said, ‘Each of you is right; and as all cannot\n have the young lady, the best way is for neither of you to have her: for\n the truth is, there is somebody she likes a great deal better. But to make\n up for your loss, I will give each of you, as a reward for his skill, half\n a kingdom.’ So the brothers agreed that this plan would be much better\n than either quarrelling or marrying a lady who had no mind to have them.\n And the king then gave to each half a kingdom, as he had said; and they\n lived very happily the rest of their days, and took good care of their\n father; and somebody took better care of the young lady, than to let\n either the dragon or one of the craftsmen have her again.', 'HANS IN LUCK\n\nSome men are born to good luck: all they do or try to do comes right—all\n that falls to them is so much gain—all their geese are swans—all\n their cards are trumps—toss them which way you will, they will\n always, like poor puss, alight upon their legs, and only move on so much\n the faster. The world may very likely not always think of them as they\n think of themselves, but what care they for the world? what can it know\n about the matter?\nOne of these lucky beings was neighbour Hans. Seven long years he had\n worked hard for his master. At last he said, ‘Master, my time is up; I\n must go home and see my poor mother once more: so pray pay me my wages and\n let me go.’ And the master said, ‘You have been a faithful and good\n servant, Hans, so your pay shall be handsome.’ Then he gave him a lump of\n silver as big as his head.\nHans took out his pocket-handkerchief, put the piece of silver into it,\n threw it over his shoulder, and jogged off on his road homewards. As he\n went lazily on, dragging one foot after another, a man came in sight,\n trotting gaily along on a capital horse. ‘Ah!’ said Hans aloud, ‘what a\n fine thing it is to ride on horseback! There he sits as easy and happy as\n if he was at home, in the chair by his fireside; he trips against no\n stones, saves shoe-leather, and gets on he hardly knows how.’ Hans did not\n speak so softly but the horseman heard it all, and said, ‘Well, friend,\n why do you go on foot then?’ ‘Ah!’ said he, ‘I have this load to carry: to\n be sure it is silver, but it is so heavy that I can’t hold up my head, and\n you must know it hurts my shoulder sadly.’ ‘What do you say of making an\n exchange?’ said the horseman. ‘I will give you my horse, and you shall\n give me the silver; which will save you a great deal of trouble in\n carrying such a heavy load about with you.’ ‘With all my heart,’ said\n Hans: ‘but as you are so kind to me, I must tell you one thing—you\n will have a weary task to draw that silver about with you.’ However, the\n horseman got off, took the silver, helped Hans up, gave him the bridle\n into one hand and the whip into the other, and said, ‘When you want to go\n very fast, smack your lips loudly together, and cry “Jip!”’\nHans was delighted as he sat on the horse, drew himself up, squared his\n elbows, turned out his toes, cracked his whip, and rode merrily off, one\n minute whistling a merry tune, and another singing,\n‘No care and no sorrow,\nA fig for the morrow!\nWe’ll laugh and be merry,\nSing neigh down derry!’\nAfter a time he thought he should like to go a little faster, so he\n smacked his lips and cried ‘Jip!’ Away went the horse full gallop; and\n before Hans knew what he was about, he was thrown off, and lay on his back\n by the road-side. His horse would have ran off, if a shepherd who was\n coming by, driving a cow, had not stopped it. Hans soon came to himself,\n and got upon his legs again, sadly vexed, and said to the shepherd, ‘This\n riding is no joke, when a man has the luck to get upon a beast like this\n that stumbles and flings him off as if it would break his neck. However,\n I’m off now once for all: I like your cow now a great deal better than\n this smart beast that played me this trick, and has spoiled my best coat,\n you see, in this puddle; which, by the by, smells not very like a nosegay.\n One can walk along at one’s leisure behind that cow—keep good\n company, and have milk, butter, and cheese, every day, into the bargain.\n What would I give to have such a prize!’ ‘Well,’ said the shepherd, ‘if\n you are so fond of her, I will change my cow for your horse; I like to do\n good to my neighbours, even though I lose by it myself.’ ‘Done!’ said\n Hans, merrily. ‘What a noble heart that good man has!’ thought he. Then\n the shepherd jumped upon the horse, wished Hans and the cow good morning,\n and away he rode.\nHans brushed his coat, wiped his face and hands, rested a while, and then\n drove off his cow quietly, and thought his bargain a very lucky one. ‘If I\n have only a piece of bread (and I certainly shall always be able to get\n that), I can, whenever I like, eat my butter and cheese with it; and when\n I am thirsty I can milk my cow and drink the milk: and what can I wish for\n more?’ When he came to an inn, he halted, ate up all his bread, and gave\n away his last penny for a glass of beer. When he had rested himself he set\n off again, driving his cow towards his mother’s village. But the heat grew\n greater as soon as noon came on, till at last, as he found himself on a\n wide heath that would take him more than an hour to cross, he began to be\n so hot and parched that his tongue clave to the roof of his mouth. ‘I can\n find a cure for this,’ thought he; ‘now I will milk my cow and quench my\n thirst’: so he tied her to the stump of a tree, and held his leathern cap\n to milk into; but not a drop was to be had. Who would have thought that\n this cow, which was to bring him milk and butter and cheese, was all that\n time utterly dry? Hans had not thought of looking to that.\nWhile he was trying his luck in milking, and managing the matter very\n clumsily, the uneasy beast began to think him very troublesome; and at\n last gave him such a kick on the head as knocked him down; and there he\n lay a long while senseless. Luckily a butcher soon came by, driving a pig\n in a wheelbarrow. ‘What is the matter with you, my man?’ said the butcher,\n as he helped him up. Hans told him what had happened, how he was dry, and\n wanted to milk his cow, but found the cow was dry too. Then the butcher\n gave him a flask of ale, saying, ‘There, drink and refresh yourself; your\n cow will give you no milk: don’t you see she is an old beast, good for\n nothing but the slaughter-house?’ ‘Alas, alas!’ said Hans, ‘who would have\n thought it? What a shame to take my horse, and give me only a dry cow! If\n I kill her, what will she be good for? I hate cow-beef; it is not tender\n enough for me. If it were a pig now—like that fat gentleman you are\n driving along at his ease—one could do something with it; it would\n at any rate make sausages.’ ‘Well,’ said the butcher, ‘I don’t like to say\n no, when one is asked to do a kind, neighbourly thing. To please you I\n will change, and give you my fine fat pig for the cow.’ ‘Heaven reward you\n for your kindness and self-denial!’ said Hans, as he gave the butcher the\n cow; and taking the pig off the wheel-barrow, drove it away, holding it by\n the string that was tied to its leg.\nSo on he jogged, and all seemed now to go right with him: he had met with\n some misfortunes, to be sure; but he was now well repaid for all. How\n could it be otherwise with such a travelling companion as he had at last\n got?\nThe next man he met was a countryman carrying a fine white goose. The\n countryman stopped to ask what was o’clock; this led to further chat; and\n Hans told him all his luck, how he had so many good bargains, and how all\n the world went gay and smiling with him. The countryman then began to tell\n his tale, and said he was going to take the goose to a christening.\n ‘Feel,’ said he, ‘how heavy it is, and yet it is only eight weeks old.\n Whoever roasts and eats it will find plenty of fat upon it, it has lived\n so well!’ ‘You’re right,’ said Hans, as he weighed it in his hand; ‘but if\n you talk of fat, my pig is no trifle.’ Meantime the countryman began to\n look grave, and shook his head. ‘Hark ye!’ said he, ‘my worthy friend, you\n seem a good sort of fellow, so I can’t help doing you a kind turn. Your\n pig may get you into a scrape. In the village I just came from, the squire\n has had a pig stolen out of his sty. I was dreadfully afraid when I saw\n you that you had got the squire’s pig. If you have, and they catch you, it\n will be a bad job for you. The least they will do will be to throw you\n into the horse-pond. Can you swim?’\nPoor Hans was sadly frightened. ‘Good man,’ cried he, ‘pray get me out of\n this scrape. I know nothing of where the pig was either bred or born; but\n he may have been the squire’s for aught I can tell: you know this country\n better than I do, take my pig and give me the goose.’ ‘I ought to have\n something into the bargain,’ said the countryman; ‘give a fat goose for a\n pig, indeed! ‘Tis not everyone would do so much for you as that. However,\n I will not be hard upon you, as you are in trouble.’ Then he took the\n string in his hand, and drove off the pig by a side path; while Hans went\n on the way homewards free from care. ‘After all,’ thought he, ‘that chap\n is pretty well taken in. I don’t care whose pig it is, but wherever it\n came from it has been a very good friend to me. I have much the best of\n the bargain. First there will be a capital roast; then the fat will find\n me in goose-grease for six months; and then there are all the beautiful\n white feathers. I will put them into my pillow, and then I am sure I shall\n sleep soundly without rocking. How happy my mother will be! Talk of a pig,\n indeed! Give me a fine fat goose.’\nAs he came to the next village, he saw a scissor-grinder with his wheel,\n working and singing,\n‘O’er hill and o’er dale\nSo happy I roam,\nWork light and live well,\nAll the world is my home;\nThen who so blythe, so merry as I?’\nHans stood looking on for a while, and at last said, ‘You must be well\n off, master grinder! you seem so happy at your work.’ ‘Yes,’ said the\n other, ‘mine is a golden trade; a good grinder never puts his hand into\n his pocket without finding money in it—but where did you get that\n beautiful goose?’ ‘I did not buy it, I gave a pig for it.’ ‘And where did\n you get the pig?’ ‘I gave a cow for it.’ ‘And the cow?’ ‘I gave a horse\n for it.’ ‘And the horse?’ ‘I gave a lump of silver as big as my head for\n it.’ ‘And the silver?’ ‘Oh! I worked hard for that seven long years.’ ‘You\n have thriven well in the world hitherto,’ said the grinder, ‘now if you\n could find money in your pocket whenever you put your hand in it, your\n fortune would be made.’ ‘Very true: but how is that to be managed?’ ‘How?\n Why, you must turn grinder like myself,’ said the other; ‘you only want a\n grindstone; the rest will come of itself. Here is one that is but little\n the worse for wear: I would not ask more than the value of your goose for\n it—will you buy?’ ‘How can you ask?’ said Hans; ‘I should be the\n happiest man in the world, if I could have money whenever I put my hand in\n my pocket: what could I want more? there’s the goose.’ ‘Now,’ said the\n grinder, as he gave him a common rough stone that lay by his side, ‘this\n is a most capital stone; do but work it well enough, and you can make an\n old nail cut with it.’\nHans took the stone, and went his way with a light heart: his eyes\n sparkled for joy, and he said to himself, ‘Surely I must have been born in\n a lucky hour; everything I could want or wish for comes of itself. People\n are so kind; they seem really to think I do them a favour in letting them\n make me rich, and giving me good bargains.’\nMeantime he began to be tired, and hungry too, for he had given away his\n last penny in his joy at getting the cow.\nAt last he could go no farther, for the stone tired him sadly: and he\n dragged himself to the side of a river, that he might take a drink of\n water, and rest a while. So he laid the stone carefully by his side on the\n bank: but, as he stooped down to drink, he forgot it, pushed it a little,\n and down it rolled, plump into the stream.\nFor a while he watched it sinking in the deep clear water; then sprang up\n and danced for joy, and again fell upon his knees and thanked Heaven, with\n tears in his eyes, for its kindness in taking away his only plague, the\n ugly heavy stone.\n‘How happy am I!’ cried he; ‘nobody was ever so lucky as I.’ Then up he\n got with a light heart, free from all his troubles, and walked on till he\n reached his mother’s house, and told her how very easy the road to good\n luck was.']","- The White Snake: The servant’s integrity and self-control (not opening the dish, risking punishment) lead to truth being revealed through his acts of mercy. He helps others (ducks, ant-king, ravens) at his own cost, and those good turns are repaid with opportunities and finally a rightful reward from the king. His perseverance and kindness, even after a false accusation, bring lasting happiness and a secure future.

- The Four Clever Brothers: Each brother uses patience to learn a craft, then perseverance to apply it in danger (rescuing the princess from the dragon). Their teamwork and mutual respect—rather than rivalry—yield a just reward: the king’s daughters’ hand and, ultimately, half a kingdom for each, plus the happiness of returning the princess safely. Their virtue and shared effort win lasting prosperity rather than petty competition.

- Hans in Luck: Hans’s cheerful virtue and patient acceptance of misfortune turn losses into a surprising fortune. He keeps a positive outlook, makes sacrifices (giving away money and goods in exchange), and trusts good fortune to come; even when he ends with nothing more than a simple gift (the grindstone), he feels lucky, content, and finds happiness with his mother. His readiness to see value beyond wealth shows that inner contentment and virtue can equal happiness despite material losses.

Overall, the tales illustrate that sacrifice, perseverance, virtue, and patience cultivate gratitude, repay kind deeds, and ultimately lead to genuine happiness, even when wealth is lost or when hard times arise.","In the first story, the king’s son and his beloved both go through much sacrifice and perseverance. The prince leaves his bride to obey his dying father’s wish, even though it means giving up his own happiness. The true bride, instead of giving up when she hears her beloved is to marry another, shows great patience and virtue by disguising herself and working as a huntsman to stay close to him. She and her companions endure tests set by the lion, and with the help of a kind servant, they persevere and do not reveal their true identities. In the end, her patience and virtue are rewarded when the king recognizes her, and they are happily reunited, showing that happiness comes not from riches or status, but from staying true and persevering through hardship.

In the second story, the princess loses all her royal possessions and is forced to become a goose-girl because of her maid’s betrayal. Despite her loss and suffering, she remains gentle, meek, and patient, never seeking revenge or complaining. She endures her hardships quietly, showing virtue and patience even when she is treated unfairly. Her perseverance is finally rewarded when the old king discovers the truth, restores her to her rightful place, and she is married to the prince. The good fairy even brings her faithful horse Falada back to life. Both stories show that through sacrifice, perseverance, virtue, and patience, the characters find happiness in the end, no matter how much they lose or how hard their journey is.",0.0,,0.0
"How do the themes of sibling love and brotherhood and cooperation manifest differently in the stories of the seven ravens and the four brothers, and what do these differences reveal about the ways siblings support each other in times of adversity?","['THE SEVEN RAVENS\n\nThere was once a man who had seven sons, and last of all one daughter.\n Although the little girl was very pretty, she was so weak and small that\n they thought she could not live; but they said she should at once be\n christened.\nSo the father sent one of his sons in haste to the spring to get some\n water, but the other six ran with him. Each wanted to be first at drawing\n the water, and so they were in such a hurry that all let their pitchers\n fall into the well, and they stood very foolishly looking at one another,\n and did not know what to do, for none dared go home. In the meantime the\n father was uneasy, and could not tell what made the young men stay so\n long. ‘Surely,’ said he, ‘the whole seven must have forgotten themselves\n over some game of play’; and when he had waited still longer and they yet\n did not come, he flew into a rage and wished them all turned into ravens.\n Scarcely had he spoken these words when he heard a croaking over his head,\n and looked up and saw seven ravens as black as coal flying round and\n round. Sorry as he was to see his wish so fulfilled, he did not know how\n what was done could be undone, and comforted himself as well as he could\n for the loss of his seven sons with his dear little daughter, who soon\n became stronger and every day more beautiful.\nFor a long time she did not know that she had ever had any brothers; for\n her father and mother took care not to speak of them before her: but one\n day by chance she heard the people about her speak of them. ‘Yes,’ said\n they, ‘she is beautiful indeed, but still ‘tis a pity that her brothers\n should have been lost for her sake.’ Then she was much grieved, and went\n to her father and mother, and asked if she had any brothers, and what had\n become of them. So they dared no longer hide the truth from her, but said\n it was the will of Heaven, and that her birth was only the innocent cause\n of it; but the little girl mourned sadly about it every day, and thought\n herself bound to do all she could to bring her brothers back; and she had\n neither rest nor ease, till at length one day she stole away, and set out\n into the wide world to find her brothers, wherever they might be, and free\n them, whatever it might cost her.\nShe took nothing with her but a little ring which her father and mother\n had given her, a loaf of bread in case she should be hungry, a little\n pitcher of water in case she should be thirsty, and a little stool to rest\n upon when she should be weary. Thus she went on and on, and journeyed till\n she came to the world’s end; then she came to the sun, but the sun looked\n much too hot and fiery; so she ran away quickly to the moon, but the moon\n was cold and chilly, and said, ‘I smell flesh and blood this way!’ so she\n took herself away in a hurry and came to the stars, and the stars were\n friendly and kind to her, and each star sat upon his own little stool; but\n the morning star rose up and gave her a little piece of wood, and said,\n ‘If you have not this little piece of wood, you cannot unlock the castle\n that stands on the glass-mountain, and there your brothers live.’ The\n little girl took the piece of wood, rolled it up in a little cloth, and\n went on again until she came to the glass-mountain, and found the door\n shut. Then she felt for the little piece of wood; but when she unwrapped\n the cloth it was not there, and she saw she had lost the gift of the good\n stars. What was to be done? She wanted to save her brothers, and had no\n key of the castle of the glass-mountain; so this faithful little sister\n took a knife out of her pocket and cut off her little finger, that was\n just the size of the piece of wood she had lost, and put it in the door\n and opened it.\nAs she went in, a little dwarf came up to her, and said, ‘What are you\n seeking for?’ ‘I seek for my brothers, the seven ravens,’ answered she.\n Then the dwarf said, ‘My masters are not at home; but if you will wait\n till they come, pray step in.’ Now the little dwarf was getting their\n dinner ready, and he brought their food upon seven little plates, and\n their drink in seven little glasses, and set them upon the table, and out\n of each little plate their sister ate a small piece, and out of each\n little glass she drank a small drop; but she let the ring that she had\n brought with her fall into the last glass.\nOn a sudden she heard a fluttering and croaking in the air, and the dwarf\n said, ‘Here come my masters.’ When they came in, they wanted to eat and\n drink, and looked for their little plates and glasses. Then said one after\n the other,\n‘Who has eaten from my little plate? And who has been drinking out of my\n little glass?’\n‘Caw! Caw! well I ween\n Mortal lips have this way been.’\nWhen the seventh came to the bottom of his glass, and found there the\n ring, he looked at it, and knew that it was his father’s and mother’s, and\n said, ‘O that our little sister would but come! then we should be free.’\n When the little girl heard this (for she stood behind the door all the\n time and listened), she ran forward, and in an instant all the ravens took\n their right form again; and all hugged and kissed each other, and went\n merrily home.', 'THE FOUR CLEVER BROTHERS\n\n‘Dear children,’ said a poor man to his four sons, ‘I have nothing to give\n you; you must go out into the wide world and try your luck. Begin by\n learning some craft or another, and see how you can get on.’ So the four\n brothers took their walking-sticks in their hands, and their little\n bundles on their shoulders, and after bidding their father goodbye, went\n all out at the gate together. When they had got on some way they came to\n four crossways, each leading to a different country. Then the eldest said,\n ‘Here we must part; but this day four years we will come back to this\n spot, and in the meantime each must try what he can do for himself.’\nSo each brother went his way; and as the eldest was hastening on a man met\n him, and asked him where he was going, and what he wanted. ‘I am going to\n try my luck in the world, and should like to begin by learning some art or\n trade,’ answered he. ‘Then,’ said the man, ‘go with me, and I will teach\n you to become the cunningest thief that ever was.’ ‘No,’ said the other,\n ‘that is not an honest calling, and what can one look to earn by it in the\n end but the gallows?’ ‘Oh!’ said the man, ‘you need not fear the gallows;\n for I will only teach you to steal what will be fair game: I meddle with\n nothing but what no one else can get or care anything about, and where no\n one can find you out.’ So the young man agreed to follow his trade, and he\n soon showed himself so clever, that nothing could escape him that he had\n once set his mind upon.\nThe second brother also met a man, who, when he found out what he was\n setting out upon, asked him what craft he meant to follow. ‘I do not know\n yet,’ said he. ‘Then come with me, and be a star-gazer. It is a noble art,\n for nothing can be hidden from you, when once you understand the stars.’\n The plan pleased him much, and he soon became such a skilful star-gazer,\n that when he had served out his time, and wanted to leave his master, he\n gave him a glass, and said, ‘With this you can see all that is passing in\n the sky and on earth, and nothing can be hidden from you.’\nThe third brother met a huntsman, who took him with him, and taught him so\n well all that belonged to hunting, that he became very clever in the craft\n of the woods; and when he left his master he gave him a bow, and said,\n ‘Whatever you shoot at with this bow you will be sure to hit.’\nThe youngest brother likewise met a man who asked him what he wished to\n do. ‘Would not you like,’ said he, ‘to be a tailor?’ ‘Oh, no!’ said the\n young man; ‘sitting cross-legged from morning to night, working backwards\n and forwards with a needle and goose, will never suit me.’ ‘Oh!’ answered\n the man, ‘that is not my sort of tailoring; come with me, and you will\n learn quite another kind of craft from that.’ Not knowing what better to\n do, he came into the plan, and learnt tailoring from the beginning; and\n when he left his master, he gave him a needle, and said, ‘You can sew\n anything with this, be it as soft as an egg or as hard as steel; and the\n joint will be so fine that no seam will be seen.’\nAfter the space of four years, at the time agreed upon, the four brothers\n met at the four cross-roads; and having welcomed each other, set off\n towards their father’s home, where they told him all that had happened to\n them, and how each had learned some craft.\nThen, one day, as they were sitting before the house under a very high\n tree, the father said, ‘I should like to try what each of you can do in\n this way.’ So he looked up, and said to the second son, ‘At the top of\n this tree there is a chaffinch’s nest; tell me how many eggs there are in\n it.’ The star-gazer took his glass, looked up, and said, ‘Five.’ ‘Now,’\n said the father to the eldest son, ‘take away the eggs without letting the\n bird that is sitting upon them and hatching them know anything of what you\n are doing.’ So the cunning thief climbed up the tree, and brought away to\n his father the five eggs from under the bird; and it never saw or felt\n what he was doing, but kept sitting on at its ease. Then the father took\n the eggs, and put one on each corner of the table, and the fifth in the\n middle, and said to the huntsman, ‘Cut all the eggs in two pieces at one\n shot.’ The huntsman took up his bow, and at one shot struck all the five\n eggs as his father wished.\n‘Now comes your turn,’ said he to the young tailor; ‘sew the eggs and the\n young birds in them together again, so neatly that the shot shall have\n done them no harm.’ Then the tailor took his needle, and sewed the eggs as\n he was told; and when he had done, the thief was sent to take them back to\n the nest, and put them under the bird without its knowing it. Then she\n went on sitting, and hatched them: and in a few days they crawled out, and\n had only a little red streak across their necks, where the tailor had sewn\n them together.\n‘Well done, sons!’ said the old man; ‘you have made good use of your time,\n and learnt something worth the knowing; but I am sure I do not know which\n ought to have the prize. Oh, that a time might soon come for you to turn\n your skill to some account!’\nNot long after this there was a great bustle in the country; for the\n king’s daughter had been carried off by a mighty dragon, and the king\n mourned over his loss day and night, and made it known that whoever\n brought her back to him should have her for a wife. Then the four brothers\n said to each other, ‘Here is a chance for us; let us try what we can do.’\n And they agreed to see whether they could not set the princess free. ‘I\n will soon find out where she is, however,’ said the star-gazer, as he\n looked through his glass; and he soon cried out, ‘I see her afar off,\n sitting upon a rock in the sea, and I can spy the dragon close by,\n guarding her.’ Then he went to the king, and asked for a ship for himself\n and his brothers; and they sailed together over the sea, till they came to\n the right place. There they found the princess sitting, as the star-gazer\n had said, on the rock; and the dragon was lying asleep, with his head upon\n her lap. ‘I dare not shoot at him,’ said the huntsman, ‘for I should kill\n the beautiful young lady also.’ ‘Then I will try my skill,’ said the\n thief, and went and stole her away from under the dragon, so quietly and\n gently that the beast did not know it, but went on snoring.\nThen away they hastened with her full of joy in their boat towards the\n ship; but soon came the dragon roaring behind them through the air; for he\n awoke and missed the princess. But when he got over the boat, and wanted\n to pounce upon them and carry off the princess, the huntsman took up his\n bow and shot him straight through the heart so that he fell down dead.\n They were still not safe; for he was such a great beast that in his fall\n he overset the boat, and they had to swim in the open sea upon a few\n planks. So the tailor took his needle, and with a few large stitches put\n some of the planks together; and he sat down upon these, and sailed about\n and gathered up all pieces of the boat; and then tacked them together so\n quickly that the boat was soon ready, and they then reached the ship and\n got home safe.\nWhen they had brought home the princess to her father, there was great\n rejoicing; and he said to the four brothers, ‘One of you shall marry her,\n but you must settle amongst yourselves which it is to be.’ Then there\n arose a quarrel between them; and the star-gazer said, ‘If I had not found\n the princess out, all your skill would have been of no use; therefore she\n ought to be mine.’ ‘Your seeing her would have been of no use,’ said the\n thief, ‘if I had not taken her away from the dragon; therefore she ought\n to be mine.’ ‘No, she is mine,’ said the huntsman; ‘for if I had not\n killed the dragon, he would, after all, have torn you and the princess\n into pieces.’ ‘And if I had not sewn the boat together again,’ said the\n tailor, ‘you would all have been drowned, therefore she is mine.’ Then the\n king put in a word, and said, ‘Each of you is right; and as all cannot\n have the young lady, the best way is for neither of you to have her: for\n the truth is, there is somebody she likes a great deal better. But to make\n up for your loss, I will give each of you, as a reward for his skill, half\n a kingdom.’ So the brothers agreed that this plan would be much better\n than either quarrelling or marrying a lady who had no mind to have them.\n And the king then gave to each half a kingdom, as he had said; and they\n lived very happily the rest of their days, and took good care of their\n father; and somebody took better care of the young lady, than to let\n either the dragon or one of the craftsmen have her again.', 'SNOW-WHITE AND ROSE-RED\n\nThere was once a poor widow who lived in a lonely cottage. In front of the\n cottage was a garden wherein stood two rose-trees, one of which bore white\n and the other red roses. She had two children who were like the two\n rose-trees, and one was called Snow-white, and the other Rose-red. They\n were as good and happy, as busy and cheerful as ever two children in the\n world were, only Snow-white was more quiet and gentle than Rose-red.\n Rose-red liked better to run about in the meadows and fields seeking\n flowers and catching butterflies; but Snow-white sat at home with her\n mother, and helped her with her housework, or read to her when there was\n nothing to do.\nThe two children were so fond of one another that they always held each\n other by the hand when they went out together, and when Snow-white said:\n ‘We will not leave each other,’ Rose-red answered: ‘Never so long as we\n live,’ and their mother would add: ‘What one has she must share with the\n other.’\nThey often ran about the forest alone and gathered red berries, and no\n beasts did them any harm, but came close to them trustfully. The little\n hare would eat a cabbage-leaf out of their hands, the roe grazed by their\n side, the stag leapt merrily by them, and the birds sat still upon the\n boughs, and sang whatever they knew.\nNo mishap overtook them; if they had stayed too late in the forest, and\n night came on, they laid themselves down near one another upon the moss,\n and slept until morning came, and their mother knew this and did not worry\n on their account.\nOnce when they had spent the night in the wood and the dawn had roused\n them, they saw a beautiful child in a shining white dress sitting near\n their bed. He got up and looked quite kindly at them, but said nothing and\n went into the forest. And when they looked round they found that they had\n been sleeping quite close to a precipice, and would certainly have fallen\n into it in the darkness if they had gone only a few paces further. And\n their mother told them that it must have been the angel who watches over\n good children.\nSnow-white and Rose-red kept their mother’s little cottage so neat that it\n was a pleasure to look inside it. In the summer Rose-red took care of the\n house, and every morning laid a wreath of flowers by her mother’s bed\n before she awoke, in which was a rose from each tree. In the winter\n Snow-white lit the fire and hung the kettle on the hob. The kettle was of\n brass and shone like gold, so brightly was it polished. In the evening,\n when the snowflakes fell, the mother said: ‘Go, Snow-white, and bolt the\n door,’ and then they sat round the hearth, and the mother took her\n spectacles and read aloud out of a large book, and the two girls listened\n as they sat and spun. And close by them lay a lamb upon the floor, and\n behind them upon a perch sat a white dove with its head hidden beneath its\n wings.\nOne evening, as they were thus sitting comfortably together, someone\n knocked at the door as if he wished to be let in. The mother said: ‘Quick,\n Rose-red, open the door, it must be a traveller who is seeking shelter.’\n Rose-red went and pushed back the bolt, thinking that it was a poor man,\n but it was not; it was a bear that stretched his broad, black head within\n the door.\nRose-red screamed and sprang back, the lamb bleated, the dove fluttered,\n and Snow-white hid herself behind her mother’s bed. But the bear began to\n speak and said: ‘Do not be afraid, I will do you no harm! I am\n half-frozen, and only want to warm myself a little beside you.’\n‘Poor bear,’ said the mother, ‘lie down by the fire, only take care that\n you do not burn your coat.’ Then she cried: ‘Snow-white, Rose-red, come\n out, the bear will do you no harm, he means well.’ So they both came out,\n and by-and-by the lamb and dove came nearer, and were not afraid of him.\n The bear said: ‘Here, children, knock the snow out of my coat a little’;\n so they brought the broom and swept the bear’s hide clean; and he\n stretched himself by the fire and growled contentedly and comfortably. It\n was not long before they grew quite at home, and played tricks with their\n clumsy guest. They tugged his hair with their hands, put their feet upon\n his back and rolled him about, or they took a hazel-switch and beat him,\n and when he growled they laughed. But the bear took it all in good part,\n only when they were too rough he called out: ‘Leave me alive, children,\nSnow-white, Rose-red,\n Will you beat your wooer dead?’\nWhen it was bed-time, and the others went to bed, the mother said to the\n bear: ‘You can lie there by the hearth, and then you will be safe from the\n cold and the bad weather.’ As soon as day dawned the two children let him\n out, and he trotted across the snow into the forest.\nHenceforth the bear came every evening at the same time, laid himself down\n by the hearth, and let the children amuse themselves with him as much as\n they liked; and they got so used to him that the doors were never fastened\n until their black friend had arrived.\nWhen spring had come and all outside was green, the bear said one morning\n to Snow-white: ‘Now I must go away, and cannot come back for the whole\n summer.’ ‘Where are you going, then, dear bear?’ asked Snow-white. ‘I must\n go into the forest and guard my treasures from the wicked dwarfs. In the\n winter, when the earth is frozen hard, they are obliged to stay below and\n cannot work their way through; but now, when the sun has thawed and warmed\n the earth, they break through it, and come out to pry and steal; and what\n once gets into their hands, and in their caves, does not easily see\n daylight again.’\nSnow-white was quite sorry at his departure, and as she unbolted the door\n for him, and the bear was hurrying out, he caught against the bolt and a\n piece of his hairy coat was torn off, and it seemed to Snow-white as if\n she had seen gold shining through it, but she was not sure about it. The\n bear ran away quickly, and was soon out of sight behind the trees.\nA short time afterwards the mother sent her children into the forest to\n get firewood. There they found a big tree which lay felled on the ground,\n and close by the trunk something was jumping backwards and forwards in the\n grass, but they could not make out what it was. When they came nearer they\n saw a dwarf with an old withered face and a snow-white beard a yard long.\n The end of the beard was caught in a crevice of the tree, and the little\n fellow was jumping about like a dog tied to a rope, and did not know what\n to do.\nHe glared at the girls with his fiery red eyes and cried: ‘Why do you\n stand there? Can you not come here and help me?’ ‘What are you up to,\n little man?’ asked Rose-red. ‘You stupid, prying goose!’ answered the\n dwarf: ‘I was going to split the tree to get a little wood for cooking.\n The little bit of food that we people get is immediately burnt up with\n heavy logs; we do not swallow so much as you coarse, greedy folk. I had\n just driven the wedge safely in, and everything was going as I wished; but\n the cursed wedge was too smooth and suddenly sprang out, and the tree\n closed so quickly that I could not pull out my beautiful white beard; so\n now it is tight and I cannot get away, and the silly, sleek, milk-faced\n things laugh! Ugh! how odious you are!’\nThe children tried very hard, but they could not pull the beard out, it\n was caught too fast. ‘I will run and fetch someone,’ said Rose-red. ‘You\n senseless goose!’ snarled the dwarf; ‘why should you fetch someone? You\n are already two too many for me; can you not think of something better?’\n ‘Don’t be impatient,’ said Snow-white, ‘I will help you,’ and she pulled\n her scissors out of her pocket, and cut off the end of the beard.\nAs soon as the dwarf felt himself free he laid hold of a bag which lay\n amongst the roots of the tree, and which was full of gold, and lifted it\n up, grumbling to himself: ‘Uncouth people, to cut off a piece of my fine\n beard. Bad luck to you!’ and then he swung the bag upon his back, and went\n off without even once looking at the children.\nSome time afterwards Snow-white and Rose-red went to catch a dish of fish.\n As they came near the brook they saw something like a large grasshopper\n jumping towards the water, as if it were going to leap in. They ran to it\n and found it was the dwarf. ‘Where are you going?’ said Rose-red; ‘you\n surely don’t want to go into the water?’ ‘I am not such a fool!’ cried the\n dwarf; ‘don’t you see that the accursed fish wants to pull me in?’ The\n little man had been sitting there fishing, and unluckily the wind had\n tangled up his beard with the fishing-line; a moment later a big fish made\n a bite and the feeble creature had not strength to pull it out; the fish\n kept the upper hand and pulled the dwarf towards him. He held on to all\n the reeds and rushes, but it was of little good, for he was forced to\n follow the movements of the fish, and was in urgent danger of being\n dragged into the water.\nThe girls came just in time; they held him fast and tried to free his\n beard from the line, but all in vain, beard and line were entangled fast\n together. There was nothing to do but to bring out the scissors and cut\n the beard, whereby a small part of it was lost. When the dwarf saw that he\n screamed out: ‘Is that civil, you toadstool, to disfigure a man’s face?\n Was it not enough to clip off the end of my beard? Now you have cut off\n the best part of it. I cannot let myself be seen by my people. I wish you\n had been made to run the soles off your shoes!’ Then he took out a sack of\n pearls which lay in the rushes, and without another word he dragged it\n away and disappeared behind a stone.\nIt happened that soon afterwards the mother sent the two children to the\n town to buy needles and thread, and laces and ribbons. The road led them\n across a heath upon which huge pieces of rock lay strewn about. There they\n noticed a large bird hovering in the air, flying slowly round and round\n above them; it sank lower and lower, and at last settled near a rock not\n far away. Immediately they heard a loud, piteous cry. They ran up and saw\n with horror that the eagle had seized their old acquaintance the dwarf,\n and was going to carry him off.\nThe children, full of pity, at once took tight hold of the little man, and\n pulled against the eagle so long that at last he let his booty go. As soon\n as the dwarf had recovered from his first fright he cried with his shrill\n voice: ‘Could you not have done it more carefully! You dragged at my brown\n coat so that it is all torn and full of holes, you clumsy creatures!’ Then\n he took up a sack full of precious stones, and slipped away again under\n the rock into his hole. The girls, who by this time were used to his\n ingratitude, went on their way and did their business in town.\nAs they crossed the heath again on their way home they surprised the\n dwarf, who had emptied out his bag of precious stones in a clean spot, and\n had not thought that anyone would come there so late. The evening sun\n shone upon the brilliant stones; they glittered and sparkled with all\n colours so beautifully that the children stood still and stared at them.\n ‘Why do you stand gaping there?’ cried the dwarf, and his ashen-grey face\n became copper-red with rage. He was still cursing when a loud growling was\n heard, and a black bear came trotting towards them out of the forest. The\n dwarf sprang up in a fright, but he could not reach his cave, for the bear\n was already close. Then in the dread of his heart he cried: ‘Dear Mr Bear,\n spare me, I will give you all my treasures; look, the beautiful jewels\n lying there! Grant me my life; what do you want with such a slender little\n fellow as I? you would not feel me between your teeth. Come, take these\n two wicked girls, they are tender morsels for you, fat as young quails;\n for mercy’s sake eat them!’ The bear took no heed of his words, but gave\n the wicked creature a single blow with his paw, and he did not move again.\nThe girls had run away, but the bear called to them: ‘Snow-white and\n Rose-red, do not be afraid; wait, I will come with you.’ Then they\n recognized his voice and waited, and when he came up to them suddenly his\n bearskin fell off, and he stood there a handsome man, clothed all in gold.\n ‘I am a king’s son,’ he said, ‘and I was bewitched by that wicked dwarf,\n who had stolen my treasures; I have had to run about the forest as a\n savage bear until I was freed by his death. Now he has got his\n well-deserved punishment.\nSnow-white was married to him, and Rose-red to his brother, and they\n divided between them the great treasure which the dwarf had gathered\n together in his cave. The old mother lived peacefully and happily with her\n children for many years. She took the two rose-trees with her, and they\n stood before her window, and every year bore the most beautiful roses,\n white and red.\nThe Brothers Grimm, Jacob (1785-1863) and Wilhelm (1786-1859), were born\n in Hanau, near Frankfurt, in the German state of Hesse. Throughout their\n lives they remained close friends, and both studied law at Marburg\n University. Jacob was a pioneer in the study of German philology, and\n although Wilhelm’s work was hampered by poor health the brothers\n collaborated in the creation of a German dictionary, not completed until\n a century after their deaths. But they were best (and universally) known\n for the collection of over two hundred folk tales they made from oral\n sources and published in two volumes of ‘Nursery and Household Tales’ in\n 1812 and 1814. Although their intention was to preserve such material as\n part of German cultural and literary history, and their collection was\n first published with scholarly notes and no illustration, the tales soon\n came into the possession of young readers. This was in part due to Edgar\n Taylor, who made the first English translation in 1823, selecting about\n fifty stories ‘with the amusement of some young friends principally in\n view.’ They have been an essential ingredient of children’s reading ever\n since.']","- Seven Ravens: The bond is centered on a single sister’s steadfast self-sacrifice for her brothers. After they are turned into ravens, she endures danger and deprivation on a personal quest to save them, even cutting off part of her finger to gain a key. The siblings’ love is rekindled through the sister’s perseverance and a magical, protective reunion. The adversity is resolved through one sibling’s devoted action and ultimate restoration of the family.

- The Four Clever Brothers: The bond is built on collective skill and cooperation. Each brother pursues a distinct craft, and together they pool their abilities to rescue the king’s daughter. They plan, execute, and combine their talents (thief, star-gazer, hunter, tailor) to overcome dangers, culminating in a shared reward. The adversity is faced with teamwork, although rivalry surfaces over who deserves the prize, which the king ultimately resolves by rewarding all.

What these differences reveal: In the ravens tale, sibling support is intensely personal and sacrificial, demonstrating how a single devoted sibling can redeem the others through steadfast love. In the four brothers tale, sibling support is collaborative and complementary—success comes from varied talents working in concert. Both show that siblings sustain each other in hardship, but one emphasizes individual devotion, the other collective cooperation.","In the story of the seven ravens (<1-hop>), sibling love is portrayed through the unwavering devotion of the youngest sister, who, upon learning of her brothers’ fate, embarks on a perilous journey to save them. Her determination leads her to make great personal sacrifices, such as cutting off her own finger to unlock the castle where her brothers are imprisoned. This act of selflessness and courage ultimately restores her brothers to their human forms, highlighting the power of sibling love to overcome even magical curses and great hardships.

In contrast, the story of the four brothers (<2-hop>) emphasizes brotherhood and cooperation as the siblings set out into the world, each learning a unique craft. When the king’s daughter is captured by a dragon, the brothers combine their individual skills—star-gazing, thievery, hunting, and tailoring—to rescue her. Each brother’s contribution is essential to the success of their quest, and their cooperation allows them to overcome obstacles that none could have managed alone. Even when a dispute arises over who deserves the princess, they ultimately accept the king’s fair solution and continue to live harmoniously, sharing the rewards and caring for their father.

These differences reveal that sibling support can take many forms: in the tale of the seven ravens, it is the deep, personal love of a sister willing to endure hardship for her brothers; in the tale of the four brothers, it is the collective strength found in cooperation and the pooling of diverse talents. Both stories celebrate the enduring bonds between siblings and demonstrate that whether through individual sacrifice or teamwork, siblings can achieve remarkable things when united by love and loyalty.",0.8888888888888888,,0.75
"How do the stories of the seven ravens and the four brothers both show sibling love and brotherhood and cooperation, and wot lesons do they teach about working together?","['THE SEVEN RAVENS\n\nThere was once a man who had seven sons, and last of all one daughter.\n Although the little girl was very pretty, she was so weak and small that\n they thought she could not live; but they said she should at once be\n christened.\nSo the father sent one of his sons in haste to the spring to get some\n water, but the other six ran with him. Each wanted to be first at drawing\n the water, and so they were in such a hurry that all let their pitchers\n fall into the well, and they stood very foolishly looking at one another,\n and did not know what to do, for none dared go home. In the meantime the\n father was uneasy, and could not tell what made the young men stay so\n long. ‘Surely,’ said he, ‘the whole seven must have forgotten themselves\n over some game of play’; and when he had waited still longer and they yet\n did not come, he flew into a rage and wished them all turned into ravens.\n Scarcely had he spoken these words when he heard a croaking over his head,\n and looked up and saw seven ravens as black as coal flying round and\n round. Sorry as he was to see his wish so fulfilled, he did not know how\n what was done could be undone, and comforted himself as well as he could\n for the loss of his seven sons with his dear little daughter, who soon\n became stronger and every day more beautiful.\nFor a long time she did not know that she had ever had any brothers; for\n her father and mother took care not to speak of them before her: but one\n day by chance she heard the people about her speak of them. ‘Yes,’ said\n they, ‘she is beautiful indeed, but still ‘tis a pity that her brothers\n should have been lost for her sake.’ Then she was much grieved, and went\n to her father and mother, and asked if she had any brothers, and what had\n become of them. So they dared no longer hide the truth from her, but said\n it was the will of Heaven, and that her birth was only the innocent cause\n of it; but the little girl mourned sadly about it every day, and thought\n herself bound to do all she could to bring her brothers back; and she had\n neither rest nor ease, till at length one day she stole away, and set out\n into the wide world to find her brothers, wherever they might be, and free\n them, whatever it might cost her.\nShe took nothing with her but a little ring which her father and mother\n had given her, a loaf of bread in case she should be hungry, a little\n pitcher of water in case she should be thirsty, and a little stool to rest\n upon when she should be weary. Thus she went on and on, and journeyed till\n she came to the world’s end; then she came to the sun, but the sun looked\n much too hot and fiery; so she ran away quickly to the moon, but the moon\n was cold and chilly, and said, ‘I smell flesh and blood this way!’ so she\n took herself away in a hurry and came to the stars, and the stars were\n friendly and kind to her, and each star sat upon his own little stool; but\n the morning star rose up and gave her a little piece of wood, and said,\n ‘If you have not this little piece of wood, you cannot unlock the castle\n that stands on the glass-mountain, and there your brothers live.’ The\n little girl took the piece of wood, rolled it up in a little cloth, and\n went on again until she came to the glass-mountain, and found the door\n shut. Then she felt for the little piece of wood; but when she unwrapped\n the cloth it was not there, and she saw she had lost the gift of the good\n stars. What was to be done? She wanted to save her brothers, and had no\n key of the castle of the glass-mountain; so this faithful little sister\n took a knife out of her pocket and cut off her little finger, that was\n just the size of the piece of wood she had lost, and put it in the door\n and opened it.\nAs she went in, a little dwarf came up to her, and said, ‘What are you\n seeking for?’ ‘I seek for my brothers, the seven ravens,’ answered she.\n Then the dwarf said, ‘My masters are not at home; but if you will wait\n till they come, pray step in.’ Now the little dwarf was getting their\n dinner ready, and he brought their food upon seven little plates, and\n their drink in seven little glasses, and set them upon the table, and out\n of each little plate their sister ate a small piece, and out of each\n little glass she drank a small drop; but she let the ring that she had\n brought with her fall into the last glass.\nOn a sudden she heard a fluttering and croaking in the air, and the dwarf\n said, ‘Here come my masters.’ When they came in, they wanted to eat and\n drink, and looked for their little plates and glasses. Then said one after\n the other,\n‘Who has eaten from my little plate? And who has been drinking out of my\n little glass?’\n‘Caw! Caw! well I ween\n Mortal lips have this way been.’\nWhen the seventh came to the bottom of his glass, and found there the\n ring, he looked at it, and knew that it was his father’s and mother’s, and\n said, ‘O that our little sister would but come! then we should be free.’\n When the little girl heard this (for she stood behind the door all the\n time and listened), she ran forward, and in an instant all the ravens took\n their right form again; and all hugged and kissed each other, and went\n merrily home.', 'THE FOUR CLEVER BROTHERS\n\n‘Dear children,’ said a poor man to his four sons, ‘I have nothing to give\n you; you must go out into the wide world and try your luck. Begin by\n learning some craft or another, and see how you can get on.’ So the four\n brothers took their walking-sticks in their hands, and their little\n bundles on their shoulders, and after bidding their father goodbye, went\n all out at the gate together. When they had got on some way they came to\n four crossways, each leading to a different country. Then the eldest said,\n ‘Here we must part; but this day four years we will come back to this\n spot, and in the meantime each must try what he can do for himself.’\nSo each brother went his way; and as the eldest was hastening on a man met\n him, and asked him where he was going, and what he wanted. ‘I am going to\n try my luck in the world, and should like to begin by learning some art or\n trade,’ answered he. ‘Then,’ said the man, ‘go with me, and I will teach\n you to become the cunningest thief that ever was.’ ‘No,’ said the other,\n ‘that is not an honest calling, and what can one look to earn by it in the\n end but the gallows?’ ‘Oh!’ said the man, ‘you need not fear the gallows;\n for I will only teach you to steal what will be fair game: I meddle with\n nothing but what no one else can get or care anything about, and where no\n one can find you out.’ So the young man agreed to follow his trade, and he\n soon showed himself so clever, that nothing could escape him that he had\n once set his mind upon.\nThe second brother also met a man, who, when he found out what he was\n setting out upon, asked him what craft he meant to follow. ‘I do not know\n yet,’ said he. ‘Then come with me, and be a star-gazer. It is a noble art,\n for nothing can be hidden from you, when once you understand the stars.’\n The plan pleased him much, and he soon became such a skilful star-gazer,\n that when he had served out his time, and wanted to leave his master, he\n gave him a glass, and said, ‘With this you can see all that is passing in\n the sky and on earth, and nothing can be hidden from you.’\nThe third brother met a huntsman, who took him with him, and taught him so\n well all that belonged to hunting, that he became very clever in the craft\n of the woods; and when he left his master he gave him a bow, and said,\n ‘Whatever you shoot at with this bow you will be sure to hit.’\nThe youngest brother likewise met a man who asked him what he wished to\n do. ‘Would not you like,’ said he, ‘to be a tailor?’ ‘Oh, no!’ said the\n young man; ‘sitting cross-legged from morning to night, working backwards\n and forwards with a needle and goose, will never suit me.’ ‘Oh!’ answered\n the man, ‘that is not my sort of tailoring; come with me, and you will\n learn quite another kind of craft from that.’ Not knowing what better to\n do, he came into the plan, and learnt tailoring from the beginning; and\n when he left his master, he gave him a needle, and said, ‘You can sew\n anything with this, be it as soft as an egg or as hard as steel; and the\n joint will be so fine that no seam will be seen.’\nAfter the space of four years, at the time agreed upon, the four brothers\n met at the four cross-roads; and having welcomed each other, set off\n towards their father’s home, where they told him all that had happened to\n them, and how each had learned some craft.\nThen, one day, as they were sitting before the house under a very high\n tree, the father said, ‘I should like to try what each of you can do in\n this way.’ So he looked up, and said to the second son, ‘At the top of\n this tree there is a chaffinch’s nest; tell me how many eggs there are in\n it.’ The star-gazer took his glass, looked up, and said, ‘Five.’ ‘Now,’\n said the father to the eldest son, ‘take away the eggs without letting the\n bird that is sitting upon them and hatching them know anything of what you\n are doing.’ So the cunning thief climbed up the tree, and brought away to\n his father the five eggs from under the bird; and it never saw or felt\n what he was doing, but kept sitting on at its ease. Then the father took\n the eggs, and put one on each corner of the table, and the fifth in the\n middle, and said to the huntsman, ‘Cut all the eggs in two pieces at one\n shot.’ The huntsman took up his bow, and at one shot struck all the five\n eggs as his father wished.\n‘Now comes your turn,’ said he to the young tailor; ‘sew the eggs and the\n young birds in them together again, so neatly that the shot shall have\n done them no harm.’ Then the tailor took his needle, and sewed the eggs as\n he was told; and when he had done, the thief was sent to take them back to\n the nest, and put them under the bird without its knowing it. Then she\n went on sitting, and hatched them: and in a few days they crawled out, and\n had only a little red streak across their necks, where the tailor had sewn\n them together.\n‘Well done, sons!’ said the old man; ‘you have made good use of your time,\n and learnt something worth the knowing; but I am sure I do not know which\n ought to have the prize. Oh, that a time might soon come for you to turn\n your skill to some account!’\nNot long after this there was a great bustle in the country; for the\n king’s daughter had been carried off by a mighty dragon, and the king\n mourned over his loss day and night, and made it known that whoever\n brought her back to him should have her for a wife. Then the four brothers\n said to each other, ‘Here is a chance for us; let us try what we can do.’\n And they agreed to see whether they could not set the princess free. ‘I\n will soon find out where she is, however,’ said the star-gazer, as he\n looked through his glass; and he soon cried out, ‘I see her afar off,\n sitting upon a rock in the sea, and I can spy the dragon close by,\n guarding her.’ Then he went to the king, and asked for a ship for himself\n and his brothers; and they sailed together over the sea, till they came to\n the right place. There they found the princess sitting, as the star-gazer\n had said, on the rock; and the dragon was lying asleep, with his head upon\n her lap. ‘I dare not shoot at him,’ said the huntsman, ‘for I should kill\n the beautiful young lady also.’ ‘Then I will try my skill,’ said the\n thief, and went and stole her away from under the dragon, so quietly and\n gently that the beast did not know it, but went on snoring.\nThen away they hastened with her full of joy in their boat towards the\n ship; but soon came the dragon roaring behind them through the air; for he\n awoke and missed the princess. But when he got over the boat, and wanted\n to pounce upon them and carry off the princess, the huntsman took up his\n bow and shot him straight through the heart so that he fell down dead.\n They were still not safe; for he was such a great beast that in his fall\n he overset the boat, and they had to swim in the open sea upon a few\n planks. So the tailor took his needle, and with a few large stitches put\n some of the planks together; and he sat down upon these, and sailed about\n and gathered up all pieces of the boat; and then tacked them together so\n quickly that the boat was soon ready, and they then reached the ship and\n got home safe.\nWhen they had brought home the princess to her father, there was great\n rejoicing; and he said to the four brothers, ‘One of you shall marry her,\n but you must settle amongst yourselves which it is to be.’ Then there\n arose a quarrel between them; and the star-gazer said, ‘If I had not found\n the princess out, all your skill would have been of no use; therefore she\n ought to be mine.’ ‘Your seeing her would have been of no use,’ said the\n thief, ‘if I had not taken her away from the dragon; therefore she ought\n to be mine.’ ‘No, she is mine,’ said the huntsman; ‘for if I had not\n killed the dragon, he would, after all, have torn you and the princess\n into pieces.’ ‘And if I had not sewn the boat together again,’ said the\n tailor, ‘you would all have been drowned, therefore she is mine.’ Then the\n king put in a word, and said, ‘Each of you is right; and as all cannot\n have the young lady, the best way is for neither of you to have her: for\n the truth is, there is somebody she likes a great deal better. But to make\n up for your loss, I will give each of you, as a reward for his skill, half\n a kingdom.’ So the brothers agreed that this plan would be much better\n than either quarrelling or marrying a lady who had no mind to have them.\n And the king then gave to each half a kingdom, as he had said; and they\n lived very happily the rest of their days, and took good care of their\n father; and somebody took better care of the young lady, than to let\n either the dragon or one of the craftsmen have her again.', 'THE WILLOW-WREN AND THE BEAR\n\nOnce in summer-time the bear and the wolf were walking in the forest, and\n the bear heard a bird singing so beautifully that he said: ‘Brother wolf,\n what bird is it that sings so well?’ ‘That is the King of birds,’ said the\n wolf, ‘before whom we must bow down.’ In reality the bird was the\n willow-wren. ‘IF that’s the case,’ said the bear, ‘I should very much like\n to see his royal palace; come, take me thither.’ ‘That is not done quite\n as you seem to think,’ said the wolf; ‘you must wait until the Queen\n comes,’ Soon afterwards, the Queen arrived with some food in her beak, and\n the lord King came too, and they began to feed their young ones. The bear\n would have liked to go at once, but the wolf held him back by the sleeve,\n and said: ‘No, you must wait until the lord and lady Queen have gone away\n again.’ So they took stock of the hole where the nest lay, and trotted\n away. The bear, however, could not rest until he had seen the royal\n palace, and when a short time had passed, went to it again. The King and\n Queen had just flown out, so he peeped in and saw five or six young ones\n lying there. ‘Is that the royal palace?’ cried the bear; ‘it is a wretched\n palace, and you are not King’s children, you are disreputable children!’\n When the young wrens heard that, they were frightfully angry, and\n screamed: ‘No, that we are not! Our parents are honest people! Bear, you\n will have to pay for that!’\nThe bear and the wolf grew uneasy, and turned back and went into their\n holes. The young willow-wrens, however, continued to cry and scream, and\n when their parents again brought food they said: ‘We will not so much as\n touch one fly’s leg, no, not if we were dying of hunger, until you have\n settled whether we are respectable children or not; the bear has been here\n and has insulted us!’ Then the old King said: ‘Be easy, he shall be\n punished,’ and he at once flew with the Queen to the bear’s cave, and\n called in: ‘Old Growler, why have you insulted my children? You shall\n suffer for it—we will punish you by a bloody war.’ Thus war was\n announced to the Bear, and all four-footed animals were summoned to take\n part in it, oxen, asses, cows, deer, and every other animal the earth\n contained. And the willow-wren summoned everything which flew in the air,\n not only birds, large and small, but midges, and hornets, bees and flies\n had to come.\nWhen the time came for the war to begin, the willow-wren sent out spies to\n discover who was the enemy’s commander-in-chief. The gnat, who was the\n most crafty, flew into the forest where the enemy was assembled, and hid\n herself beneath a leaf of the tree where the password was to be announced.\n There stood the bear, and he called the fox before him and said: ‘Fox, you\n are the most cunning of all animals, you shall be general and lead us.’\n ‘Good,’ said the fox, ‘but what signal shall we agree upon?’ No one knew\n that, so the fox said: ‘I have a fine long bushy tail, which almost looks\n like a plume of red feathers. When I lift my tail up quite high, all is\n going well, and you must charge; but if I let it hang down, run away as\n fast as you can.’ When the gnat had heard that, she flew away again, and\n revealed everything, down to the minutest detail, to the willow-wren. When\n day broke, and the battle was to begin, all the four-footed animals came\n running up with such a noise that the earth trembled. The willow-wren with\n his army also came flying through the air with such a humming, and\n whirring, and swarming that every one was uneasy and afraid, and on both\n sides they advanced against each other. But the willow-wren sent down the\n hornet, with orders to settle beneath the fox’s tail, and sting with all\n his might. When the fox felt the first string, he started so that he\n lifted one leg, from pain, but he bore it, and still kept his tail high in\n the air; at the second sting, he was forced to put it down for a moment;\n at the third, he could hold out no longer, screamed, and put his tail\n between his legs. When the animals saw that, they thought all was lost,\n and began to flee, each into his hole, and the birds had won the battle.\nThen the King and Queen flew home to their children and cried: ‘Children,\n rejoice, eat and drink to your heart’s content, we have won the battle!’\n But the young wrens said: ‘We will not eat yet, the bear must come to the\n nest, and beg for pardon and say that we are honourable children, before\n we will do that.’ Then the willow-wren flew to the bear’s hole and cried:\n ‘Growler, you are to come to the nest to my children, and beg their\n pardon, or else every rib of your body shall be broken.’ So the bear crept\n thither in the greatest fear, and begged their pardon. And now at last the\n young wrens were satisfied, and sat down together and ate and drank, and\n made merry till quite late into the night.']","- In The Seven Ravens, the sister’s deep love for her brothers motivates her to endure great dangers, sacrifice part of her body to gain the key, and finally rescue them. The brothers’ return to their former selves and their reunion with family show the power of familial love and unity.

- In The Four Clever Brothers, each brother brings a different skill, and they cooperate to win the king’s challenge and rescue the princess. Their combined talents—thief, star-gazer, huntsman, and tailor—work together to achieve a shared goal, and the king’s solution to split the reward reinforces that teamwork and scaled collaboration are stronger than individual rivalry.

Overall, both tales teach that sibling love and cooperative effort—valuing each other’s gifts, supporting one another, and working toward a common goal—lead to triumph and harmony.","Both stories highlight sibling love and brotherhood and cooperation through the actions of their main characters. In the story of the seven ravens, the little sister sets out alone to save her seven brothers who were turned into ravens, showing deep sibling love and determination. She overcomes many hardships and ultimately frees her brothers, leading to a joyful family reunion. In the story of the four brothers, the siblings each learn a different skill and later cooperate to rescue the king’s daughter from a dragon. Each brother’s unique talent is essential to the success of their quest, and they work together to overcome challenges. In the end, instead of quarreling over the reward, they accept the king’s fair solution and live happily together. Both tales teach that love for siblings and cooperation among brothers and sisters can overcome great difficulties, and that working together brings about the best outcomes for everyone.",1.0,0.6111111111111112,0.73
How thems magic change and self-reinventin show up in both stories with the frog and Cat-skin girl?,"['CAT-SKIN\n\nThere was once a king, whose queen had hair of the purest gold, and was so\n beautiful that her match was not to be met with on the whole face of the\n earth. But this beautiful queen fell ill, and when she felt that her end\n drew near she called the king to her and said, ‘Promise me that you will\n never marry again, unless you meet with a wife who is as beautiful as I\n am, and who has golden hair like mine.’ Then when the king in his grief\n promised all she asked, she shut her eyes and died. But the king was not\n to be comforted, and for a long time never thought of taking another wife.\n At last, however, his wise men said, ‘this will not do; the king must\n marry again, that we may have a queen.’ So messengers were sent far and\n wide, to seek for a bride as beautiful as the late queen. But there was no\n princess in the world so beautiful; and if there had been, still there was\n not one to be found who had golden hair. So the messengers came home, and\n had had all their trouble for nothing.\nNow the king had a daughter, who was just as beautiful as her mother, and\n had the same golden hair. And when she was grown up, the king looked at\n her and saw that she was just like this late queen: then he said to his\n courtiers, ‘May I not marry my daughter? She is the very image of my dead\n wife: unless I have her, I shall not find any bride upon the whole earth,\n and you say there must be a queen.’ When the courtiers heard this they\n were shocked, and said, ‘Heaven forbid that a father should marry his\n daughter! Out of so great a sin no good can come.’ And his daughter was\n also shocked, but hoped the king would soon give up such thoughts; so she\n said to him, ‘Before I marry anyone I must have three dresses: one must be\n of gold, like the sun; another must be of shining silver, like the moon;\n and a third must be dazzling as the stars: besides this, I want a mantle\n of a thousand different kinds of fur put together, to which every beast in\n the kingdom must give a part of his skin.’ And thus she thought he would\n think of the matter no more. But the king made the most skilful workmen in\n his kingdom weave the three dresses: one golden, like the sun; another\n silvery, like the moon; and a third sparkling, like the stars: and his\n hunters were told to hunt out all the beasts in his kingdom, and to take\n the finest fur out of their skins: and thus a mantle of a thousand furs\n was made.\nWhen all were ready, the king sent them to her; but she got up in the\n night when all were asleep, and took three of her trinkets, a golden ring,\n a golden necklace, and a golden brooch, and packed the three dresses—of\n the sun, the moon, and the stars—up in a nutshell, and wrapped\n herself up in the mantle made of all sorts of fur, and besmeared her face\n and hands with soot. Then she threw herself upon Heaven for help in her\n need, and went away, and journeyed on the whole night, till at last she\n came to a large wood. As she was very tired, she sat herself down in the\n hollow of a tree and soon fell asleep: and there she slept on till it was\n midday.\nNow as the king to whom the wood belonged was hunting in it, his dogs came\n to the tree, and began to snuff about, and run round and round, and bark.\n ‘Look sharp!’ said the king to the huntsmen, ‘and see what sort of game\n lies there.’ And the huntsmen went up to the tree, and when they came back\n again said, ‘In the hollow tree there lies a most wonderful beast, such as\n we never saw before; its skin seems to be of a thousand kinds of fur, but\n there it lies fast asleep.’ ‘See,’ said the king, ‘if you can catch it\n alive, and we will take it with us.’ So the huntsmen took it up, and the\n maiden awoke and was greatly frightened, and said, ‘I am a poor child that\n has neither father nor mother left; have pity on me and take me with you.’\n Then they said, ‘Yes, Miss Cat-skin, you will do for the kitchen; you can\n sweep up the ashes, and do things of that sort.’ So they put her into the\n coach, and took her home to the king’s palace. Then they showed her a\n little corner under the staircase, where no light of day ever peeped in,\n and said, ‘Cat-skin, you may lie and sleep there.’ And she was sent into\n the kitchen, and made to fetch wood and water, to blow the fire, pluck the\n poultry, pick the herbs, sift the ashes, and do all the dirty work.\nThus Cat-skin lived for a long time very sorrowfully. ‘Ah! pretty\n princess!’ thought she, ‘what will now become of thee?’ But it happened\n one day that a feast was to be held in the king’s castle, so she said to\n the cook, ‘May I go up a little while and see what is going on? I will\n take care and stand behind the door.’ And the cook said, ‘Yes, you may go,\n but be back again in half an hour’s time, to rake out the ashes.’ Then she\n took her little lamp, and went into her cabin, and took off the fur skin,\n and washed the soot from off her face and hands, so that her beauty shone\n forth like the sun from behind the clouds. She next opened her nutshell,\n and brought out of it the dress that shone like the sun, and so went to\n the feast. Everyone made way for her, for nobody knew her, and they\n thought she could be no less than a king’s daughter. But the king came up\n to her, and held out his hand and danced with her; and he thought in his\n heart, ‘I never saw any one half so beautiful.’\nWhen the dance was at an end she curtsied; and when the king looked round\n for her, she was gone, no one knew wither. The guards that stood at the\n castle gate were called in: but they had seen no one. The truth was, that\n she had run into her little cabin, pulled off her dress, blackened her\n face and hands, put on the fur-skin cloak, and was Cat-skin again. When\n she went into the kitchen to her work, and began to rake the ashes, the\n cook said, ‘Let that alone till the morning, and heat the king’s soup; I\n should like to run up now and give a peep: but take care you don’t let a\n hair fall into it, or you will run a chance of never eating again.’\nAs soon as the cook went away, Cat-skin heated the king’s soup, and\n toasted a slice of bread first, as nicely as ever she could; and when it\n was ready, she went and looked in the cabin for her little golden ring,\n and put it into the dish in which the soup was. When the dance was over,\n the king ordered his soup to be brought in; and it pleased him so well,\n that he thought he had never tasted any so good before. At the bottom he\n saw a gold ring lying; and as he could not make out how it had got there,\n he ordered the cook to be sent for. The cook was frightened when he heard\n the order, and said to Cat-skin, ‘You must have let a hair fall into the\n soup; if it be so, you will have a good beating.’ Then he went before the\n king, and he asked him who had cooked the soup. ‘I did,’ answered the\n cook. But the king said, ‘That is not true; it was better done than you\n could do it.’ Then he answered, ‘To tell the truth I did not cook it, but\n Cat-skin did.’ ‘Then let Cat-skin come up,’ said the king: and when she\n came he said to her, ‘Who are you?’ ‘I am a poor child,’ said she, ‘that\n has lost both father and mother.’ ‘How came you in my palace?’ asked he.\n ‘I am good for nothing,’ said she, ‘but to be scullion-girl, and to have\n boots and shoes thrown at my head.’ ‘But how did you get the ring that was\n in the soup?’ asked the king. Then she would not own that she knew\n anything about the ring; so the king sent her away again about her\n business.\nAfter a time there was another feast, and Cat-skin asked the cook to let\n her go up and see it as before. ‘Yes,’ said he, ‘but come again in half an\n hour, and cook the king the soup that he likes so much.’ Then she ran to\n her little cabin, washed herself quickly, and took her dress out which was\n silvery as the moon, and put it on; and when she went in, looking like a\n king’s daughter, the king went up to her, and rejoiced at seeing her\n again, and when the dance began he danced with her. After the dance was at\n an end she managed to slip out, so slyly that the king did not see where\n she was gone; but she sprang into her little cabin, and made herself into\n Cat-skin again, and went into the kitchen to cook the soup. Whilst the\n cook was above stairs, she got the golden necklace and dropped it into the\n soup; then it was brought to the king, who ate it, and it pleased him as\n well as before; so he sent for the cook, who was again forced to tell him\n that Cat-skin had cooked it. Cat-skin was brought again before the king,\n but she still told him that she was only fit to have boots and shoes\n thrown at her head.\nBut when the king had ordered a feast to be got ready for the third time,\n it happened just the same as before. ‘You must be a witch, Cat-skin,’ said\n the cook; ‘for you always put something into your soup, so that it pleases\n the king better than mine.’ However, he let her go up as before. Then she\n put on her dress which sparkled like the stars, and went into the\n ball-room in it; and the king danced with her again, and thought she had\n never looked so beautiful as she did then. So whilst he was dancing with\n her, he put a gold ring on her finger without her seeing it, and ordered\n that the dance should be kept up a long time. When it was at an end, he\n would have held her fast by the hand, but she slipped away, and sprang so\n quickly through the crowd that he lost sight of her: and she ran as fast\n as she could into her little cabin under the stairs. But this time she\n kept away too long, and stayed beyond the half-hour; so she had not time\n to take off her fine dress, and threw her fur mantle over it, and in her\n haste did not blacken herself all over with soot, but left one of her\n fingers white.\nThen she ran into the kitchen, and cooked the king’s soup; and as soon as\n the cook was gone, she put the golden brooch into the dish. When the king\n got to the bottom, he ordered Cat-skin to be called once more, and soon\n saw the white finger, and the ring that he had put on it whilst they were\n dancing: so he seized her hand, and kept fast hold of it, and when she\n wanted to loose herself and spring away, the fur cloak fell off a little\n on one side, and the starry dress sparkled underneath it.\nThen he got hold of the fur and tore it off, and her golden hair and\n beautiful form were seen, and she could no longer hide herself: so she\n washed the soot and ashes from her face, and showed herself to be the most\n beautiful princess upon the face of the earth. But the king said, ‘You are\n my beloved bride, and we will never more be parted from each other.’ And\n the wedding feast was held, and a merry day it was, as ever was heard of\n or seen in that country, or indeed in any other.', 'THE FOX AND THE CAT\n\nIt happened that the cat met the fox in a forest, and as she thought to\n herself: ‘He is clever and full of experience, and much esteemed in the\n world,’ she spoke to him in a friendly way. ‘Good day, dear Mr Fox, how\n are you? How is all with you? How are you getting on in these hard times?’\n The fox, full of all kinds of arrogance, looked at the cat from head to\n foot, and for a long time did not know whether he would give any answer or\n not. At last he said: ‘Oh, you wretched beard-cleaner, you piebald fool,\n you hungry mouse-hunter, what can you be thinking of? Have you the cheek\n to ask how I am getting on? What have you learnt? How many arts do you\n understand?’ ‘I understand but one,’ replied the cat, modestly. ‘What art\n is that?’ asked the fox. ‘When the hounds are following me, I can spring\n into a tree and save myself.’ ‘Is that all?’ said the fox. ‘I am master of\n a hundred arts, and have into the bargain a sackful of cunning. You make\n me sorry for you; come with me, I will teach you how people get away from\n the hounds.’ Just then came a hunter with four dogs. The cat sprang nimbly\n up a tree, and sat down at the top of it, where the branches and foliage\n quite concealed her. ‘Open your sack, Mr Fox, open your sack,’ cried the\n cat to him, but the dogs had already seized him, and were holding him\n fast. ‘Ah, Mr Fox,’ cried the cat. ‘You with your hundred arts are left in\n the lurch! Had you been able to climb like me, you would not have lost\n your life.’', 'THE FROG-PRINCE\n\nOne fine evening a young princess put on her bonnet and clogs, and went\n out to take a walk by herself in a wood; and when she came to a cool\n spring of water, that rose in the midst of it, she sat herself down to\n rest a while. Now she had a golden ball in her hand, which was her\n favourite plaything; and she was always tossing it up into the air, and\n catching it again as it fell. After a time she threw it up so high that\n she missed catching it as it fell; and the ball bounded away, and rolled\n along upon the ground, till at last it fell down into the spring. The\n princess looked into the spring after her ball, but it was very deep, so\n deep that she could not see the bottom of it. Then she began to bewail her\n loss, and said, ‘Alas! if I could only get my ball again, I would give all\n my fine clothes and jewels, and everything that I have in the world.’\nWhilst she was speaking, a frog put its head out of the water, and said,\n ‘Princess, why do you weep so bitterly?’ ‘Alas!’ said she, ‘what can you\n do for me, you nasty frog? My golden ball has fallen into the spring.’ The\n frog said, ‘I want not your pearls, and jewels, and fine clothes; but if\n you will love me, and let me live with you and eat from off your golden\n plate, and sleep upon your bed, I will bring you your ball again.’ ‘What\n nonsense,’ thought the princess, ‘this silly frog is talking! He can never\n even get out of the spring to visit me, though he may be able to get my\n ball for me, and therefore I will tell him he shall have what he asks.’ So\n she said to the frog, ‘Well, if you will bring me my ball, I will do all\n you ask.’ Then the frog put his head down, and dived deep under the water;\n and after a little while he came up again, with the ball in his mouth, and\n threw it on the edge of the spring. As soon as the young princess saw her\n ball, she ran to pick it up; and she was so overjoyed to have it in her\n hand again, that she never thought of the frog, but ran home with it as\n fast as she could. The frog called after her, ‘Stay, princess, and take me\n with you as you said,’ But she did not stop to hear a word.\nThe next day, just as the princess had sat down to dinner, she heard a\n strange noise—tap, tap—plash, plash—as if something was\n coming up the marble staircase: and soon afterwards there was a gentle\n knock at the door, and a little voice cried out and said:\n‘Open the door, my princess dear,\n Open the door to thy true love here!\n And mind the words that thou and I said\n By the fountain cool, in the greenwood shade.’\nThen the princess ran to the door and opened it, and there she saw the\n frog, whom she had quite forgotten. At this sight she was sadly\n frightened, and shutting the door as fast as she could came back to her\n seat. The king, her father, seeing that something had frightened her,\n asked her what was the matter. ‘There is a nasty frog,’ said she, ‘at the\n door, that lifted my ball for me out of the spring this morning: I told\n him that he should live with me here, thinking that he could never get out\n of the spring; but there he is at the door, and he wants to come in.’\nWhile she was speaking the frog knocked again at the door, and said:\n‘Open the door, my princess dear,\n Open the door to thy true love here!\n And mind the words that thou and I said\n By the fountain cool, in the greenwood shade.’\nThen the king said to the young princess, ‘As you have given your word you\n must keep it; so go and let him in.’ She did so, and the frog hopped into\n the room, and then straight on—tap, tap—plash, plash—from\n the bottom of the room to the top, till he came up close to the table\n where the princess sat. ‘Pray lift me upon chair,’ said he to the\n princess, ‘and let me sit next to you.’ As soon as she had done this, the\n frog said, ‘Put your plate nearer to me, that I may eat out of it.’ This\n she did, and when he had eaten as much as he could, he said, ‘Now I am\n tired; carry me upstairs, and put me into your bed.’ And the princess,\n though very unwilling, took him up in her hand, and put him upon the\n pillow of her own bed, where he slept all night long. As soon as it was\n light he jumped up, hopped downstairs, and went out of the house. ‘Now,\n then,’ thought the princess, ‘at last he is gone, and I shall be troubled\n with him no more.’\nBut she was mistaken; for when night came again she heard the same tapping\n at the door; and the frog came once more, and said:\n‘Open the door, my princess dear,\n Open the door to thy true love here!\n And mind the words that thou and I said\n By the fountain cool, in the greenwood shade.’\nAnd when the princess opened the door the frog came in, and slept upon her\n pillow as before, till the morning broke. And the third night he did the\n same. But when the princess awoke on the following morning she was\n astonished to see, instead of the frog, a handsome prince, gazing on her\n with the most beautiful eyes she had ever seen, and standing at the head\n of her bed.\nHe told her that he had been enchanted by a spiteful fairy, who had\n changed him into a frog; and that he had been fated so to abide till some\n princess should take him out of the spring, and let him eat from her\n plate, and sleep upon her bed for three nights. ‘You,’ said the prince,\n ‘have broken his cruel charm, and now I have nothing to wish for but that\n you should go with me into my father’s kingdom, where I will marry you,\n and love you as long as you live.’\nThe young princess, you may be sure, was not long in saying ‘Yes’ to all\n this; and as they spoke a gay coach drove up, with eight beautiful horses,\n decked with plumes of feathers and a golden harness; and behind the coach\n rode the prince’s servant, faithful Heinrich, who had bewailed the\n misfortunes of his dear master during his enchantment so long and so\n bitterly, that his heart had well-nigh burst.\nThey then took leave of the king, and got into the coach with eight\n horses, and all set out, full of joy and merriment, for the prince’s\n kingdom, which they reached safely; and there they lived happily a great\n many years.']","- Both tales hinge on magical change that redefines who the characters are.
- Frog-Prince: The frog is enchanted into a prince and later transformed back into a human when the princess honors her promise and lets him stay and sleep with her for three nights. The princess’s relationship with him shifts through magic into a true royal union.
- Cat-skin: The girl secretly reinvents herself through magical disguises—three dresses (golden sun, silver moon, starry) and a fur mantle—plus soot masking her beauty. She uses these disguises to move between a hidden kitchen servant and a radiant princess, ultimately revealing her true identity when the truth is uncovered.
- In both, transformation isn’t just appearance: it enables a new social role (prince/queen) and requires the protagonists’ actions (keeping a promise, choosing to disguise and reclaim identity) to solidify the change.","In first story, frog was really a prince what got changed by a fairy, and he turn back to hisself after princess let him eat from her plate and sleep on her bed for three nights. That be magic change and he get new life. In second story, Cat-skin girl run away from her home, put on fur cloak and soot to hide who she is, and work in kitchen. She change how she look and live, then later show her true self at the feast and become queen. Both stories got magic change and self-reinventin, with folks turnin into somethin else and then back again.",0.6,0.42105263157894735,0.65
How do the stories of the enchanted frog prince and Cat-skin both illustrate the themes of transformation and enchantment as well as transformation and self-reinvention?,"['THE FROG-PRINCE\n\nOne fine evening a young princess put on her bonnet and clogs, and went\n out to take a walk by herself in a wood; and when she came to a cool\n spring of water, that rose in the midst of it, she sat herself down to\n rest a while. Now she had a golden ball in her hand, which was her\n favourite plaything; and she was always tossing it up into the air, and\n catching it again as it fell. After a time she threw it up so high that\n she missed catching it as it fell; and the ball bounded away, and rolled\n along upon the ground, till at last it fell down into the spring. The\n princess looked into the spring after her ball, but it was very deep, so\n deep that she could not see the bottom of it. Then she began to bewail her\n loss, and said, ‘Alas! if I could only get my ball again, I would give all\n my fine clothes and jewels, and everything that I have in the world.’\nWhilst she was speaking, a frog put its head out of the water, and said,\n ‘Princess, why do you weep so bitterly?’ ‘Alas!’ said she, ‘what can you\n do for me, you nasty frog? My golden ball has fallen into the spring.’ The\n frog said, ‘I want not your pearls, and jewels, and fine clothes; but if\n you will love me, and let me live with you and eat from off your golden\n plate, and sleep upon your bed, I will bring you your ball again.’ ‘What\n nonsense,’ thought the princess, ‘this silly frog is talking! He can never\n even get out of the spring to visit me, though he may be able to get my\n ball for me, and therefore I will tell him he shall have what he asks.’ So\n she said to the frog, ‘Well, if you will bring me my ball, I will do all\n you ask.’ Then the frog put his head down, and dived deep under the water;\n and after a little while he came up again, with the ball in his mouth, and\n threw it on the edge of the spring. As soon as the young princess saw her\n ball, she ran to pick it up; and she was so overjoyed to have it in her\n hand again, that she never thought of the frog, but ran home with it as\n fast as she could. The frog called after her, ‘Stay, princess, and take me\n with you as you said,’ But she did not stop to hear a word.\nThe next day, just as the princess had sat down to dinner, she heard a\n strange noise—tap, tap—plash, plash—as if something was\n coming up the marble staircase: and soon afterwards there was a gentle\n knock at the door, and a little voice cried out and said:\n‘Open the door, my princess dear,\n Open the door to thy true love here!\n And mind the words that thou and I said\n By the fountain cool, in the greenwood shade.’\nThen the princess ran to the door and opened it, and there she saw the\n frog, whom she had quite forgotten. At this sight she was sadly\n frightened, and shutting the door as fast as she could came back to her\n seat. The king, her father, seeing that something had frightened her,\n asked her what was the matter. ‘There is a nasty frog,’ said she, ‘at the\n door, that lifted my ball for me out of the spring this morning: I told\n him that he should live with me here, thinking that he could never get out\n of the spring; but there he is at the door, and he wants to come in.’\nWhile she was speaking the frog knocked again at the door, and said:\n‘Open the door, my princess dear,\n Open the door to thy true love here!\n And mind the words that thou and I said\n By the fountain cool, in the greenwood shade.’\nThen the king said to the young princess, ‘As you have given your word you\n must keep it; so go and let him in.’ She did so, and the frog hopped into\n the room, and then straight on—tap, tap—plash, plash—from\n the bottom of the room to the top, till he came up close to the table\n where the princess sat. ‘Pray lift me upon chair,’ said he to the\n princess, ‘and let me sit next to you.’ As soon as she had done this, the\n frog said, ‘Put your plate nearer to me, that I may eat out of it.’ This\n she did, and when he had eaten as much as he could, he said, ‘Now I am\n tired; carry me upstairs, and put me into your bed.’ And the princess,\n though very unwilling, took him up in her hand, and put him upon the\n pillow of her own bed, where he slept all night long. As soon as it was\n light he jumped up, hopped downstairs, and went out of the house. ‘Now,\n then,’ thought the princess, ‘at last he is gone, and I shall be troubled\n with him no more.’\nBut she was mistaken; for when night came again she heard the same tapping\n at the door; and the frog came once more, and said:\n‘Open the door, my princess dear,\n Open the door to thy true love here!\n And mind the words that thou and I said\n By the fountain cool, in the greenwood shade.’\nAnd when the princess opened the door the frog came in, and slept upon her\n pillow as before, till the morning broke. And the third night he did the\n same. But when the princess awoke on the following morning she was\n astonished to see, instead of the frog, a handsome prince, gazing on her\n with the most beautiful eyes she had ever seen, and standing at the head\n of her bed.\nHe told her that he had been enchanted by a spiteful fairy, who had\n changed him into a frog; and that he had been fated so to abide till some\n princess should take him out of the spring, and let him eat from her\n plate, and sleep upon her bed for three nights. ‘You,’ said the prince,\n ‘have broken his cruel charm, and now I have nothing to wish for but that\n you should go with me into my father’s kingdom, where I will marry you,\n and love you as long as you live.’\nThe young princess, you may be sure, was not long in saying ‘Yes’ to all\n this; and as they spoke a gay coach drove up, with eight beautiful horses,\n decked with plumes of feathers and a golden harness; and behind the coach\n rode the prince’s servant, faithful Heinrich, who had bewailed the\n misfortunes of his dear master during his enchantment so long and so\n bitterly, that his heart had well-nigh burst.\nThey then took leave of the king, and got into the coach with eight\n horses, and all set out, full of joy and merriment, for the prince’s\n kingdom, which they reached safely; and there they lived happily a great\n many years.', 'CAT-SKIN\n\nThere was once a king, whose queen had hair of the purest gold, and was so\n beautiful that her match was not to be met with on the whole face of the\n earth. But this beautiful queen fell ill, and when she felt that her end\n drew near she called the king to her and said, ‘Promise me that you will\n never marry again, unless you meet with a wife who is as beautiful as I\n am, and who has golden hair like mine.’ Then when the king in his grief\n promised all she asked, she shut her eyes and died. But the king was not\n to be comforted, and for a long time never thought of taking another wife.\n At last, however, his wise men said, ‘this will not do; the king must\n marry again, that we may have a queen.’ So messengers were sent far and\n wide, to seek for a bride as beautiful as the late queen. But there was no\n princess in the world so beautiful; and if there had been, still there was\n not one to be found who had golden hair. So the messengers came home, and\n had had all their trouble for nothing.\nNow the king had a daughter, who was just as beautiful as her mother, and\n had the same golden hair. And when she was grown up, the king looked at\n her and saw that she was just like this late queen: then he said to his\n courtiers, ‘May I not marry my daughter? She is the very image of my dead\n wife: unless I have her, I shall not find any bride upon the whole earth,\n and you say there must be a queen.’ When the courtiers heard this they\n were shocked, and said, ‘Heaven forbid that a father should marry his\n daughter! Out of so great a sin no good can come.’ And his daughter was\n also shocked, but hoped the king would soon give up such thoughts; so she\n said to him, ‘Before I marry anyone I must have three dresses: one must be\n of gold, like the sun; another must be of shining silver, like the moon;\n and a third must be dazzling as the stars: besides this, I want a mantle\n of a thousand different kinds of fur put together, to which every beast in\n the kingdom must give a part of his skin.’ And thus she thought he would\n think of the matter no more. But the king made the most skilful workmen in\n his kingdom weave the three dresses: one golden, like the sun; another\n silvery, like the moon; and a third sparkling, like the stars: and his\n hunters were told to hunt out all the beasts in his kingdom, and to take\n the finest fur out of their skins: and thus a mantle of a thousand furs\n was made.\nWhen all were ready, the king sent them to her; but she got up in the\n night when all were asleep, and took three of her trinkets, a golden ring,\n a golden necklace, and a golden brooch, and packed the three dresses—of\n the sun, the moon, and the stars—up in a nutshell, and wrapped\n herself up in the mantle made of all sorts of fur, and besmeared her face\n and hands with soot. Then she threw herself upon Heaven for help in her\n need, and went away, and journeyed on the whole night, till at last she\n came to a large wood. As she was very tired, she sat herself down in the\n hollow of a tree and soon fell asleep: and there she slept on till it was\n midday.\nNow as the king to whom the wood belonged was hunting in it, his dogs came\n to the tree, and began to snuff about, and run round and round, and bark.\n ‘Look sharp!’ said the king to the huntsmen, ‘and see what sort of game\n lies there.’ And the huntsmen went up to the tree, and when they came back\n again said, ‘In the hollow tree there lies a most wonderful beast, such as\n we never saw before; its skin seems to be of a thousand kinds of fur, but\n there it lies fast asleep.’ ‘See,’ said the king, ‘if you can catch it\n alive, and we will take it with us.’ So the huntsmen took it up, and the\n maiden awoke and was greatly frightened, and said, ‘I am a poor child that\n has neither father nor mother left; have pity on me and take me with you.’\n Then they said, ‘Yes, Miss Cat-skin, you will do for the kitchen; you can\n sweep up the ashes, and do things of that sort.’ So they put her into the\n coach, and took her home to the king’s palace. Then they showed her a\n little corner under the staircase, where no light of day ever peeped in,\n and said, ‘Cat-skin, you may lie and sleep there.’ And she was sent into\n the kitchen, and made to fetch wood and water, to blow the fire, pluck the\n poultry, pick the herbs, sift the ashes, and do all the dirty work.\nThus Cat-skin lived for a long time very sorrowfully. ‘Ah! pretty\n princess!’ thought she, ‘what will now become of thee?’ But it happened\n one day that a feast was to be held in the king’s castle, so she said to\n the cook, ‘May I go up a little while and see what is going on? I will\n take care and stand behind the door.’ And the cook said, ‘Yes, you may go,\n but be back again in half an hour’s time, to rake out the ashes.’ Then she\n took her little lamp, and went into her cabin, and took off the fur skin,\n and washed the soot from off her face and hands, so that her beauty shone\n forth like the sun from behind the clouds. She next opened her nutshell,\n and brought out of it the dress that shone like the sun, and so went to\n the feast. Everyone made way for her, for nobody knew her, and they\n thought she could be no less than a king’s daughter. But the king came up\n to her, and held out his hand and danced with her; and he thought in his\n heart, ‘I never saw any one half so beautiful.’\nWhen the dance was at an end she curtsied; and when the king looked round\n for her, she was gone, no one knew wither. The guards that stood at the\n castle gate were called in: but they had seen no one. The truth was, that\n she had run into her little cabin, pulled off her dress, blackened her\n face and hands, put on the fur-skin cloak, and was Cat-skin again. When\n she went into the kitchen to her work, and began to rake the ashes, the\n cook said, ‘Let that alone till the morning, and heat the king’s soup; I\n should like to run up now and give a peep: but take care you don’t let a\n hair fall into it, or you will run a chance of never eating again.’\nAs soon as the cook went away, Cat-skin heated the king’s soup, and\n toasted a slice of bread first, as nicely as ever she could; and when it\n was ready, she went and looked in the cabin for her little golden ring,\n and put it into the dish in which the soup was. When the dance was over,\n the king ordered his soup to be brought in; and it pleased him so well,\n that he thought he had never tasted any so good before. At the bottom he\n saw a gold ring lying; and as he could not make out how it had got there,\n he ordered the cook to be sent for. The cook was frightened when he heard\n the order, and said to Cat-skin, ‘You must have let a hair fall into the\n soup; if it be so, you will have a good beating.’ Then he went before the\n king, and he asked him who had cooked the soup. ‘I did,’ answered the\n cook. But the king said, ‘That is not true; it was better done than you\n could do it.’ Then he answered, ‘To tell the truth I did not cook it, but\n Cat-skin did.’ ‘Then let Cat-skin come up,’ said the king: and when she\n came he said to her, ‘Who are you?’ ‘I am a poor child,’ said she, ‘that\n has lost both father and mother.’ ‘How came you in my palace?’ asked he.\n ‘I am good for nothing,’ said she, ‘but to be scullion-girl, and to have\n boots and shoes thrown at my head.’ ‘But how did you get the ring that was\n in the soup?’ asked the king. Then she would not own that she knew\n anything about the ring; so the king sent her away again about her\n business.\nAfter a time there was another feast, and Cat-skin asked the cook to let\n her go up and see it as before. ‘Yes,’ said he, ‘but come again in half an\n hour, and cook the king the soup that he likes so much.’ Then she ran to\n her little cabin, washed herself quickly, and took her dress out which was\n silvery as the moon, and put it on; and when she went in, looking like a\n king’s daughter, the king went up to her, and rejoiced at seeing her\n again, and when the dance began he danced with her. After the dance was at\n an end she managed to slip out, so slyly that the king did not see where\n she was gone; but she sprang into her little cabin, and made herself into\n Cat-skin again, and went into the kitchen to cook the soup. Whilst the\n cook was above stairs, she got the golden necklace and dropped it into the\n soup; then it was brought to the king, who ate it, and it pleased him as\n well as before; so he sent for the cook, who was again forced to tell him\n that Cat-skin had cooked it. Cat-skin was brought again before the king,\n but she still told him that she was only fit to have boots and shoes\n thrown at her head.\nBut when the king had ordered a feast to be got ready for the third time,\n it happened just the same as before. ‘You must be a witch, Cat-skin,’ said\n the cook; ‘for you always put something into your soup, so that it pleases\n the king better than mine.’ However, he let her go up as before. Then she\n put on her dress which sparkled like the stars, and went into the\n ball-room in it; and the king danced with her again, and thought she had\n never looked so beautiful as she did then. So whilst he was dancing with\n her, he put a gold ring on her finger without her seeing it, and ordered\n that the dance should be kept up a long time. When it was at an end, he\n would have held her fast by the hand, but she slipped away, and sprang so\n quickly through the crowd that he lost sight of her: and she ran as fast\n as she could into her little cabin under the stairs. But this time she\n kept away too long, and stayed beyond the half-hour; so she had not time\n to take off her fine dress, and threw her fur mantle over it, and in her\n haste did not blacken herself all over with soot, but left one of her\n fingers white.\nThen she ran into the kitchen, and cooked the king’s soup; and as soon as\n the cook was gone, she put the golden brooch into the dish. When the king\n got to the bottom, he ordered Cat-skin to be called once more, and soon\n saw the white finger, and the ring that he had put on it whilst they were\n dancing: so he seized her hand, and kept fast hold of it, and when she\n wanted to loose herself and spring away, the fur cloak fell off a little\n on one side, and the starry dress sparkled underneath it.\nThen he got hold of the fur and tore it off, and her golden hair and\n beautiful form were seen, and she could no longer hide herself: so she\n washed the soot and ashes from her face, and showed herself to be the most\n beautiful princess upon the face of the earth. But the king said, ‘You are\n my beloved bride, and we will never more be parted from each other.’ And\n the wedding feast was held, and a merry day it was, as ever was heard of\n or seen in that country, or indeed in any other.', 'RAPUNZEL\n\nThere were once a man and a woman who had long in vain wished for a child.\n At length the woman hoped that God was about to grant her desire. These\n people had a little window at the back of their house from which a\n splendid garden could be seen, which was full of the most beautiful\n flowers and herbs. It was, however, surrounded by a high wall, and no one\n dared to go into it because it belonged to an enchantress, who had great\n power and was dreaded by all the world. One day the woman was standing by\n this window and looking down into the garden, when she saw a bed which was\n planted with the most beautiful rampion (rapunzel), and it looked so fresh\n and green that she longed for it, she quite pined away, and began to look\n pale and miserable. Then her husband was alarmed, and asked: ‘What ails\n you, dear wife?’ ‘Ah,’ she replied, ‘if I can’t eat some of the rampion,\n which is in the garden behind our house, I shall die.’ The man, who loved\n her, thought: ‘Sooner than let your wife die, bring her some of the\n rampion yourself, let it cost what it will.’ At twilight, he clambered\n down over the wall into the garden of the enchantress, hastily clutched a\n handful of rampion, and took it to his wife. She at once made herself a\n salad of it, and ate it greedily. It tasted so good to her—so very\n good, that the next day she longed for it three times as much as before.\n If he was to have any rest, her husband must once more descend into the\n garden. In the gloom of evening therefore, he let himself down again; but\n when he had clambered down the wall he was terribly afraid, for he saw the\n enchantress standing before him. ‘How can you dare,’ said she with angry\n look, ‘descend into my garden and steal my rampion like a thief? You shall\n suffer for it!’ ‘Ah,’ answered he, ‘let mercy take the place of justice, I\n only made up my mind to do it out of necessity. My wife saw your rampion\n from the window, and felt such a longing for it that she would have died\n if she had not got some to eat.’ Then the enchantress allowed her anger to\n be softened, and said to him: ‘If the case be as you say, I will allow you\n to take away with you as much rampion as you will, only I make one\n condition, you must give me the child which your wife will bring into the\n world; it shall be well treated, and I will care for it like a mother.’\n The man in his terror consented to everything, and when the woman was\n brought to bed, the enchantress appeared at once, gave the child the name\n of Rapunzel, and took it away with her.\nRapunzel grew into the most beautiful child under the sun. When she was\n twelve years old, the enchantress shut her into a tower, which lay in a\n forest, and had neither stairs nor door, but quite at the top was a little\n window. When the enchantress wanted to go in, she placed herself beneath\n it and cried:\n‘Rapunzel, Rapunzel,\n Let down your hair to me.’\nRapunzel had magnificent long hair, fine as spun gold, and when she heard\n the voice of the enchantress she unfastened her braided tresses, wound\n them round one of the hooks of the window above, and then the hair fell\n twenty ells down, and the enchantress climbed up by it.\nAfter a year or two, it came to pass that the king’s son rode through the\n forest and passed by the tower. Then he heard a song, which was so\n charming that he stood still and listened. This was Rapunzel, who in her\n solitude passed her time in letting her sweet voice resound. The king’s\n son wanted to climb up to her, and looked for the door of the tower, but\n none was to be found. He rode home, but the singing had so deeply touched\n his heart, that every day he went out into the forest and listened to it.\n Once when he was thus standing behind a tree, he saw that an enchantress\n came there, and he heard how she cried:\n‘Rapunzel, Rapunzel,\n Let down your hair to me.’\nThen Rapunzel let down the braids of her hair, and the enchantress climbed\n up to her. ‘If that is the ladder by which one mounts, I too will try my\n fortune,’ said he, and the next day when it began to grow dark, he went to\n the tower and cried:\n‘Rapunzel, Rapunzel,\n Let down your hair to me.’\nImmediately the hair fell down and the king’s son climbed up.\nAt first Rapunzel was terribly frightened when a man, such as her eyes had\n never yet beheld, came to her; but the king’s son began to talk to her\n quite like a friend, and told her that his heart had been so stirred that\n it had let him have no rest, and he had been forced to see her. Then\n Rapunzel lost her fear, and when he asked her if she would take him for\n her husband, and she saw that he was young and handsome, she thought: ‘He\n will love me more than old Dame Gothel does’; and she said yes, and laid\n her hand in his. She said: ‘I will willingly go away with you, but I do\n not know how to get down. Bring with you a skein of silk every time that\n you come, and I will weave a ladder with it, and when that is ready I will\n descend, and you will take me on your horse.’ They agreed that until that\n time he should come to her every evening, for the old woman came by day.\n The enchantress remarked nothing of this, until once Rapunzel said to her:\n ‘Tell me, Dame Gothel, how it happens that you are so much heavier for me\n to draw up than the young king’s son—he is with me in a moment.’\n ‘Ah! you wicked child,’ cried the enchantress. ‘What do I hear you say! I\n thought I had separated you from all the world, and yet you have deceived\n me!’ In her anger she clutched Rapunzel’s beautiful tresses, wrapped them\n twice round her left hand, seized a pair of scissors with the right, and\n snip, snap, they were cut off, and the lovely braids lay on the ground.\n And she was so pitiless that she took poor Rapunzel into a desert where\n she had to live in great grief and misery.\nOn the same day that she cast out Rapunzel, however, the enchantress\n fastened the braids of hair, which she had cut off, to the hook of the\n window, and when the king’s son came and cried:\n‘Rapunzel, Rapunzel,\n Let down your hair to me.’\nshe let the hair down. The king’s son ascended, but instead of finding his\n dearest Rapunzel, he found the enchantress, who gazed at him with wicked\n and venomous looks. ‘Aha!’ she cried mockingly, ‘you would fetch your\n dearest, but the beautiful bird sits no longer singing in the nest; the\n cat has got it, and will scratch out your eyes as well. Rapunzel is lost\n to you; you will never see her again.’ The king’s son was beside himself\n with pain, and in his despair he leapt down from the tower. He escaped\n with his life, but the thorns into which he fell pierced his eyes. Then he\n wandered quite blind about the forest, ate nothing but roots and berries,\n and did naught but lament and weep over the loss of his dearest wife. Thus\n he roamed about in misery for some years, and at length came to the desert\n where Rapunzel, with the twins to which she had given birth, a boy and a\n girl, lived in wretchedness. He heard a voice, and it seemed so familiar\n to him that he went towards it, and when he approached, Rapunzel knew him\n and fell on his neck and wept. Two of her tears wetted his eyes and they\n grew clear again, and he could see with them as before. He led her to his\n kingdom where he was joyfully received, and they lived for a long time\n afterwards, happy and contented.']","Both tales center on enchantment that alters outward form and life, and on characters remaking themselves through action.

- The Frog Prince shows a literal enchantment: a prince is changed into a frog by a spiteful fairy, and only a princess’s act of keeping her word and letting him eat from her plate and sleep in her bed can break the spell. The transformation is finally resolved when desire, loyalty, and courage catalyze a return to humanity and a new shared life.

- Cat-skin centers on self-reinvention through disguise and beauty. She is literally transformed by magical furs and dresses that hide her true status; she moves between humble, hidden identity and radiant, royal-looking appearances. She reinvents herself to access the king’s world, then reveals her true worth and rightful place, breaking the enchantment of her lowly status and being recognized as the king’s bride.

In both, enchantment drives change, and the protagonists shape their fates through choices and manage to transform their circumstances and identities.","Both stories vividly embody the themes of transformation and enchantment, as well as transformation and self-reinvention. In the tale of the frog prince (<1-hop>), a prince is transformed into a frog by a spiteful fairy’s enchantment and can only regain his true form through the kindness and actions of a princess, ultimately breaking the spell and allowing him to return to his original self. This magical transformation is central to the story’s resolution and happiness. In the story of Cat-skin (<2-hop>), the princess undergoes a form of self-reinvention: to escape an unwanted marriage, she disguises herself in a mantle of a thousand furs, blackens her face and hands, and takes on the humble identity of Cat-skin. Through her resourcefulness and perseverance, she eventually reveals her true identity and beauty, leading to her own transformation from a scullion-girl back to a princess and bride. Both narratives use magical or self-imposed transformations to show how characters can change their circumstances, find happiness, and ultimately be rewarded for their resilience and goodness.",1.0,0.3888888888888889,0.52
How did being good and using what you good at help the brothers win in both stories?,"['THE FOUR CLEVER BROTHERS\n\n‘Dear children,’ said a poor man to his four sons, ‘I have nothing to give\n you; you must go out into the wide world and try your luck. Begin by\n learning some craft or another, and see how you can get on.’ So the four\n brothers took their walking-sticks in their hands, and their little\n bundles on their shoulders, and after bidding their father goodbye, went\n all out at the gate together. When they had got on some way they came to\n four crossways, each leading to a different country. Then the eldest said,\n ‘Here we must part; but this day four years we will come back to this\n spot, and in the meantime each must try what he can do for himself.’\nSo each brother went his way; and as the eldest was hastening on a man met\n him, and asked him where he was going, and what he wanted. ‘I am going to\n try my luck in the world, and should like to begin by learning some art or\n trade,’ answered he. ‘Then,’ said the man, ‘go with me, and I will teach\n you to become the cunningest thief that ever was.’ ‘No,’ said the other,\n ‘that is not an honest calling, and what can one look to earn by it in the\n end but the gallows?’ ‘Oh!’ said the man, ‘you need not fear the gallows;\n for I will only teach you to steal what will be fair game: I meddle with\n nothing but what no one else can get or care anything about, and where no\n one can find you out.’ So the young man agreed to follow his trade, and he\n soon showed himself so clever, that nothing could escape him that he had\n once set his mind upon.\nThe second brother also met a man, who, when he found out what he was\n setting out upon, asked him what craft he meant to follow. ‘I do not know\n yet,’ said he. ‘Then come with me, and be a star-gazer. It is a noble art,\n for nothing can be hidden from you, when once you understand the stars.’\n The plan pleased him much, and he soon became such a skilful star-gazer,\n that when he had served out his time, and wanted to leave his master, he\n gave him a glass, and said, ‘With this you can see all that is passing in\n the sky and on earth, and nothing can be hidden from you.’\nThe third brother met a huntsman, who took him with him, and taught him so\n well all that belonged to hunting, that he became very clever in the craft\n of the woods; and when he left his master he gave him a bow, and said,\n ‘Whatever you shoot at with this bow you will be sure to hit.’\nThe youngest brother likewise met a man who asked him what he wished to\n do. ‘Would not you like,’ said he, ‘to be a tailor?’ ‘Oh, no!’ said the\n young man; ‘sitting cross-legged from morning to night, working backwards\n and forwards with a needle and goose, will never suit me.’ ‘Oh!’ answered\n the man, ‘that is not my sort of tailoring; come with me, and you will\n learn quite another kind of craft from that.’ Not knowing what better to\n do, he came into the plan, and learnt tailoring from the beginning; and\n when he left his master, he gave him a needle, and said, ‘You can sew\n anything with this, be it as soft as an egg or as hard as steel; and the\n joint will be so fine that no seam will be seen.’\nAfter the space of four years, at the time agreed upon, the four brothers\n met at the four cross-roads; and having welcomed each other, set off\n towards their father’s home, where they told him all that had happened to\n them, and how each had learned some craft.\nThen, one day, as they were sitting before the house under a very high\n tree, the father said, ‘I should like to try what each of you can do in\n this way.’ So he looked up, and said to the second son, ‘At the top of\n this tree there is a chaffinch’s nest; tell me how many eggs there are in\n it.’ The star-gazer took his glass, looked up, and said, ‘Five.’ ‘Now,’\n said the father to the eldest son, ‘take away the eggs without letting the\n bird that is sitting upon them and hatching them know anything of what you\n are doing.’ So the cunning thief climbed up the tree, and brought away to\n his father the five eggs from under the bird; and it never saw or felt\n what he was doing, but kept sitting on at its ease. Then the father took\n the eggs, and put one on each corner of the table, and the fifth in the\n middle, and said to the huntsman, ‘Cut all the eggs in two pieces at one\n shot.’ The huntsman took up his bow, and at one shot struck all the five\n eggs as his father wished.\n‘Now comes your turn,’ said he to the young tailor; ‘sew the eggs and the\n young birds in them together again, so neatly that the shot shall have\n done them no harm.’ Then the tailor took his needle, and sewed the eggs as\n he was told; and when he had done, the thief was sent to take them back to\n the nest, and put them under the bird without its knowing it. Then she\n went on sitting, and hatched them: and in a few days they crawled out, and\n had only a little red streak across their necks, where the tailor had sewn\n them together.\n‘Well done, sons!’ said the old man; ‘you have made good use of your time,\n and learnt something worth the knowing; but I am sure I do not know which\n ought to have the prize. Oh, that a time might soon come for you to turn\n your skill to some account!’\nNot long after this there was a great bustle in the country; for the\n king’s daughter had been carried off by a mighty dragon, and the king\n mourned over his loss day and night, and made it known that whoever\n brought her back to him should have her for a wife. Then the four brothers\n said to each other, ‘Here is a chance for us; let us try what we can do.’\n And they agreed to see whether they could not set the princess free. ‘I\n will soon find out where she is, however,’ said the star-gazer, as he\n looked through his glass; and he soon cried out, ‘I see her afar off,\n sitting upon a rock in the sea, and I can spy the dragon close by,\n guarding her.’ Then he went to the king, and asked for a ship for himself\n and his brothers; and they sailed together over the sea, till they came to\n the right place. There they found the princess sitting, as the star-gazer\n had said, on the rock; and the dragon was lying asleep, with his head upon\n her lap. ‘I dare not shoot at him,’ said the huntsman, ‘for I should kill\n the beautiful young lady also.’ ‘Then I will try my skill,’ said the\n thief, and went and stole her away from under the dragon, so quietly and\n gently that the beast did not know it, but went on snoring.\nThen away they hastened with her full of joy in their boat towards the\n ship; but soon came the dragon roaring behind them through the air; for he\n awoke and missed the princess. But when he got over the boat, and wanted\n to pounce upon them and carry off the princess, the huntsman took up his\n bow and shot him straight through the heart so that he fell down dead.\n They were still not safe; for he was such a great beast that in his fall\n he overset the boat, and they had to swim in the open sea upon a few\n planks. So the tailor took his needle, and with a few large stitches put\n some of the planks together; and he sat down upon these, and sailed about\n and gathered up all pieces of the boat; and then tacked them together so\n quickly that the boat was soon ready, and they then reached the ship and\n got home safe.\nWhen they had brought home the princess to her father, there was great\n rejoicing; and he said to the four brothers, ‘One of you shall marry her,\n but you must settle amongst yourselves which it is to be.’ Then there\n arose a quarrel between them; and the star-gazer said, ‘If I had not found\n the princess out, all your skill would have been of no use; therefore she\n ought to be mine.’ ‘Your seeing her would have been of no use,’ said the\n thief, ‘if I had not taken her away from the dragon; therefore she ought\n to be mine.’ ‘No, she is mine,’ said the huntsman; ‘for if I had not\n killed the dragon, he would, after all, have torn you and the princess\n into pieces.’ ‘And if I had not sewn the boat together again,’ said the\n tailor, ‘you would all have been drowned, therefore she is mine.’ Then the\n king put in a word, and said, ‘Each of you is right; and as all cannot\n have the young lady, the best way is for neither of you to have her: for\n the truth is, there is somebody she likes a great deal better. But to make\n up for your loss, I will give each of you, as a reward for his skill, half\n a kingdom.’ So the brothers agreed that this plan would be much better\n than either quarrelling or marrying a lady who had no mind to have them.\n And the king then gave to each half a kingdom, as he had said; and they\n lived very happily the rest of their days, and took good care of their\n father; and somebody took better care of the young lady, than to let\n either the dragon or one of the craftsmen have her again.', 'THE STRAW, THE COAL, AND THE BEAN\n\nIn a village dwelt a poor old woman, who had gathered together a dish of\n beans and wanted to cook them. So she made a fire on her hearth, and that\n it might burn the quicker, she lighted it with a handful of straw. When\n she was emptying the beans into the pan, one dropped without her observing\n it, and lay on the ground beside a straw, and soon afterwards a burning\n coal from the fire leapt down to the two. Then the straw began and said:\n ‘Dear friends, from whence do you come here?’ The coal replied: ‘I\n fortunately sprang out of the fire, and if I had not escaped by sheer\n force, my death would have been certain,—I should have been burnt to\n ashes.’ The bean said: ‘I too have escaped with a whole skin, but if the\n old woman had got me into the pan, I should have been made into broth\n without any mercy, like my comrades.’ ‘And would a better fate have fallen\n to my lot?’ said the straw. ‘The old woman has destroyed all my brethren\n in fire and smoke; she seized sixty of them at once, and took their lives.\n I luckily slipped through her fingers.’\n‘But what are we to do now?’ said the coal.\n‘I think,’ answered the bean, ‘that as we have so fortunately escaped\n death, we should keep together like good companions, and lest a new\n mischance should overtake us here, we should go away together, and repair\n to a foreign country.’\nThe proposition pleased the two others, and they set out on their way\n together. Soon, however, they came to a little brook, and as there was no\n bridge or foot-plank, they did not know how they were to get over it. The\n straw hit on a good idea, and said: ‘I will lay myself straight across,\n and then you can walk over on me as on a bridge.’ The straw therefore\n stretched itself from one bank to the other, and the coal, who was of an\n impetuous disposition, tripped quite boldly on to the newly-built bridge.\n But when she had reached the middle, and heard the water rushing beneath\n her, she was after all, afraid, and stood still, and ventured no farther.\n The straw, however, began to burn, broke in two pieces, and fell into the\n stream. The coal slipped after her, hissed when she got into the water,\n and breathed her last. The bean, who had prudently stayed behind on the\n shore, could not but laugh at the event, was unable to stop, and laughed\n so heartily that she burst. It would have been all over with her,\n likewise, if, by good fortune, a tailor who was travelling in search of\n work, had not sat down to rest by the brook. As he had a compassionate\n heart he pulled out his needle and thread, and sewed her together. The\n bean thanked him most prettily, but as the tailor used black thread, all\n beans since then have a black seam.', 'THE GOLDEN BIRD\n\nA certain king had a beautiful garden, and in the garden stood a tree\n which bore golden apples. These apples were always counted, and about the\n time when they began to grow ripe it was found that every night one of\n them was gone. The king became very angry at this, and ordered the\n gardener to keep watch all night under the tree. The gardener set his\n eldest son to watch; but about twelve o’clock he fell asleep, and in the\n morning another of the apples was missing. Then the second son was ordered\n to watch; and at midnight he too fell asleep, and in the morning another\n apple was gone. Then the third son offered to keep watch; but the gardener\n at first would not let him, for fear some harm should come to him:\n however, at last he consented, and the young man laid himself under the\n tree to watch. As the clock struck twelve he heard a rustling noise in the\n air, and a bird came flying that was of pure gold; and as it was snapping\n at one of the apples with its beak, the gardener’s son jumped up and shot\n an arrow at it. But the arrow did the bird no harm; only it dropped a\n golden feather from its tail, and then flew away. The golden feather was\n brought to the king in the morning, and all the council was called\n together. Everyone agreed that it was worth more than all the wealth of\n the kingdom: but the king said, ‘One feather is of no use to me, I must\n have the whole bird.’\nThen the gardener’s eldest son set out and thought to find the golden bird\n very easily; and when he had gone but a little way, he came to a wood, and\n by the side of the wood he saw a fox sitting; so he took his bow and made\n ready to shoot at it. Then the fox said, ‘Do not shoot me, for I will give\n you good counsel; I know what your business is, and that you want to find\n the golden bird. You will reach a village in the evening; and when you get\n there, you will see two inns opposite to each other, one of which is very\n pleasant and beautiful to look at: go not in there, but rest for the night\n in the other, though it may appear to you to be very poor and mean.’ But\n the son thought to himself, ‘What can such a beast as this know about the\n matter?’ So he shot his arrow at the fox; but he missed it, and it set up\n its tail above its back and ran into the wood. Then he went his way, and\n in the evening came to the village where the two inns were; and in one of\n these were people singing, and dancing, and feasting; but the other looked\n very dirty, and poor. ‘I should be very silly,’ said he, ‘if I went to\n that shabby house, and left this charming place’; so he went into the\n smart house, and ate and drank at his ease, and forgot the bird, and his\n country too.\nTime passed on; and as the eldest son did not come back, and no tidings\n were heard of him, the second son set out, and the same thing happened to\n him. He met the fox, who gave him the good advice: but when he came to the\n two inns, his eldest brother was standing at the window where the\n merrymaking was, and called to him to come in; and he could not withstand\n the temptation, but went in, and forgot the golden bird and his country in\n the same manner.\nTime passed on again, and the youngest son too wished to set out into the\n wide world to seek for the golden bird; but his father would not listen to\n it for a long while, for he was very fond of his son, and was afraid that\n some ill luck might happen to him also, and prevent his coming back.\n However, at last it was agreed he should go, for he would not rest at\n home; and as he came to the wood, he met the fox, and heard the same good\n counsel. But he was thankful to the fox, and did not attempt his life as\n his brothers had done; so the fox said, ‘Sit upon my tail, and you will\n travel faster.’ So he sat down, and the fox began to run, and away they\n went over stock and stone so quick that their hair whistled in the wind.\nWhen they came to the village, the son followed the fox’s counsel, and\n without looking about him went to the shabby inn and rested there all\n night at his ease. In the morning came the fox again and met him as he was\n beginning his journey, and said, ‘Go straight forward, till you come to a\n castle, before which lie a whole troop of soldiers fast asleep and\n snoring: take no notice of them, but go into the castle and pass on and on\n till you come to a room, where the golden bird sits in a wooden cage;\n close by it stands a beautiful golden cage; but do not try to take the\n bird out of the shabby cage and put it into the handsome one, otherwise\n you will repent it.’ Then the fox stretched out his tail again, and the\n young man sat himself down, and away they went over stock and stone till\n their hair whistled in the wind.\nBefore the castle gate all was as the fox had said: so the son went in and\n found the chamber where the golden bird hung in a wooden cage, and below\n stood the golden cage, and the three golden apples that had been lost were\n lying close by it. Then thought he to himself, ‘It will be a very droll\n thing to bring away such a fine bird in this shabby cage’; so he opened\n the door and took hold of it and put it into the golden cage. But the bird\n set up such a loud scream that all the soldiers awoke, and they took him\n prisoner and carried him before the king. The next morning the court sat\n to judge him; and when all was heard, it sentenced him to die, unless he\n should bring the king the golden horse which could run as swiftly as the\n wind; and if he did this, he was to have the golden bird given him for his\n own.\nSo he set out once more on his journey, sighing, and in great despair,\n when on a sudden his friend the fox met him, and said, ‘You see now what\n has happened on account of your not listening to my counsel. I will still,\n however, tell you how to find the golden horse, if you will do as I bid\n you. You must go straight on till you come to the castle where the horse\n stands in his stall: by his side will lie the groom fast asleep and\n snoring: take away the horse quietly, but be sure to put the old leathern\n saddle upon him, and not the golden one that is close by it.’ Then the son\n sat down on the fox’s tail, and away they went over stock and stone till\n their hair whistled in the wind.\nAll went right, and the groom lay snoring with his hand upon the golden\n saddle. But when the son looked at the horse, he thought it a great pity\n to put the leathern saddle upon it. ‘I will give him the good one,’ said\n he; ‘I am sure he deserves it.’ As he took up the golden saddle the groom\n awoke and cried out so loud, that all the guards ran in and took him\n prisoner, and in the morning he was again brought before the court to be\n judged, and was sentenced to die. But it was agreed, that, if he could\n bring thither the beautiful princess, he should live, and have the bird\n and the horse given him for his own.\nThen he went his way very sorrowful; but the old fox came and said, ‘Why\n did not you listen to me? If you had, you would have carried away both the\n bird and the horse; yet will I once more give you counsel. Go straight on,\n and in the evening you will arrive at a castle. At twelve o’clock at night\n the princess goes to the bathing-house: go up to her and give her a kiss,\n and she will let you lead her away; but take care you do not suffer her to\n go and take leave of her father and mother.’ Then the fox stretched out\n his tail, and so away they went over stock and stone till their hair\n whistled again.\nAs they came to the castle, all was as the fox had said, and at twelve\n o’clock the young man met the princess going to the bath and gave her the\n kiss, and she agreed to run away with him, but begged with many tears that\n he would let her take leave of her father. At first he refused, but she\n wept still more and more, and fell at his feet, till at last he consented;\n but the moment she came to her father’s house the guards awoke and he was\n taken prisoner again.\nThen he was brought before the king, and the king said, ‘You shall never\n have my daughter unless in eight days you dig away the hill that stops the\n view from my window.’ Now this hill was so big that the whole world could\n not take it away: and when he had worked for seven days, and had done very\n little, the fox came and said. ‘Lie down and go to sleep; I will work for\n you.’ And in the morning he awoke and the hill was gone; so he went\n merrily to the king, and told him that now that it was removed he must\n give him the princess.\nThen the king was obliged to keep his word, and away went the young man\n and the princess; and the fox came and said to him, ‘We will have all\n three, the princess, the horse, and the bird.’ ‘Ah!’ said the young man,\n ‘that would be a great thing, but how can you contrive it?’\n‘If you will only listen,’ said the fox, ‘it can be done. When you come to\n the king, and he asks for the beautiful princess, you must say, “Here she\n is!” Then he will be very joyful; and you will mount the golden horse that\n they are to give you, and put out your hand to take leave of them; but\n shake hands with the princess last. Then lift her quickly on to the horse\n behind you; clap your spurs to his side, and gallop away as fast as you\n can.’\nAll went right: then the fox said, ‘When you come to the castle where the\n bird is, I will stay with the princess at the door, and you will ride in\n and speak to the king; and when he sees that it is the right horse, he\n will bring out the bird; but you must sit still, and say that you want to\n look at it, to see whether it is the true golden bird; and when you get it\n into your hand, ride away.’\nThis, too, happened as the fox said; they carried off the bird, the\n princess mounted again, and they rode on to a great wood. Then the fox\n came, and said, ‘Pray kill me, and cut off my head and my feet.’ But the\n young man refused to do it: so the fox said, ‘I will at any rate give you\n good counsel: beware of two things; ransom no one from the gallows, and\n sit down by the side of no river.’ Then away he went. ‘Well,’ thought the\n young man, ‘it is no hard matter to keep that advice.’\nHe rode on with the princess, till at last he came to the village where he\n had left his two brothers. And there he heard a great noise and uproar;\n and when he asked what was the matter, the people said, ‘Two men are going\n to be hanged.’ As he came nearer, he saw that the two men were his\n brothers, who had turned robbers; so he said, ‘Cannot they in any way be\n saved?’ But the people said ‘No,’ unless he would bestow all his money\n upon the rascals and buy their liberty. Then he did not stay to think\n about the matter, but paid what was asked, and his brothers were given up,\n and went on with him towards their home.\nAnd as they came to the wood where the fox first met them, it was so cool\n and pleasant that the two brothers said, ‘Let us sit down by the side of\n the river, and rest a while, to eat and drink.’ So he said, ‘Yes,’ and\n forgot the fox’s counsel, and sat down on the side of the river; and while\n he suspected nothing, they came behind, and threw him down the bank, and\n took the princess, the horse, and the bird, and went home to the king\n their master, and said. ‘All this have we won by our labour.’ Then there\n was great rejoicing made; but the horse would not eat, the bird would not\n sing, and the princess wept.\nThe youngest son fell to the bottom of the river’s bed: luckily it was\n nearly dry, but his bones were almost broken, and the bank was so steep\n that he could find no way to get out. Then the old fox came once more, and\n scolded him for not following his advice; otherwise no evil would have\n befallen him: ‘Yet,’ said he, ‘I cannot leave you here, so lay hold of my\n tail and hold fast.’ Then he pulled him out of the river, and said to him,\n as he got upon the bank, ‘Your brothers have set watch to kill you, if\n they find you in the kingdom.’ So he dressed himself as a poor man, and\n came secretly to the king’s court, and was scarcely within the doors when\n the horse began to eat, and the bird to sing, and the princess left off\n weeping. Then he went to the king, and told him all his brothers’ roguery;\n and they were seized and punished, and he had the princess given to him\n again; and after the king’s death he was heir to his kingdom.\nA long while after, he went to walk one day in the wood, and the old fox\n met him, and besought him with tears in his eyes to kill him, and cut off\n his head and feet. And at last he did so, and in a moment the fox was\n changed into a man, and turned out to be the brother of the princess, who\n had been lost a great many many years.']","- The Four Clever Brothers: Each brother uses a skill he learned honestly for a good purpose. The star-gazer’s sight, the thief’s deftness, the huntsman’s archery, and the tailor’s needle all contribute to finding the princess, freeing her from the dragon, and returning home safely. Their different talents, used well and for the right end, win them the king’s favor (and a share of the kingdom).

- The Straw, the Coal, and the Bean: The three friends attempt to rely on their strengths together (straw as a bridge, coal’s boldness, bean’s prudence). When they follow the right plan and stick together, they avoid death and reach safety, though not all survive. The story emphasizes that using your gifts wisely and working with others helps you endure and succeed, whereas ignoring good counsel can lead to ruin.","In the first story, the little dwarf was kind and stopped his brothers from hurting ants, ducks, and bees. Because he was good, the animals helped him with hard tasks, like finding pearls, getting a key, and picking the right princess. This let him break the spell and become king. In the second story, each brother learned a special skill, like stealing, star-gazing, hunting, or sewing. When the king’s daughter was taken by a dragon, they all used what they was good at together to save her and fix the boat. Because they worked together and used their talents, they all got rewarded and lived happy. So, being good and using your own talents helped them beat hard things and find happiness.",0.42857142857142855,0.625,0.12
"In the two tales provided, how do the protagonists exemplify the themes of overcoming challenges through virtue and the use of individual talents for collective success, and what are the outcomes of their actions for themselves and those around them?","['THE FOUR CLEVER BROTHERS\n\n‘Dear children,’ said a poor man to his four sons, ‘I have nothing to give\n you; you must go out into the wide world and try your luck. Begin by\n learning some craft or another, and see how you can get on.’ So the four\n brothers took their walking-sticks in their hands, and their little\n bundles on their shoulders, and after bidding their father goodbye, went\n all out at the gate together. When they had got on some way they came to\n four crossways, each leading to a different country. Then the eldest said,\n ‘Here we must part; but this day four years we will come back to this\n spot, and in the meantime each must try what he can do for himself.’\nSo each brother went his way; and as the eldest was hastening on a man met\n him, and asked him where he was going, and what he wanted. ‘I am going to\n try my luck in the world, and should like to begin by learning some art or\n trade,’ answered he. ‘Then,’ said the man, ‘go with me, and I will teach\n you to become the cunningest thief that ever was.’ ‘No,’ said the other,\n ‘that is not an honest calling, and what can one look to earn by it in the\n end but the gallows?’ ‘Oh!’ said the man, ‘you need not fear the gallows;\n for I will only teach you to steal what will be fair game: I meddle with\n nothing but what no one else can get or care anything about, and where no\n one can find you out.’ So the young man agreed to follow his trade, and he\n soon showed himself so clever, that nothing could escape him that he had\n once set his mind upon.\nThe second brother also met a man, who, when he found out what he was\n setting out upon, asked him what craft he meant to follow. ‘I do not know\n yet,’ said he. ‘Then come with me, and be a star-gazer. It is a noble art,\n for nothing can be hidden from you, when once you understand the stars.’\n The plan pleased him much, and he soon became such a skilful star-gazer,\n that when he had served out his time, and wanted to leave his master, he\n gave him a glass, and said, ‘With this you can see all that is passing in\n the sky and on earth, and nothing can be hidden from you.’\nThe third brother met a huntsman, who took him with him, and taught him so\n well all that belonged to hunting, that he became very clever in the craft\n of the woods; and when he left his master he gave him a bow, and said,\n ‘Whatever you shoot at with this bow you will be sure to hit.’\nThe youngest brother likewise met a man who asked him what he wished to\n do. ‘Would not you like,’ said he, ‘to be a tailor?’ ‘Oh, no!’ said the\n young man; ‘sitting cross-legged from morning to night, working backwards\n and forwards with a needle and goose, will never suit me.’ ‘Oh!’ answered\n the man, ‘that is not my sort of tailoring; come with me, and you will\n learn quite another kind of craft from that.’ Not knowing what better to\n do, he came into the plan, and learnt tailoring from the beginning; and\n when he left his master, he gave him a needle, and said, ‘You can sew\n anything with this, be it as soft as an egg or as hard as steel; and the\n joint will be so fine that no seam will be seen.’\nAfter the space of four years, at the time agreed upon, the four brothers\n met at the four cross-roads; and having welcomed each other, set off\n towards their father’s home, where they told him all that had happened to\n them, and how each had learned some craft.\nThen, one day, as they were sitting before the house under a very high\n tree, the father said, ‘I should like to try what each of you can do in\n this way.’ So he looked up, and said to the second son, ‘At the top of\n this tree there is a chaffinch’s nest; tell me how many eggs there are in\n it.’ The star-gazer took his glass, looked up, and said, ‘Five.’ ‘Now,’\n said the father to the eldest son, ‘take away the eggs without letting the\n bird that is sitting upon them and hatching them know anything of what you\n are doing.’ So the cunning thief climbed up the tree, and brought away to\n his father the five eggs from under the bird; and it never saw or felt\n what he was doing, but kept sitting on at its ease. Then the father took\n the eggs, and put one on each corner of the table, and the fifth in the\n middle, and said to the huntsman, ‘Cut all the eggs in two pieces at one\n shot.’ The huntsman took up his bow, and at one shot struck all the five\n eggs as his father wished.\n‘Now comes your turn,’ said he to the young tailor; ‘sew the eggs and the\n young birds in them together again, so neatly that the shot shall have\n done them no harm.’ Then the tailor took his needle, and sewed the eggs as\n he was told; and when he had done, the thief was sent to take them back to\n the nest, and put them under the bird without its knowing it. Then she\n went on sitting, and hatched them: and in a few days they crawled out, and\n had only a little red streak across their necks, where the tailor had sewn\n them together.\n‘Well done, sons!’ said the old man; ‘you have made good use of your time,\n and learnt something worth the knowing; but I am sure I do not know which\n ought to have the prize. Oh, that a time might soon come for you to turn\n your skill to some account!’\nNot long after this there was a great bustle in the country; for the\n king’s daughter had been carried off by a mighty dragon, and the king\n mourned over his loss day and night, and made it known that whoever\n brought her back to him should have her for a wife. Then the four brothers\n said to each other, ‘Here is a chance for us; let us try what we can do.’\n And they agreed to see whether they could not set the princess free. ‘I\n will soon find out where she is, however,’ said the star-gazer, as he\n looked through his glass; and he soon cried out, ‘I see her afar off,\n sitting upon a rock in the sea, and I can spy the dragon close by,\n guarding her.’ Then he went to the king, and asked for a ship for himself\n and his brothers; and they sailed together over the sea, till they came to\n the right place. There they found the princess sitting, as the star-gazer\n had said, on the rock; and the dragon was lying asleep, with his head upon\n her lap. ‘I dare not shoot at him,’ said the huntsman, ‘for I should kill\n the beautiful young lady also.’ ‘Then I will try my skill,’ said the\n thief, and went and stole her away from under the dragon, so quietly and\n gently that the beast did not know it, but went on snoring.\nThen away they hastened with her full of joy in their boat towards the\n ship; but soon came the dragon roaring behind them through the air; for he\n awoke and missed the princess. But when he got over the boat, and wanted\n to pounce upon them and carry off the princess, the huntsman took up his\n bow and shot him straight through the heart so that he fell down dead.\n They were still not safe; for he was such a great beast that in his fall\n he overset the boat, and they had to swim in the open sea upon a few\n planks. So the tailor took his needle, and with a few large stitches put\n some of the planks together; and he sat down upon these, and sailed about\n and gathered up all pieces of the boat; and then tacked them together so\n quickly that the boat was soon ready, and they then reached the ship and\n got home safe.\nWhen they had brought home the princess to her father, there was great\n rejoicing; and he said to the four brothers, ‘One of you shall marry her,\n but you must settle amongst yourselves which it is to be.’ Then there\n arose a quarrel between them; and the star-gazer said, ‘If I had not found\n the princess out, all your skill would have been of no use; therefore she\n ought to be mine.’ ‘Your seeing her would have been of no use,’ said the\n thief, ‘if I had not taken her away from the dragon; therefore she ought\n to be mine.’ ‘No, she is mine,’ said the huntsman; ‘for if I had not\n killed the dragon, he would, after all, have torn you and the princess\n into pieces.’ ‘And if I had not sewn the boat together again,’ said the\n tailor, ‘you would all have been drowned, therefore she is mine.’ Then the\n king put in a word, and said, ‘Each of you is right; and as all cannot\n have the young lady, the best way is for neither of you to have her: for\n the truth is, there is somebody she likes a great deal better. But to make\n up for your loss, I will give each of you, as a reward for his skill, half\n a kingdom.’ So the brothers agreed that this plan would be much better\n than either quarrelling or marrying a lady who had no mind to have them.\n And the king then gave to each half a kingdom, as he had said; and they\n lived very happily the rest of their days, and took good care of their\n father; and somebody took better care of the young lady, than to let\n either the dragon or one of the craftsmen have her again.', 'THE STRAW, THE COAL, AND THE BEAN\n\nIn a village dwelt a poor old woman, who had gathered together a dish of\n beans and wanted to cook them. So she made a fire on her hearth, and that\n it might burn the quicker, she lighted it with a handful of straw. When\n she was emptying the beans into the pan, one dropped without her observing\n it, and lay on the ground beside a straw, and soon afterwards a burning\n coal from the fire leapt down to the two. Then the straw began and said:\n ‘Dear friends, from whence do you come here?’ The coal replied: ‘I\n fortunately sprang out of the fire, and if I had not escaped by sheer\n force, my death would have been certain,—I should have been burnt to\n ashes.’ The bean said: ‘I too have escaped with a whole skin, but if the\n old woman had got me into the pan, I should have been made into broth\n without any mercy, like my comrades.’ ‘And would a better fate have fallen\n to my lot?’ said the straw. ‘The old woman has destroyed all my brethren\n in fire and smoke; she seized sixty of them at once, and took their lives.\n I luckily slipped through her fingers.’\n‘But what are we to do now?’ said the coal.\n‘I think,’ answered the bean, ‘that as we have so fortunately escaped\n death, we should keep together like good companions, and lest a new\n mischance should overtake us here, we should go away together, and repair\n to a foreign country.’\nThe proposition pleased the two others, and they set out on their way\n together. Soon, however, they came to a little brook, and as there was no\n bridge or foot-plank, they did not know how they were to get over it. The\n straw hit on a good idea, and said: ‘I will lay myself straight across,\n and then you can walk over on me as on a bridge.’ The straw therefore\n stretched itself from one bank to the other, and the coal, who was of an\n impetuous disposition, tripped quite boldly on to the newly-built bridge.\n But when she had reached the middle, and heard the water rushing beneath\n her, she was after all, afraid, and stood still, and ventured no farther.\n The straw, however, began to burn, broke in two pieces, and fell into the\n stream. The coal slipped after her, hissed when she got into the water,\n and breathed her last. The bean, who had prudently stayed behind on the\n shore, could not but laugh at the event, was unable to stop, and laughed\n so heartily that she burst. It would have been all over with her,\n likewise, if, by good fortune, a tailor who was travelling in search of\n work, had not sat down to rest by the brook. As he had a compassionate\n heart he pulled out his needle and thread, and sewed her together. The\n bean thanked him most prettily, but as the tailor used black thread, all\n beans since then have a black seam.', 'THE WHITE SNAKE\n\nA long time ago there lived a king who was famed for his wisdom through\n all the land. Nothing was hidden from him, and it seemed as if news of the\n most secret things was brought to him through the air. But he had a\n strange custom; every day after dinner, when the table was cleared, and no\n one else was present, a trusty servant had to bring him one more dish. It\n was covered, however, and even the servant did not know what was in it,\n neither did anyone know, for the king never took off the cover to eat of\n it until he was quite alone.\nThis had gone on for a long time, when one day the servant, who took away\n the dish, was overcome with such curiosity that he could not help carrying\n the dish into his room. When he had carefully locked the door, he lifted\n up the cover, and saw a white snake lying on the dish. But when he saw it\n he could not deny himself the pleasure of tasting it, so he cut of a\n little bit and put it into his mouth. No sooner had it touched his tongue\n than he heard a strange whispering of little voices outside his window. He\n went and listened, and then noticed that it was the sparrows who were\n chattering together, and telling one another of all kinds of things which\n they had seen in the fields and woods. Eating the snake had given him\n power of understanding the language of animals.\nNow it so happened that on this very day the queen lost her most beautiful\n ring, and suspicion of having stolen it fell upon this trusty servant, who\n was allowed to go everywhere. The king ordered the man to be brought\n before him, and threatened with angry words that unless he could before\n the morrow point out the thief, he himself should be looked upon as guilty\n and executed. In vain he declared his innocence; he was dismissed with no\n better answer.\nIn his trouble and fear he went down into the courtyard and took thought\n how to help himself out of his trouble. Now some ducks were sitting\n together quietly by a brook and taking their rest; and, whilst they were\n making their feathers smooth with their bills, they were having a\n confidential conversation together. The servant stood by and listened.\n They were telling one another of all the places where they had been\n waddling about all the morning, and what good food they had found; and one\n said in a pitiful tone: ‘Something lies heavy on my stomach; as I was\n eating in haste I swallowed a ring which lay under the queen’s window.’\n The servant at once seized her by the neck, carried her to the kitchen,\n and said to the cook: ‘Here is a fine duck; pray, kill her.’ ‘Yes,’ said\n the cook, and weighed her in his hand; ‘she has spared no trouble to\n fatten herself, and has been waiting to be roasted long enough.’ So he cut\n off her head, and as she was being dressed for the spit, the queen’s ring\n was found inside her.\nThe servant could now easily prove his innocence; and the king, to make\n amends for the wrong, allowed him to ask a favour, and promised him the\n best place in the court that he could wish for. The servant refused\n everything, and only asked for a horse and some money for travelling, as\n he had a mind to see the world and go about a little. When his request was\n granted he set out on his way, and one day came to a pond, where he saw\n three fishes caught in the reeds and gasping for water. Now, though it is\n said that fishes are dumb, he heard them lamenting that they must perish\n so miserably, and, as he had a kind heart, he got off his horse and put\n the three prisoners back into the water. They leapt with delight, put out\n their heads, and cried to him: ‘We will remember you and repay you for\n saving us!’\nHe rode on, and after a while it seemed to him that he heard a voice in\n the sand at his feet. He listened, and heard an ant-king complain: ‘Why\n cannot folks, with their clumsy beasts, keep off our bodies? That stupid\n horse, with his heavy hoofs, has been treading down my people without\n mercy!’ So he turned on to a side path and the ant-king cried out to him:\n ‘We will remember you—one good turn deserves another!’\nThe path led him into a wood, and there he saw two old ravens standing by\n their nest, and throwing out their young ones. ‘Out with you, you idle,\n good-for-nothing creatures!’ cried they; ‘we cannot find food for you any\n longer; you are big enough, and can provide for yourselves.’ But the poor\n young ravens lay upon the ground, flapping their wings, and crying: ‘Oh,\n what helpless chicks we are! We must shift for ourselves, and yet we\n cannot fly! What can we do, but lie here and starve?’ So the good young\n fellow alighted and killed his horse with his sword, and gave it to them\n for food. Then they came hopping up to it, satisfied their hunger, and\n cried: ‘We will remember you—one good turn deserves another!’\nAnd now he had to use his own legs, and when he had walked a long way, he\n came to a large city. There was a great noise and crowd in the streets,\n and a man rode up on horseback, crying aloud: ‘The king’s daughter wants a\n husband; but whoever seeks her hand must perform a hard task, and if he\n does not succeed he will forfeit his life.’ Many had already made the\n attempt, but in vain; nevertheless when the youth saw the king’s daughter\n he was so overcome by her great beauty that he forgot all danger, went\n before the king, and declared himself a suitor.\nSo he was led out to the sea, and a gold ring was thrown into it, before\n his eyes; then the king ordered him to fetch this ring up from the bottom\n of the sea, and added: ‘If you come up again without it you will be thrown\n in again and again until you perish amid the waves.’ All the people\n grieved for the handsome youth; then they went away, leaving him alone by\n the sea.\nHe stood on the shore and considered what he should do, when suddenly he\n saw three fishes come swimming towards him, and they were the very fishes\n whose lives he had saved. The one in the middle held a mussel in its\n mouth, which it laid on the shore at the youth’s feet, and when he had\n taken it up and opened it, there lay the gold ring in the shell. Full of\n joy he took it to the king and expected that he would grant him the\n promised reward.\nBut when the proud princess perceived that he was not her equal in birth,\n she scorned him, and required him first to perform another task. She went\n down into the garden and strewed with her own hands ten sacksful of\n millet-seed on the grass; then she said: ‘Tomorrow morning before sunrise\n these must be picked up, and not a single grain be wanting.’\nThe youth sat down in the garden and considered how it might be possible\n to perform this task, but he could think of nothing, and there he sat\n sorrowfully awaiting the break of day, when he should be led to death. But\n as soon as the first rays of the sun shone into the garden he saw all the\n ten sacks standing side by side, quite full, and not a single grain was\n missing. The ant-king had come in the night with thousands and thousands\n of ants, and the grateful creatures had by great industry picked up all\n the millet-seed and gathered them into the sacks.\nPresently the king’s daughter herself came down into the garden, and was\n amazed to see that the young man had done the task she had given him. But\n she could not yet conquer her proud heart, and said: ‘Although he has\n performed both the tasks, he shall not be my husband until he had brought\n me an apple from the Tree of Life.’ The youth did not know where the Tree\n of Life stood, but he set out, and would have gone on for ever, as long as\n his legs would carry him, though he had no hope of finding it. After he\n had wandered through three kingdoms, he came one evening to a wood, and\n lay down under a tree to sleep. But he heard a rustling in the branches,\n and a golden apple fell into his hand. At the same time three ravens flew\n down to him, perched themselves upon his knee, and said: ‘We are the three\n young ravens whom you saved from starving; when we had grown big, and\n heard that you were seeking the Golden Apple, we flew over the sea to the\n end of the world, where the Tree of Life stands, and have brought you the\n apple.’ The youth, full of joy, set out homewards, and took the Golden\n Apple to the king’s beautiful daughter, who had now no more excuses left\n to make. They cut the Apple of Life in two and ate it together; and then\n her heart became full of love for him, and they lived in undisturbed\n happiness to a great age.']","- The Four Clever Brothers
  - How they overcome challenges: Each brother uses a distinct virtuous talent acquired for the common good—cleverness (the thief), foresight (the star-gazer), marksmanship (the huntsman), and skilled sewing (the tailor). They combine these abilities to outwit the dragon, recover the princess, and return home safely.
  - Collective success: Their diverse skills are mutually supportive; together they rescue the princess and bring her back to her father. The king rewards them not by quarrelling, but by sharing half a kingdom with each, recognizing that their different gifts together achieved the outcome.
  - Outcomes for themselves and others: They secure the princess’s return and the king’s praise; each brother gains a portion of the kingdom and they care for their father. The tale emphasizes how virtue (honesty, ingenuity, cooperation) and leveraging individual talents for a shared goal lead to lasting rewards for all.

- The Straw, the Coal, and the Bean
  - How they overcome challenges: The trio, through companionship and practical wit, seeks safety and passage to a foreign land. The straw proposes a bridge, the coal risks the crossing, and the bean stays prudent. Although the straw and coal perish in the crossing, their collaboration is framed as a lesson in unity and the consequences of risk.
  - Collective success: The narrative shifts to the bean (and later a compassionate tailor) turning to mercy and cooperation. The bean is later sewn back together by the tailor, enabling survival and ongoing aid (the tailor’s kindness leads to future reciprocal help from other beings the servant saved earlier).
  - Outcomes for themselves and others: The bean is saved and grateful; the tailor’s skill and mercy enable another life to continue, and the broader network of those helped (the rescued servant, the birds and animals) “remember” and reward good deeds. The tale underscores that mutual aid, prudence, and acting for others’ benefit can transform a perilous situation into future fortune, even if not all partners survive.","In the first tale, the youngest brother, described as a little insignificant dwarf, consistently demonstrates virtue by protecting the ants, ducks, and bees from harm, despite his elder brothers’ disregard. His kindness is later rewarded when these creatures assist him in completing the seemingly impossible tasks required to disenchant the castle: the ants gather the thousand pearls, the ducks retrieve the key from the lake, and the queen bee helps him identify the youngest princess. Through his virtuous actions and the help he receives in return, he overcomes the challenges that defeated his brothers, ultimately breaking the spell, restoring those turned to stone, and marrying the youngest princess. This story highlights how virtue and compassion lead to success and benefit not only the protagonist but also those around him, as all are freed from enchantment.

In the second tale, four brothers each learn a unique craft—thievery, star-gazing, hunting, and tailoring—and later combine their individual talents to rescue a princess from a dragon. The star-gazer locates the princess, the thief stealthily rescues her, the huntsman slays the dragon, and the tailor repairs their boat after it is destroyed. Their collective effort, relying on each brother’s special skill, ensures the success of their quest. Although they quarrel over who deserves the princess, the king wisely rewards each with half a kingdom, recognizing their equal contributions. This outcome demonstrates that the use of individual talents for a common goal leads to collective success and shared rewards, benefiting both the brothers and their father, who is cared for in their prosperity. Both tales thus embody the themes of overcoming challenges through virtue and the effective use of individual talents for the good of all.",0.5,0.7391304347826086,0.34
How does the lion play a role in revealing hidden truths and testing characters in both stories?,"['THE TWELVE HUNTSMEN\n\nThere was once a king’s son who had a bride whom he loved very much. And\n when he was sitting beside her and very happy, news came that his father\n lay sick unto death, and desired to see him once again before his end.\n Then he said to his beloved: ‘I must now go and leave you, I give you a\n ring as a remembrance of me. When I am king, I will return and fetch you.’\n So he rode away, and when he reached his father, the latter was\n dangerously ill, and near his death. He said to him: ‘Dear son, I wished\n to see you once again before my end, promise me to marry as I wish,’ and\n he named a certain king’s daughter who was to be his wife. The son was in\n such trouble that he did not think what he was doing, and said: ‘Yes, dear\n father, your will shall be done,’ and thereupon the king shut his eyes,\n and died.\nWhen therefore the son had been proclaimed king, and the time of mourning\n was over, he was forced to keep the promise which he had given his father,\n and caused the king’s daughter to be asked in marriage, and she was\n promised to him. His first betrothed heard of this, and fretted so much\n about his faithfulness that she nearly died. Then her father said to her:\n ‘Dearest child, why are you so sad? You shall have whatsoever you will.’\n She thought for a moment and said: ‘Dear father, I wish for eleven girls\n exactly like myself in face, figure, and size.’ The father said: ‘If it be\n possible, your desire shall be fulfilled,’ and he caused a search to be\n made in his whole kingdom, until eleven young maidens were found who\n exactly resembled his daughter in face, figure, and size.\nWhen they came to the king’s daughter, she had twelve suits of huntsmen’s\n clothes made, all alike, and the eleven maidens had to put on the\n huntsmen’s clothes, and she herself put on the twelfth suit. Thereupon she\n took her leave of her father, and rode away with them, and rode to the\n court of her former betrothed, whom she loved so dearly. Then she asked if\n he required any huntsmen, and if he would take all of them into his\n service. The king looked at her and did not know her, but as they were\n such handsome fellows, he said: ‘Yes,’ and that he would willingly take\n them, and now they were the king’s twelve huntsmen.\nThe king, however, had a lion which was a wondrous animal, for he knew all\n concealed and secret things. It came to pass that one evening he said to\n the king: ‘You think you have twelve huntsmen?’ ‘Yes,’ said the king,\n ‘they are twelve huntsmen.’ The lion continued: ‘You are mistaken, they\n are twelve girls.’ The king said: ‘That cannot be true! How will you prove\n that to me?’ ‘Oh, just let some peas be strewn in the ante-chamber,’\n answered the lion, ‘and then you will soon see. Men have a firm step, and\n when they walk over peas none of them stir, but girls trip and skip, and\n drag their feet, and the peas roll about.’ The king was well pleased with\n the counsel, and caused the peas to be strewn.\nThere was, however, a servant of the king’s who favoured the huntsmen, and\n when he heard that they were going to be put to this test he went to them\n and repeated everything, and said: ‘The lion wants to make the king\n believe that you are girls.’ Then the king’s daughter thanked him, and\n said to her maidens: ‘Show some strength, and step firmly on the peas.’ So\n next morning when the king had the twelve huntsmen called before him, and\n they came into the ante-chamber where the peas were lying, they stepped so\n firmly on them, and had such a strong, sure walk, that not one of the peas\n either rolled or stirred. Then they went away again, and the king said to\n the lion: ‘You have lied to me, they walk just like men.’ The lion said:\n ‘They have been informed that they were going to be put to the test, and\n have assumed some strength. Just let twelve spinning-wheels be brought\n into the ante-chamber, and they will go to them and be pleased with them,\n and that is what no man would do.’ The king liked the advice, and had the\n spinning-wheels placed in the ante-chamber.\nBut the servant, who was well disposed to the huntsmen, went to them, and\n disclosed the project. So when they were alone the king’s daughter said to\n her eleven girls: ‘Show some constraint, and do not look round at the\n spinning-wheels.’ And next morning when the king had his twelve huntsmen\n summoned, they went through the ante-chamber, and never once looked at the\n spinning-wheels. Then the king again said to the lion: ‘You have deceived\n me, they are men, for they have not looked at the spinning-wheels.’ The\n lion replied: ‘They have restrained themselves.’ The king, however, would\n no longer believe the lion.\nThe twelve huntsmen always followed the king to the chase, and his liking\n for them continually increased. Now it came to pass that once when they\n were out hunting, news came that the king’s bride was approaching. When\n the true bride heard that, it hurt her so much that her heart was almost\n broken, and she fell fainting to the ground. The king thought something\n had happened to his dear huntsman, ran up to him, wanted to help him, and\n drew his glove off. Then he saw the ring which he had given to his first\n bride, and when he looked in her face he recognized her. Then his heart\n was so touched that he kissed her, and when she opened her eyes he said:\n ‘You are mine, and I am yours, and no one in the world can alter that.’ He\n sent a messenger to the other bride, and entreated her to return to her\n own kingdom, for he had a wife already, and someone who had just found an\n old key did not require a new one. Thereupon the wedding was celebrated,\n and the lion was again taken into favour, because, after all, he had told\n the truth.', 'OLD SULTAN\n\nA shepherd had a faithful dog, called Sultan, who was grown very old, and\n had lost all his teeth. And one day when the shepherd and his wife were\n standing together before the house the shepherd said, ‘I will shoot old\n Sultan tomorrow morning, for he is of no use now.’ But his wife said,\n ‘Pray let the poor faithful creature live; he has served us well a great\n many years, and we ought to give him a livelihood for the rest of his\n days.’ ‘But what can we do with him?’ said the shepherd, ‘he has not a\n tooth in his head, and the thieves don’t care for him at all; to be sure\n he has served us, but then he did it to earn his livelihood; tomorrow\n shall be his last day, depend upon it.’\nPoor Sultan, who was lying close by them, heard all that the shepherd and\n his wife said to one another, and was very much frightened to think\n tomorrow would be his last day; so in the evening he went to his good\n friend the wolf, who lived in the wood, and told him all his sorrows, and\n how his master meant to kill him in the morning. ‘Make yourself easy,’\n said the wolf, ‘I will give you some good advice. Your master, you know,\n goes out every morning very early with his wife into the field; and they\n take their little child with them, and lay it down behind the hedge in the\n shade while they are at work. Now do you lie down close by the child, and\n pretend to be watching it, and I will come out of the wood and run away\n with it; you must run after me as fast as you can, and I will let it drop;\n then you may carry it back, and they will think you have saved their\n child, and will be so thankful to you that they will take care of you as\n long as you live.’ The dog liked this plan very well; and accordingly so\n it was managed. The wolf ran with the child a little way; the shepherd and\n his wife screamed out; but Sultan soon overtook him, and carried the poor\n little thing back to his master and mistress. Then the shepherd patted him\n on the head, and said, ‘Old Sultan has saved our child from the wolf, and\n therefore he shall live and be well taken care of, and have plenty to eat.\n Wife, go home, and give him a good dinner, and let him have my old cushion\n to sleep on as long as he lives.’ So from this time forward Sultan had all\n that he could wish for.\nSoon afterwards the wolf came and wished him joy, and said, ‘Now, my good\n fellow, you must tell no tales, but turn your head the other way when I\n want to taste one of the old shepherd’s fine fat sheep.’ ‘No,’ said the\n Sultan; ‘I will be true to my master.’ However, the wolf thought he was in\n joke, and came one night to get a dainty morsel. But Sultan had told his\n master what the wolf meant to do; so he laid wait for him behind the barn\n door, and when the wolf was busy looking out for a good fat sheep, he had\n a stout cudgel laid about his back, that combed his locks for him finely.\nThen the wolf was very angry, and called Sultan ‘an old rogue,’ and swore\n he would have his revenge. So the next morning the wolf sent the boar to\n challenge Sultan to come into the wood to fight the matter. Now Sultan had\n nobody he could ask to be his second but the shepherd’s old three-legged\n cat; so he took her with him, and as the poor thing limped along with some\n trouble, she stuck up her tail straight in the air.\nThe wolf and the wild boar were first on the ground; and when they espied\n their enemies coming, and saw the cat’s long tail standing straight in the\n air, they thought she was carrying a sword for Sultan to fight with; and\n every time she limped, they thought she was picking up a stone to throw at\n them; so they said they should not like this way of fighting, and the boar\n lay down behind a bush, and the wolf jumped up into a tree. Sultan and the\n cat soon came up, and looked about and wondered that no one was there. The\n boar, however, had not quite hidden himself, for his ears stuck out of the\n bush; and when he shook one of them a little, the cat, seeing something\n move, and thinking it was a mouse, sprang upon it, and bit and scratched\n it, so that the boar jumped up and grunted, and ran away, roaring out,\n ‘Look up in the tree, there sits the one who is to blame.’ So they looked\n up, and espied the wolf sitting amongst the branches; and they called him\n a cowardly rascal, and would not suffer him to come down till he was\n heartily ashamed of himself, and had promised to be good friends again\n with old Sultan.', 'THE FOX AND THE CAT\n\nIt happened that the cat met the fox in a forest, and as she thought to\n herself: ‘He is clever and full of experience, and much esteemed in the\n world,’ she spoke to him in a friendly way. ‘Good day, dear Mr Fox, how\n are you? How is all with you? How are you getting on in these hard times?’\n The fox, full of all kinds of arrogance, looked at the cat from head to\n foot, and for a long time did not know whether he would give any answer or\n not. At last he said: ‘Oh, you wretched beard-cleaner, you piebald fool,\n you hungry mouse-hunter, what can you be thinking of? Have you the cheek\n to ask how I am getting on? What have you learnt? How many arts do you\n understand?’ ‘I understand but one,’ replied the cat, modestly. ‘What art\n is that?’ asked the fox. ‘When the hounds are following me, I can spring\n into a tree and save myself.’ ‘Is that all?’ said the fox. ‘I am master of\n a hundred arts, and have into the bargain a sackful of cunning. You make\n me sorry for you; come with me, I will teach you how people get away from\n the hounds.’ Just then came a hunter with four dogs. The cat sprang nimbly\n up a tree, and sat down at the top of it, where the branches and foliage\n quite concealed her. ‘Open your sack, Mr Fox, open your sack,’ cried the\n cat to him, but the dogs had already seized him, and were holding him\n fast. ‘Ah, Mr Fox,’ cried the cat. ‘You with your hundred arts are left in\n the lurch! Had you been able to climb like me, you would not have lost\n your life.’']","- In The Twelve Huntsmen: The lion acts as a truth-teller and tester. He claims the huntsmen are not what they seem and sets up tests (the peas, then the spinning-wheels) to force proof of their true nature and character. When the tests show they are indeed men, the lion’s evidence confirms the hidden truth and supports the eventual reunion with the true bride.

- In Old Sultan: There is no lion mentioned, so the lion does not play a role there.","In the first story, the lion is a wondrous animal who knows all concealed and secret things. He tries to reveal the true identity of the twelve huntsmen, who are actually girls in disguise, by suggesting tests to the king, such as walking over peas and ignoring spinning-wheels. Although his attempts are thwarted by the huntsmen’s foreknowledge, the lion’s role is to uncover the truth. In the second story, the lion is used as a measure of strength by the farmer, who tells his old horse he will only take him back if he is stronger than a lion. With the help of the fox, the horse outsmarts the lion, dragging him to the farmer and thus proving his worth. In both tales, the lion serves as a test or challenge that reveals the true nature or abilities of the main characters.",0.5,0.625,0.2
How witch treat people in these stories and what happen to them after?,"['HANSEL AND GRETEL\n\nHard by a great forest dwelt a poor wood-cutter with his wife and his two\n children. The boy was called Hansel and the girl Gretel. He had little to\n bite and to break, and once when great dearth fell on the land, he could\n no longer procure even daily bread. Now when he thought over this by night\n in his bed, and tossed about in his anxiety, he groaned and said to his\n wife: ‘What is to become of us? How are we to feed our poor children, when\n we no longer have anything even for ourselves?’ ‘I’ll tell you what,\n husband,’ answered the woman, ‘early tomorrow morning we will take the\n children out into the forest to where it is the thickest; there we will\n light a fire for them, and give each of them one more piece of bread, and\n then we will go to our work and leave them alone. They will not find the\n way home again, and we shall be rid of them.’ ‘No, wife,’ said the man, ‘I\n will not do that; how can I bear to leave my children alone in the forest?—the\n wild animals would soon come and tear them to pieces.’ ‘O, you fool!’ said\n she, ‘then we must all four die of hunger, you may as well plane the\n planks for our coffins,’ and she left him no peace until he consented.\n ‘But I feel very sorry for the poor children, all the same,’ said the man.\nThe two children had also not been able to sleep for hunger, and had heard\n what their stepmother had said to their father. Gretel wept bitter tears,\n and said to Hansel: ‘Now all is over with us.’ ‘Be quiet, Gretel,’ said\n Hansel, ‘do not distress yourself, I will soon find a way to help us.’ And\n when the old folks had fallen asleep, he got up, put on his little coat,\n opened the door below, and crept outside. The moon shone brightly, and the\n white pebbles which lay in front of the house glittered like real silver\n pennies. Hansel stooped and stuffed the little pocket of his coat with as\n many as he could get in. Then he went back and said to Gretel: ‘Be\n comforted, dear little sister, and sleep in peace, God will not forsake\n us,’ and he lay down again in his bed. When day dawned, but before the sun\n had risen, the woman came and awoke the two children, saying: ‘Get up, you\n sluggards! we are going into the forest to fetch wood.’ She gave each a\n little piece of bread, and said: ‘There is something for your dinner, but\n do not eat it up before then, for you will get nothing else.’ Gretel took\n the bread under her apron, as Hansel had the pebbles in his pocket. Then\n they all set out together on the way to the forest. When they had walked a\n short time, Hansel stood still and peeped back at the house, and did so\n again and again. His father said: ‘Hansel, what are you looking at there\n and staying behind for? Pay attention, and do not forget how to use your\n legs.’ ‘Ah, father,’ said Hansel, ‘I am looking at my little white cat,\n which is sitting up on the roof, and wants to say goodbye to me.’ The wife\n said: ‘Fool, that is not your little cat, that is the morning sun which is\n shining on the chimneys.’ Hansel, however, had not been looking back at\n the cat, but had been constantly throwing one of the white pebble-stones\n out of his pocket on the road.\nWhen they had reached the middle of the forest, the father said: ‘Now,\n children, pile up some wood, and I will light a fire that you may not be\n cold.’ Hansel and Gretel gathered brushwood together, as high as a little\n hill. The brushwood was lighted, and when the flames were burning very\n high, the woman said: ‘Now, children, lay yourselves down by the fire and\n rest, we will go into the forest and cut some wood. When we have done, we\n will come back and fetch you away.’\nHansel and Gretel sat by the fire, and when noon came, each ate a little\n piece of bread, and as they heard the strokes of the wood-axe they\n believed that their father was near. It was not the axe, however, but a\n branch which he had fastened to a withered tree which the wind was blowing\n backwards and forwards. And as they had been sitting such a long time,\n their eyes closed with fatigue, and they fell fast asleep. When at last\n they awoke, it was already dark night. Gretel began to cry and said: ‘How\n are we to get out of the forest now?’ But Hansel comforted her and said:\n ‘Just wait a little, until the moon has risen, and then we will soon find\n the way.’ And when the full moon had risen, Hansel took his little sister\n by the hand, and followed the pebbles which shone like newly-coined silver\n pieces, and showed them the way.\nThey walked the whole night long, and by break of day came once more to\n their father’s house. They knocked at the door, and when the woman opened\n it and saw that it was Hansel and Gretel, she said: ‘You naughty children,\n why have you slept so long in the forest?—we thought you were never\n coming back at all!’ The father, however, rejoiced, for it had cut him to\n the heart to leave them behind alone.\nNot long afterwards, there was once more great dearth throughout the land,\n and the children heard their mother saying at night to their father:\n ‘Everything is eaten again, we have one half loaf left, and that is the\n end. The children must go, we will take them farther into the wood, so\n that they will not find their way out again; there is no other means of\n saving ourselves!’ The man’s heart was heavy, and he thought: ‘It would be\n better for you to share the last mouthful with your children.’ The woman,\n however, would listen to nothing that he had to say, but scolded and\n reproached him. He who says A must say B, likewise, and as he had yielded\n the first time, he had to do so a second time also.\nThe children, however, were still awake and had heard the conversation.\n When the old folks were asleep, Hansel again got up, and wanted to go out\n and pick up pebbles as he had done before, but the woman had locked the\n door, and Hansel could not get out. Nevertheless he comforted his little\n sister, and said: ‘Do not cry, Gretel, go to sleep quietly, the good God\n will help us.’\nEarly in the morning came the woman, and took the children out of their\n beds. Their piece of bread was given to them, but it was still smaller\n than the time before. On the way into the forest Hansel crumbled his in\n his pocket, and often stood still and threw a morsel on the ground.\n ‘Hansel, why do you stop and look round?’ said the father, ‘go on.’ ‘I am\n looking back at my little pigeon which is sitting on the roof, and wants\n to say goodbye to me,’ answered Hansel. ‘Fool!’ said the woman, ‘that is\n not your little pigeon, that is the morning sun that is shining on the\n chimney.’ Hansel, however little by little, threw all the crumbs on the\n path.\nThe woman led the children still deeper into the forest, where they had\n never in their lives been before. Then a great fire was again made, and\n the mother said: ‘Just sit there, you children, and when you are tired you\n may sleep a little; we are going into the forest to cut wood, and in the\n evening when we are done, we will come and fetch you away.’ When it was\n noon, Gretel shared her piece of bread with Hansel, who had scattered his\n by the way. Then they fell asleep and evening passed, but no one came to\n the poor children. They did not awake until it was dark night, and Hansel\n comforted his little sister and said: ‘Just wait, Gretel, until the moon\n rises, and then we shall see the crumbs of bread which I have strewn\n about, they will show us our way home again.’ When the moon came they set\n out, but they found no crumbs, for the many thousands of birds which fly\n about in the woods and fields had picked them all up. Hansel said to\n Gretel: ‘We shall soon find the way,’ but they did not find it. They\n walked the whole night and all the next day too from morning till evening,\n but they did not get out of the forest, and were very hungry, for they had\n nothing to eat but two or three berries, which grew on the ground. And as\n they were so weary that their legs would carry them no longer, they lay\n down beneath a tree and fell asleep.\nIt was now three mornings since they had left their father’s house. They\n began to walk again, but they always came deeper into the forest, and if\n help did not come soon, they must die of hunger and weariness. When it was\n mid-day, they saw a beautiful snow-white bird sitting on a bough, which\n sang so delightfully that they stood still and listened to it. And when\n its song was over, it spread its wings and flew away before them, and they\n followed it until they reached a little house, on the roof of which it\n alighted; and when they approached the little house they saw that it was\n built of bread and covered with cakes, but that the windows were of clear\n sugar. ‘We will set to work on that,’ said Hansel, ‘and have a good meal.\n I will eat a bit of the roof, and you Gretel, can eat some of the window,\n it will taste sweet.’ Hansel reached up above, and broke off a little of\n the roof to try how it tasted, and Gretel leant against the window and\n nibbled at the panes. Then a soft voice cried from the parlour:\n‘Nibble, nibble, gnaw,\n Who is nibbling at my little house?’\nThe children answered:\n‘The wind, the wind,\n The heaven-born wind,’\nand went on eating without disturbing themselves. Hansel, who liked the\n taste of the roof, tore down a great piece of it, and Gretel pushed out\n the whole of one round window-pane, sat down, and enjoyed herself with it.\n Suddenly the door opened, and a woman as old as the hills, who supported\n herself on crutches, came creeping out. Hansel and Gretel were so terribly\n frightened that they let fall what they had in their hands. The old woman,\n however, nodded her head, and said: ‘Oh, you dear children, who has\n brought you here? do come in, and stay with me. No harm shall happen to\n you.’ She took them both by the hand, and led them into her little house.\n Then good food was set before them, milk and pancakes, with sugar, apples,\n and nuts. Afterwards two pretty little beds were covered with clean white\n linen, and Hansel and Gretel lay down in them, and thought they were in\n heaven.\nThe old woman had only pretended to be so kind; she was in reality a\n wicked witch, who lay in wait for children, and had only built the little\n house of bread in order to entice them there. When a child fell into her\n power, she killed it, cooked and ate it, and that was a feast day with\n her. Witches have red eyes, and cannot see far, but they have a keen scent\n like the beasts, and are aware when human beings draw near. When Hansel\n and Gretel came into her neighbourhood, she laughed with malice, and said\n mockingly: ‘I have them, they shall not escape me again!’ Early in the\n morning before the children were awake, she was already up, and when she\n saw both of them sleeping and looking so pretty, with their plump and rosy\n cheeks she muttered to herself: ‘That will be a dainty mouthful!’ Then she\n seized Hansel with her shrivelled hand, carried him into a little stable,\n and locked him in behind a grated door. Scream as he might, it would not\n help him. Then she went to Gretel, shook her till she awoke, and cried:\n ‘Get up, lazy thing, fetch some water, and cook something good for your\n brother, he is in the stable outside, and is to be made fat. When he is\n fat, I will eat him.’ Gretel began to weep bitterly, but it was all in\n vain, for she was forced to do what the wicked witch commanded.\nAnd now the best food was cooked for poor Hansel, but Gretel got nothing\n but crab-shells. Every morning the woman crept to the little stable, and\n cried: ‘Hansel, stretch out your finger that I may feel if you will soon\n be fat.’ Hansel, however, stretched out a little bone to her, and the old\n woman, who had dim eyes, could not see it, and thought it was Hansel’s\n finger, and was astonished that there was no way of fattening him. When\n four weeks had gone by, and Hansel still remained thin, she was seized\n with impatience and would not wait any longer. ‘Now, then, Gretel,’ she\n cried to the girl, ‘stir yourself, and bring some water. Let Hansel be fat\n or lean, tomorrow I will kill him, and cook him.’ Ah, how the poor little\n sister did lament when she had to fetch the water, and how her tears did\n flow down her cheeks! ‘Dear God, do help us,’ she cried. ‘If the wild\n beasts in the forest had but devoured us, we should at any rate have died\n together.’ ‘Just keep your noise to yourself,’ said the old woman, ‘it\n won’t help you at all.’\nEarly in the morning, Gretel had to go out and hang up the cauldron with\n the water, and light the fire. ‘We will bake first,’ said the old woman,\n ‘I have already heated the oven, and kneaded the dough.’ She pushed poor\n Gretel out to the oven, from which flames of fire were already darting.\n ‘Creep in,’ said the witch, ‘and see if it is properly heated, so that we\n can put the bread in.’ And once Gretel was inside, she intended to shut\n the oven and let her bake in it, and then she would eat her, too. But\n Gretel saw what she had in mind, and said: ‘I do not know how I am to do\n it; how do I get in?’ ‘Silly goose,’ said the old woman. ‘The door is big\n enough; just look, I can get in myself!’ and she crept up and thrust her\n head into the oven. Then Gretel gave her a push that drove her far into\n it, and shut the iron door, and fastened the bolt. Oh! then she began to\n howl quite horribly, but Gretel ran away and the godless witch was\n miserably burnt to death.\nGretel, however, ran like lightning to Hansel, opened his little stable,\n and cried: ‘Hansel, we are saved! The old witch is dead!’ Then Hansel\n sprang like a bird from its cage when the door is opened. How they did\n rejoice and embrace each other, and dance about and kiss each other! And\n as they had no longer any need to fear her, they went into the witch’s\n house, and in every corner there stood chests full of pearls and jewels.\n ‘These are far better than pebbles!’ said Hansel, and thrust into his\n pockets whatever could be got in, and Gretel said: ‘I, too, will take\n something home with me,’ and filled her pinafore full. ‘But now we must be\n off,’ said Hansel, ‘that we may get out of the witch’s forest.’\nWhen they had walked for two hours, they came to a great stretch of water.\n ‘We cannot cross,’ said Hansel, ‘I see no foot-plank, and no bridge.’ ‘And\n there is also no ferry,’ answered Gretel, ‘but a white duck is swimming\n there: if I ask her, she will help us over.’ Then she cried:\n‘Little duck, little duck, dost thou see,\n Hansel and Gretel are waiting for thee?\n There’s never a plank, or bridge in sight,\n Take us across on thy back so white.’\nThe duck came to them, and Hansel seated himself on its back, and told his\n sister to sit by him. ‘No,’ replied Gretel, ‘that will be too heavy for\n the little duck; she shall take us across, one after the other.’ The good\n little duck did so, and when they were once safely across and had walked\n for a short time, the forest seemed to be more and more familiar to them,\n and at length they saw from afar their father’s house. Then they began to\n run, rushed into the parlour, and threw themselves round their father’s\n neck. The man had not known one happy hour since he had left the children\n in the forest; the woman, however, was dead. Gretel emptied her pinafore\n until pearls and precious stones ran about the room, and Hansel threw one\n handful after another out of his pocket to add to them. Then all anxiety\n was at an end, and they lived together in perfect happiness. My tale is\n done, there runs a mouse; whosoever catches it, may make himself a big fur\n cap out of it.', 'THE SALAD\n\nAs a merry young huntsman was once going briskly along through a wood,\n there came up a little old woman, and said to him, ‘Good day, good day;\n you seem merry enough, but I am hungry and thirsty; do pray give me\n something to eat.’ The huntsman took pity on her, and put his hand in his\n pocket and gave her what he had. Then he wanted to go his way; but she\n took hold of him, and said, ‘Listen, my friend, to what I am going to tell\n you; I will reward you for your kindness; go your way, and after a little\n time you will come to a tree where you will see nine birds sitting on a\n cloak. Shoot into the midst of them, and one will fall down dead: the\n cloak will fall too; take it, it is a wishing-cloak, and when you wear it\n you will find yourself at any place where you may wish to be. Cut open the\n dead bird, take out its heart and keep it, and you will find a piece of\n gold under your pillow every morning when you rise. It is the bird’s heart\n that will bring you this good luck.’\nThe huntsman thanked her, and thought to himself, ‘If all this does\n happen, it will be a fine thing for me.’ When he had gone a hundred steps\n or so, he heard a screaming and chirping in the branches over him, and\n looked up and saw a flock of birds pulling a cloak with their bills and\n feet; screaming, fighting, and tugging at each other as if each wished to\n have it himself. ‘Well,’ said the huntsman, ‘this is wonderful; this\n happens just as the old woman said’; then he shot into the midst of them\n so that their feathers flew all about. Off went the flock chattering away;\n but one fell down dead, and the cloak with it. Then the huntsman did as\n the old woman told him, cut open the bird, took out the heart, and carried\n the cloak home with him.\nThe next morning when he awoke he lifted up his pillow, and there lay the\n piece of gold glittering underneath; the same happened next day, and\n indeed every day when he arose. He heaped up a great deal of gold, and at\n last thought to himself, ‘Of what use is this gold to me whilst I am at\n home? I will go out into the world and look about me.’\nThen he took leave of his friends, and hung his bag and bow about his\n neck, and went his way. It so happened that his road one day led through a\n thick wood, at the end of which was a large castle in a green meadow, and\n at one of the windows stood an old woman with a very beautiful young lady\n by her side looking about them. Now the old woman was a witch, and said to\n the young lady, ‘There is a young man coming out of the wood who carries a\n wonderful prize; we must get it away from him, my dear child, for it is\n more fit for us than for him. He has a bird’s heart that brings a piece of\n gold under his pillow every morning.’ Meantime the huntsman came nearer\n and looked at the lady, and said to himself, ‘I have been travelling so\n long that I should like to go into this castle and rest myself, for I have\n money enough to pay for anything I want’; but the real reason was, that he\n wanted to see more of the beautiful lady. Then he went into the house, and\n was welcomed kindly; and it was not long before he was so much in love\n that he thought of nothing else but looking at the lady’s eyes, and doing\n everything that she wished. Then the old woman said, ‘Now is the time for\n getting the bird’s heart.’ So the lady stole it away, and he never found\n any more gold under his pillow, for it lay now under the young lady’s, and\n the old woman took it away every morning; but he was so much in love that\n he never missed his prize.\n‘Well,’ said the old witch, ‘we have got the bird’s heart, but not the\n wishing-cloak yet, and that we must also get.’ ‘Let us leave him that,’\n said the young lady; ‘he has already lost his wealth.’ Then the witch was\n very angry, and said, ‘Such a cloak is a very rare and wonderful thing,\n and I must and will have it.’ So she did as the old woman told her, and\n set herself at the window, and looked about the country and seemed very\n sorrowful; then the huntsman said, ‘What makes you so sad?’ ‘Alas! dear\n sir,’ said she, ‘yonder lies the granite rock where all the costly\n diamonds grow, and I want so much to go there, that whenever I think of it\n I cannot help being sorrowful, for who can reach it? only the birds and\n the flies—man cannot.’ ‘If that’s all your grief,’ said the\n huntsman, ‘I’ll take you there with all my heart’; so he drew her under his\n cloak, and the moment he wished to be on the granite mountain they were\n both there. The diamonds glittered so on all sides that they were\n delighted with the sight and picked up the finest. But the old witch made\n a deep sleep come upon him, and he said to the young lady, ‘Let us sit\n down and rest ourselves a little, I am so tired that I cannot stand any\n longer.’ So they sat down, and he laid his head in her lap and fell\n asleep; and whilst he was sleeping on she took the cloak from his\n shoulders, hung it on her own, picked up the diamonds, and wished herself\n home again.\nWhen he awoke and found that his lady had tricked him, and left him alone\n on the wild rock, he said, ‘Alas! what roguery there is in the world!’ and\n there he sat in great grief and fear, not knowing what to do. Now this\n rock belonged to fierce giants who lived upon it; and as he saw three of\n them striding about, he thought to himself, ‘I can only save myself by\n feigning to be asleep’; so he laid himself down as if he were in a sound\n sleep. When the giants came up to him, the first pushed him with his foot,\n and said, ‘What worm is this that lies here curled up?’ ‘Tread upon him\n and kill him,’ said the second. ‘It’s not worth the trouble,’ said the\n third; ‘let him live, he’ll go climbing higher up the mountain, and some\n cloud will come rolling and carry him away.’ And they passed on. But the\n huntsman had heard all they said; and as soon as they were gone, he\n climbed to the top of the mountain, and when he had sat there a short time\n a cloud came rolling around him, and caught him in a whirlwind and bore\n him along for some time, till it settled in a garden, and he fell quite\n gently to the ground amongst the greens and cabbages.\nThen he looked around him, and said, ‘I wish I had something to eat, if\n not I shall be worse off than before; for here I see neither apples nor\n pears, nor any kind of fruits, nothing but vegetables.’ At last he thought\n to himself, ‘I can eat salad, it will refresh and strengthen me.’ So he\n picked out a fine head and ate of it; but scarcely had he swallowed two\n bites when he felt himself quite changed, and saw with horror that he was\n turned into an ass. However, he still felt very hungry, and the salad\n tasted very nice; so he ate on till he came to another kind of salad, and\n scarcely had he tasted it when he felt another change come over him, and\n soon saw that he was lucky enough to have found his old shape again.\nThen he laid himself down and slept off a little of his weariness; and\n when he awoke the next morning he broke off a head both of the good and\n the bad salad, and thought to himself, ‘This will help me to my fortune\n again, and enable me to pay off some folks for their treachery.’ So he\n went away to try and find the castle of his friends; and after wandering\n about a few days he luckily found it. Then he stained his face all over\n brown, so that even his mother would not have known him, and went into the\n castle and asked for a lodging; ‘I am so tired,’ said he, ‘that I can go\n no farther.’ ‘Countryman,’ said the witch, ‘who are you? and what is your\n business?’ ‘I am,’ said he, ‘a messenger sent by the king to find the\n finest salad that grows under the sun. I have been lucky enough to find\n it, and have brought it with me; but the heat of the sun scorches so that\n it begins to wither, and I don’t know that I can carry it farther.’\nWhen the witch and the young lady heard of his beautiful salad, they\n longed to taste it, and said, ‘Dear countryman, let us just taste it.’ ‘To\n be sure,’ answered he; ‘I have two heads of it with me, and will give you\n one’; so he opened his bag and gave them the bad. Then the witch herself\n took it into the kitchen to be dressed; and when it was ready she could\n not wait till it was carried up, but took a few leaves immediately and put\n them in her mouth, and scarcely were they swallowed when she lost her own\n form and ran braying down into the court in the form of an ass. Now the\n servant-maid came into the kitchen, and seeing the salad ready, was going\n to carry it up; but on the way she too felt a wish to taste it as the old\n woman had done, and ate some leaves; so she also was turned into an ass\n and ran after the other, letting the dish with the salad fall on the\n ground. The messenger sat all this time with the beautiful young lady, and\n as nobody came with the salad and she longed to taste it, she said, ‘I\n don’t know where the salad can be.’ Then he thought something must have\n happened, and said, ‘I will go into the kitchen and see.’ And as he went\n he saw two asses in the court running about, and the salad lying on the\n ground. ‘All right!’ said he; ‘those two have had their share.’ Then he\n took up the rest of the leaves, laid them on the dish and brought them to\n the young lady, saying, ‘I bring you the dish myself that you may not wait\n any longer.’ So she ate of it, and like the others ran off into the court\n braying away.\nThen the huntsman washed his face and went into the court that they might\n know him. ‘Now you shall be paid for your roguery,’ said he; and tied them\n all three to a rope and took them along with him till he came to a mill\n and knocked at the window. ‘What’s the matter?’ said the miller. ‘I have\n three tiresome beasts here,’ said the other; ‘if you will take them, give\n them food and room, and treat them as I tell you, I will pay you whatever\n you ask.’ ‘With all my heart,’ said the miller; ‘but how shall I treat\n them?’ Then the huntsman said, ‘Give the old one stripes three times a day\n and hay once; give the next (who was the servant-maid) stripes once a day\n and hay three times; and give the youngest (who was the beautiful lady)\n hay three times a day and no stripes’: for he could not find it in his\n heart to have her beaten. After this he went back to the castle, where he\n found everything he wanted.\nSome days after, the miller came to him and told him that the old ass was\n dead; ‘The other two,’ said he, ‘are alive and eat, but are so sorrowful\n that they cannot last long.’ Then the huntsman pitied them, and told the\n miller to drive them back to him, and when they came, he gave them some of\n the good salad to eat. And the beautiful young lady fell upon her knees\n before him, and said, ‘O dearest huntsman! forgive me all the ill I have\n done you; my mother forced me to it, it was against my will, for I always\n loved you very much. Your wishing-cloak hangs up in the closet, and as for\n the bird’s heart, I will give it you too.’ But he said, ‘Keep it, it will\n be just the same thing, for I mean to make you my wife.’ So they were\n married, and lived together very happily till they died.', 'RAPUNZEL\n\nThere were once a man and a woman who had long in vain wished for a child.\n At length the woman hoped that God was about to grant her desire. These\n people had a little window at the back of their house from which a\n splendid garden could be seen, which was full of the most beautiful\n flowers and herbs. It was, however, surrounded by a high wall, and no one\n dared to go into it because it belonged to an enchantress, who had great\n power and was dreaded by all the world. One day the woman was standing by\n this window and looking down into the garden, when she saw a bed which was\n planted with the most beautiful rampion (rapunzel), and it looked so fresh\n and green that she longed for it, she quite pined away, and began to look\n pale and miserable. Then her husband was alarmed, and asked: ‘What ails\n you, dear wife?’ ‘Ah,’ she replied, ‘if I can’t eat some of the rampion,\n which is in the garden behind our house, I shall die.’ The man, who loved\n her, thought: ‘Sooner than let your wife die, bring her some of the\n rampion yourself, let it cost what it will.’ At twilight, he clambered\n down over the wall into the garden of the enchantress, hastily clutched a\n handful of rampion, and took it to his wife. She at once made herself a\n salad of it, and ate it greedily. It tasted so good to her—so very\n good, that the next day she longed for it three times as much as before.\n If he was to have any rest, her husband must once more descend into the\n garden. In the gloom of evening therefore, he let himself down again; but\n when he had clambered down the wall he was terribly afraid, for he saw the\n enchantress standing before him. ‘How can you dare,’ said she with angry\n look, ‘descend into my garden and steal my rampion like a thief? You shall\n suffer for it!’ ‘Ah,’ answered he, ‘let mercy take the place of justice, I\n only made up my mind to do it out of necessity. My wife saw your rampion\n from the window, and felt such a longing for it that she would have died\n if she had not got some to eat.’ Then the enchantress allowed her anger to\n be softened, and said to him: ‘If the case be as you say, I will allow you\n to take away with you as much rampion as you will, only I make one\n condition, you must give me the child which your wife will bring into the\n world; it shall be well treated, and I will care for it like a mother.’\n The man in his terror consented to everything, and when the woman was\n brought to bed, the enchantress appeared at once, gave the child the name\n of Rapunzel, and took it away with her.\nRapunzel grew into the most beautiful child under the sun. When she was\n twelve years old, the enchantress shut her into a tower, which lay in a\n forest, and had neither stairs nor door, but quite at the top was a little\n window. When the enchantress wanted to go in, she placed herself beneath\n it and cried:\n‘Rapunzel, Rapunzel,\n Let down your hair to me.’\nRapunzel had magnificent long hair, fine as spun gold, and when she heard\n the voice of the enchantress she unfastened her braided tresses, wound\n them round one of the hooks of the window above, and then the hair fell\n twenty ells down, and the enchantress climbed up by it.\nAfter a year or two, it came to pass that the king’s son rode through the\n forest and passed by the tower. Then he heard a song, which was so\n charming that he stood still and listened. This was Rapunzel, who in her\n solitude passed her time in letting her sweet voice resound. The king’s\n son wanted to climb up to her, and looked for the door of the tower, but\n none was to be found. He rode home, but the singing had so deeply touched\n his heart, that every day he went out into the forest and listened to it.\n Once when he was thus standing behind a tree, he saw that an enchantress\n came there, and he heard how she cried:\n‘Rapunzel, Rapunzel,\n Let down your hair to me.’\nThen Rapunzel let down the braids of her hair, and the enchantress climbed\n up to her. ‘If that is the ladder by which one mounts, I too will try my\n fortune,’ said he, and the next day when it began to grow dark, he went to\n the tower and cried:\n‘Rapunzel, Rapunzel,\n Let down your hair to me.’\nImmediately the hair fell down and the king’s son climbed up.\nAt first Rapunzel was terribly frightened when a man, such as her eyes had\n never yet beheld, came to her; but the king’s son began to talk to her\n quite like a friend, and told her that his heart had been so stirred that\n it had let him have no rest, and he had been forced to see her. Then\n Rapunzel lost her fear, and when he asked her if she would take him for\n her husband, and she saw that he was young and handsome, she thought: ‘He\n will love me more than old Dame Gothel does’; and she said yes, and laid\n her hand in his. She said: ‘I will willingly go away with you, but I do\n not know how to get down. Bring with you a skein of silk every time that\n you come, and I will weave a ladder with it, and when that is ready I will\n descend, and you will take me on your horse.’ They agreed that until that\n time he should come to her every evening, for the old woman came by day.\n The enchantress remarked nothing of this, until once Rapunzel said to her:\n ‘Tell me, Dame Gothel, how it happens that you are so much heavier for me\n to draw up than the young king’s son—he is with me in a moment.’\n ‘Ah! you wicked child,’ cried the enchantress. ‘What do I hear you say! I\n thought I had separated you from all the world, and yet you have deceived\n me!’ In her anger she clutched Rapunzel’s beautiful tresses, wrapped them\n twice round her left hand, seized a pair of scissors with the right, and\n snip, snap, they were cut off, and the lovely braids lay on the ground.\n And she was so pitiless that she took poor Rapunzel into a desert where\n she had to live in great grief and misery.\nOn the same day that she cast out Rapunzel, however, the enchantress\n fastened the braids of hair, which she had cut off, to the hook of the\n window, and when the king’s son came and cried:\n‘Rapunzel, Rapunzel,\n Let down your hair to me.’\nshe let the hair down. The king’s son ascended, but instead of finding his\n dearest Rapunzel, he found the enchantress, who gazed at him with wicked\n and venomous looks. ‘Aha!’ she cried mockingly, ‘you would fetch your\n dearest, but the beautiful bird sits no longer singing in the nest; the\n cat has got it, and will scratch out your eyes as well. Rapunzel is lost\n to you; you will never see her again.’ The king’s son was beside himself\n with pain, and in his despair he leapt down from the tower. He escaped\n with his life, but the thorns into which he fell pierced his eyes. Then he\n wandered quite blind about the forest, ate nothing but roots and berries,\n and did naught but lament and weep over the loss of his dearest wife. Thus\n he roamed about in misery for some years, and at length came to the desert\n where Rapunzel, with the twins to which she had given birth, a boy and a\n girl, lived in wretchedness. He heard a voice, and it seemed so familiar\n to him that he went towards it, and when he approached, Rapunzel knew him\n and fell on his neck and wept. Two of her tears wetted his eyes and they\n grew clear again, and he could see with them as before. He led her to his\n kingdom where he was joyfully received, and they lived for a long time\n afterwards, happy and contented.']","- Hansel and Gretel: The witch lures children with kindness, fattening Hansel for cooking. She is killed by Gretel pushing him into the oven; Hansel and Gretel escape, find treasure, and live happily.

- The Salad: The old woman witch uses deceit (gives gifts, a “wishing cloak,” and crooks), steals the bird’s heart and the cloak. She, and those who taste the salad, are transformed into animals (asses) by the magic; the huntsman frees the lady, and they marry.

- Rapunzel: The enchantress Gothel treats Rapunzel as a prisoner, locking her in a tower and using magic to keep her there. After the king’s son is harmed and Rapunzel is cast out, they are eventually reunited, and live happily; Gothel remains a foe.","In the first story, the witch make the soldier do hard work and try to trick him by taking the blue light, but she end up being caught by the little black dwarf and is hanged on the gallows. In the second story, the witch and her daughter trick the huntsman to steal his magic things, but later the huntsman tricks them with magic salad and they turn into asses. The witch in both stories try to use magic and tricks on people, but in the end they get punished for what they do.",0.3333333333333333,0.7727272727272727,0.0
"wut did the cook do when she herd Tom Thumb in the parson’s house, and how did this lead to Tom ending up in the cow?","['TOM THUMB\n\nA poor woodman sat in his cottage one night, smoking his pipe by the\n fireside, while his wife sat by his side spinning. ‘How lonely it is,\n wife,’ said he, as he puffed out a long curl of smoke, ‘for you and me to\n sit here by ourselves, without any children to play about and amuse us\n while other people seem so happy and merry with their children!’ ‘What you\n say is very true,’ said the wife, sighing, and turning round her wheel;\n ‘how happy should I be if I had but one child! If it were ever so small—nay,\n if it were no bigger than my thumb—I should be very happy, and love\n it dearly.’ Now—odd as you may think it—it came to pass that\n this good woman’s wish was fulfilled, just in the very way she had wished\n it; for, not long afterwards, she had a little boy, who was quite healthy\n and strong, but was not much bigger than my thumb. So they said, ‘Well, we\n cannot say we have not got what we wished for, and, little as he is, we\n will love him dearly.’ And they called him Thomas Thumb.\nThey gave him plenty of food, yet for all they could do he never grew\n bigger, but kept just the same size as he had been when he was born.\n Still, his eyes were sharp and sparkling, and he soon showed himself to be\n a clever little fellow, who always knew well what he was about.\nOne day, as the woodman was getting ready to go into the wood to cut fuel,\n he said, ‘I wish I had someone to bring the cart after me, for I want to\n make haste.’ ‘Oh, father,’ cried Tom, ‘I will take care of that; the cart\n shall be in the wood by the time you want it.’ Then the woodman laughed,\n and said, ‘How can that be? you cannot reach up to the horse’s bridle.’\n ‘Never mind that, father,’ said Tom; ‘if my mother will only harness the\n horse, I will get into his ear and tell him which way to go.’ ‘Well,’ said\n the father, ‘we will try for once.’\nWhen the time came the mother harnessed the horse to the cart, and put Tom\n into his ear; and as he sat there the little man told the beast how to go,\n crying out, ‘Go on!’ and ‘Stop!’ as he wanted: and thus the horse went on\n just as well as if the woodman had driven it himself into the wood. It\n happened that as the horse was going a little too fast, and Tom was\n calling out, ‘Gently! gently!’ two strangers came up. ‘What an odd thing\n that is!’ said one: ‘there is a cart going along, and I hear a carter\n talking to the horse, but yet I can see no one.’ ‘That is queer, indeed,’\n said the other; ‘let us follow the cart, and see where it goes.’ So they\n went on into the wood, till at last they came to the place where the\n woodman was. Then Tom Thumb, seeing his father, cried out, ‘See, father,\n here I am with the cart, all right and safe! now take me down!’ So his\n father took hold of the horse with one hand, and with the other took his\n son out of the horse’s ear, and put him down upon a straw, where he sat as\n merry as you please.\nThe two strangers were all this time looking on, and did not know what to\n say for wonder. At last one took the other aside, and said, ‘That little\n urchin will make our fortune, if we can get him, and carry him about from\n town to town as a show; we must buy him.’ So they went up to the woodman,\n and asked him what he would take for the little man. ‘He will be better\n off,’ said they, ‘with us than with you.’ ‘I won’t sell him at all,’ said\n the father; ‘my own flesh and blood is dearer to me than all the silver\n and gold in the world.’ But Tom, hearing of the bargain they wanted to\n make, crept up his father’s coat to his shoulder and whispered in his ear,\n ‘Take the money, father, and let them have me; I’ll soon come back to\n you.’\nSo the woodman at last said he would sell Tom to the strangers for a large\n piece of gold, and they paid the price. ‘Where would you like to sit?’\n said one of them. ‘Oh, put me on the rim of your hat; that will be a nice\n gallery for me; I can walk about there and see the country as we go\n along.’ So they did as he wished; and when Tom had taken leave of his\n father they took him away with them.\nThey journeyed on till it began to be dusky, and then the little man said,\n ‘Let me get down, I’m tired.’ So the man took off his hat, and put him\n down on a clod of earth, in a ploughed field by the side of the road. But\n Tom ran about amongst the furrows, and at last slipped into an old\n mouse-hole. ‘Good night, my masters!’ said he, ‘I’m off! mind and look\n sharp after me the next time.’ Then they ran at once to the place, and\n poked the ends of their sticks into the mouse-hole, but all in vain; Tom\n only crawled farther and farther in; and at last it became quite dark, so\n that they were forced to go their way without their prize, as sulky as\n could be.\nWhen Tom found they were gone, he came out of his hiding-place. ‘What\n dangerous walking it is,’ said he, ‘in this ploughed field! If I were to\n fall from one of these great clods, I should undoubtedly break my neck.’\n At last, by good luck, he found a large empty snail-shell. ‘This is\n lucky,’ said he, ‘I can sleep here very well’; and in he crept.\nJust as he was falling asleep, he heard two men passing by, chatting\n together; and one said to the other, ‘How can we rob that rich parson’s\n house of his silver and gold?’ ‘I’ll tell you!’ cried Tom. ‘What noise was\n that?’ said the thief, frightened; ‘I’m sure I heard someone speak.’ They\n stood still listening, and Tom said, ‘Take me with you, and I’ll soon show\n you how to get the parson’s money.’ ‘But where are you?’ said they. ‘Look\n about on the ground,’ answered he, ‘and listen where the sound comes\n from.’ At last the thieves found him out, and lifted him up in their\n hands. ‘You little urchin!’ they said, ‘what can you do for us?’ ‘Why, I\n can get between the iron window-bars of the parson’s house, and throw you\n out whatever you want.’ ‘That’s a good thought,’ said the thieves; ‘come\n along, we shall see what you can do.’\nWhen they came to the parson’s house, Tom slipped through the window-bars\n into the room, and then called out as loud as he could bawl, ‘Will you\n have all that is here?’ At this the thieves were frightened, and said,\n ‘Softly, softly! Speak low, that you may not awaken anybody.’ But Tom\n seemed as if he did not understand them, and bawled out again, ‘How much\n will you have? Shall I throw it all out?’ Now the cook lay in the next\n room; and hearing a noise she raised herself up in her bed and listened.\n Meantime the thieves were frightened, and ran off a little way; but at\n last they plucked up their hearts, and said, ‘The little urchin is only\n trying to make fools of us.’ So they came back and whispered softly to\n him, saying, ‘Now let us have no more of your roguish jokes; but throw us\n out some of the money.’ Then Tom called out as loud as he could, ‘Very\n well! hold your hands! here it comes.’\nThe cook heard this quite plain, so she sprang out of bed, and ran to open\n the door. The thieves ran off as if a wolf was at their tails: and the\n maid, having groped about and found nothing, went away for a light. By the\n time she came back, Tom had slipped off into the barn; and when she had\n looked about and searched every hole and corner, and found nobody, she\n went to bed, thinking she must have been dreaming with her eyes open.\nThe little man crawled about in the hay-loft, and at last found a snug\n place to finish his night’s rest in; so he laid himself down, meaning to\n sleep till daylight, and then find his way home to his father and mother.\n But alas! how woefully he was undone! what crosses and sorrows happen to\n us all in this world! The cook got up early, before daybreak, to feed the\n cows; and going straight to the hay-loft, carried away a large bundle of\n hay, with the little man in the middle of it, fast asleep. He still,\n however, slept on, and did not awake till he found himself in the mouth of\n the cow; for the cook had put the hay into the cow’s rick, and the cow had\n taken Tom up in a mouthful of it. ‘Good lack-a-day!’ said he, ‘how came I\n to tumble into the mill?’ But he soon found out where he really was; and\n was forced to have all his wits about him, that he might not get between\n the cow’s teeth, and so be crushed to death. At last down he went into her\n stomach. ‘It is rather dark,’ said he; ‘they forgot to build windows in\n this room to let the sun in; a candle would be no bad thing.’\nThough he made the best of his bad luck, he did not like his quarters at\n all; and the worst of it was, that more and more hay was always coming\n down, and the space left for him became smaller and smaller. At last he\n cried out as loud as he could, ‘Don’t bring me any more hay! Don’t bring\n me any more hay!’\nThe maid happened to be just then milking the cow; and hearing someone\n speak, but seeing nobody, and yet being quite sure it was the same voice\n that she had heard in the night, she was so frightened that she fell off\n her stool, and overset the milk-pail. As soon as she could pick herself up\n out of the dirt, she ran off as fast as she could to her master the\n parson, and said, ‘Sir, sir, the cow is talking!’ But the parson said,\n ‘Woman, thou art surely mad!’ However, he went with her into the\n cow-house, to try and see what was the matter.\nScarcely had they set foot on the threshold, when Tom called out, ‘Don’t\n bring me any more hay!’ Then the parson himself was frightened; and\n thinking the cow was surely bewitched, told his man to kill her on the\n spot. So the cow was killed, and cut up; and the stomach, in which Tom\n lay, was thrown out upon a dunghill.\nTom soon set himself to work to get out, which was not a very easy task;\n but at last, just as he had made room to get his head out, fresh ill-luck\n befell him. A hungry wolf sprang out, and swallowed up the whole stomach,\n with Tom in it, at one gulp, and ran away.\nTom, however, was still not disheartened; and thinking the wolf would not\n dislike having some chat with him as he was going along, he called out,\n ‘My good friend, I can show you a famous treat.’ ‘Where’s that?’ said the\n wolf. ‘In such and such a house,’ said Tom, describing his own father’s\n house. ‘You can crawl through the drain into the kitchen and then into the\n pantry, and there you will find cakes, ham, beef, cold chicken, roast pig,\n apple-dumplings, and everything that your heart can wish.’\nThe wolf did not want to be asked twice; so that very night he went to the\n house and crawled through the drain into the kitchen, and then into the\n pantry, and ate and drank there to his heart’s content. As soon as he had\n had enough he wanted to get away; but he had eaten so much that he could\n not go out by the same way he came in.\nThis was just what Tom had reckoned upon; and now he began to set up a\n great shout, making all the noise he could. ‘Will you be easy?’ said the\n wolf; ‘you’ll awaken everybody in the house if you make such a clatter.’\n ‘What’s that to me?’ said the little man; ‘you have had your frolic, now\n I’ve a mind to be merry myself’; and he began, singing and shouting as\n loud as he could.\nThe woodman and his wife, being awakened by the noise, peeped through a\n crack in the door; but when they saw a wolf was there, you may well\n suppose that they were sadly frightened; and the woodman ran for his axe,\n and gave his wife a scythe. ‘Do you stay behind,’ said the woodman, ‘and\n when I have knocked him on the head you must rip him up with the scythe.’\n Tom heard all this, and cried out, ‘Father, father! I am here, the wolf\n has swallowed me.’ And his father said, ‘Heaven be praised! we have found\n our dear child again’; and he told his wife not to use the scythe for fear\n she should hurt him. Then he aimed a great blow, and struck the wolf on\n the head, and killed him on the spot! and when he was dead they cut open\n his body, and set Tommy free. ‘Ah!’ said the father, ‘what fears we have\n had for you!’ ‘Yes, father,’ answered he; ‘I have travelled all over the\n world, I think, in one way or other, since we parted; and now I am very\n glad to come home and get fresh air again.’ ‘Why, where have you been?’\n said his father. ‘I have been in a mouse-hole—and in a snail-shell—and\n down a cow’s throat—and in the wolf’s belly; and yet here I am\n again, safe and sound.’\n‘Well,’ said they, ‘you are come back, and we will not sell you again for\n all the riches in the world.’\nThen they hugged and kissed their dear little son, and gave him plenty to\n eat and drink, for he was very hungry; and then they fetched new clothes\n for him, for his old ones had been quite spoiled on his journey. So Master\n Thumb stayed at home with his father and mother, in peace; for though he\n had been so great a traveller, and had done and seen so many fine things,\n and was fond enough of telling the whole story, he always agreed that,\n after all, there’s no place like HOME!', 'THE TRAVELLING MUSICIANS\n\nAn honest farmer had once an ass that had been a faithful servant to him a\n great many years, but was now growing old and every day more and more\n unfit for work. His master therefore was tired of keeping him and began to\n think of putting an end to him; but the ass, who saw that some mischief\n was in the wind, took himself slyly off, and began his journey towards the\n great city, ‘For there,’ thought he, ‘I may turn musician.’\nAfter he had travelled a little way, he spied a dog lying by the roadside\n and panting as if he were tired. ‘What makes you pant so, my friend?’ said\n the ass. ‘Alas!’ said the dog, ‘my master was going to knock me on the\n head, because I am old and weak, and can no longer make myself useful to\n him in hunting; so I ran away; but what can I do to earn my livelihood?’\n ‘Hark ye!’ said the ass, ‘I am going to the great city to turn musician:\n suppose you go with me, and try what you can do in the same way?’ The dog\n said he was willing, and they jogged on together.\nThey had not gone far before they saw a cat sitting in the middle of the\n road and making a most rueful face. ‘Pray, my good lady,’ said the ass,\n ‘what’s the matter with you? You look quite out of spirits!’ ‘Ah, me!’\n said the cat, ‘how can one be in good spirits when one’s life is in\n danger? Because I am beginning to grow old, and had rather lie at my ease\n by the fire than run about the house after the mice, my mistress laid hold\n of me, and was going to drown me; and though I have been lucky enough to\n get away from her, I do not know what I am to live upon.’ ‘Oh,’ said the\n ass, ‘by all means go with us to the great city; you are a good night\n singer, and may make your fortune as a musician.’ The cat was pleased with\n the thought, and joined the party.\nSoon afterwards, as they were passing by a farmyard, they saw a cock\n perched upon a gate, and screaming out with all his might and main.\n ‘Bravo!’ said the ass; ‘upon my word, you make a famous noise; pray what\n is all this about?’ ‘Why,’ said the cock, ‘I was just now saying that we\n should have fine weather for our washing-day, and yet my mistress and the\n cook don’t thank me for my pains, but threaten to cut off my head\n tomorrow, and make broth of me for the guests that are coming on Sunday!’\n ‘Heaven forbid!’ said the ass, ‘come with us Master Chanticleer; it will\n be better, at any rate, than staying here to have your head cut off!\n Besides, who knows? If we care to sing in tune, we may get up some kind of\n a concert; so come along with us.’ ‘With all my heart,’ said the cock: so\n they all four went on jollily together.\nThey could not, however, reach the great city the first day; so when night\n came on, they went into a wood to sleep. The ass and the dog laid\n themselves down under a great tree, and the cat climbed up into the\n branches; while the cock, thinking that the higher he sat the safer he\n should be, flew up to the very top of the tree, and then, according to his\n custom, before he went to sleep, looked out on all sides of him to see\n that everything was well. In doing this, he saw afar off something bright\n and shining and calling to his companions said, ‘There must be a house no\n great way off, for I see a light.’ ‘If that be the case,’ said the ass,\n ‘we had better change our quarters, for our lodging is not the best in the\n world!’ ‘Besides,’ added the dog, ‘I should not be the worse for a bone or\n two, or a bit of meat.’ So they walked off together towards the spot where\n Chanticleer had seen the light, and as they drew near it became larger and\n brighter, till they at last came close to a house in which a gang of\n robbers lived.\nThe ass, being the tallest of the company, marched up to the window and\n peeped in. ‘Well, Donkey,’ said Chanticleer, ‘what do you see?’ ‘What do I\n see?’ replied the ass. ‘Why, I see a table spread with all kinds of good\n things, and robbers sitting round it making merry.’ ‘That would be a noble\n lodging for us,’ said the cock. ‘Yes,’ said the ass, ‘if we could only get\n in’; so they consulted together how they should contrive to get the\n robbers out; and at last they hit upon a plan. The ass placed himself\n upright on his hind legs, with his forefeet resting against the window;\n the dog got upon his back; the cat scrambled up to the dog’s shoulders,\n and the cock flew up and sat upon the cat’s head. When all was ready a\n signal was given, and they began their music. The ass brayed, the dog\n barked, the cat mewed, and the cock screamed; and then they all broke\n through the window at once, and came tumbling into the room, amongst the\n broken glass, with a most hideous clatter! The robbers, who had been not a\n little frightened by the opening concert, had now no doubt that some\n frightful hobgoblin had broken in upon them, and scampered away as fast as\n they could.\nThe coast once clear, our travellers soon sat down and dispatched what the\n robbers had left, with as much eagerness as if they had not expected to\n eat again for a month. As soon as they had satisfied themselves, they put\n out the lights, and each once more sought out a resting-place to his own\n liking. The donkey laid himself down upon a heap of straw in the yard, the\n dog stretched himself upon a mat behind the door, the cat rolled herself\n up on the hearth before the warm ashes, and the cock perched upon a beam\n on the top of the house; and, as they were all rather tired with their\n journey, they soon fell asleep.\nBut about midnight, when the robbers saw from afar that the lights were\n out and that all seemed quiet, they began to think that they had been in\n too great a hurry to run away; and one of them, who was bolder than the\n rest, went to see what was going on. Finding everything still, he marched\n into the kitchen, and groped about till he found a match in order to light\n a candle; and then, espying the glittering fiery eyes of the cat, he\n mistook them for live coals, and held the match to them to light it. But\n the cat, not understanding this joke, sprang at his face, and spat, and\n scratched at him. This frightened him dreadfully, and away he ran to the\n back door; but there the dog jumped up and bit him in the leg; and as he\n was crossing over the yard the ass kicked him; and the cock, who had been\n awakened by the noise, crowed with all his might. At this the robber ran\n back as fast as he could to his comrades, and told the captain how a\n horrid witch had got into the house, and had spat at him and scratched his\n face with her long bony fingers; how a man with a knife in his hand had\n hidden himself behind the door, and stabbed him in the leg; how a black\n monster stood in the yard and struck him with a club, and how the devil\n had sat upon the top of the house and cried out, ‘Throw the rascal up\n here!’ After this the robbers never dared to go back to the house; but the\n musicians were so pleased with their quarters that they took up their\n abode there; and there they are, I dare say, at this very day.', 'DOCTOR KNOWALL\n\nThere was once upon a time a poor peasant called Crabb, who drove with two\n oxen a load of wood to the town, and sold it to a doctor for two talers.\n When the money was being counted out to him, it so happened that the\n doctor was sitting at table, and when the peasant saw how well he ate and\n drank, his heart desired what he saw, and would willingly have been a\n doctor too. So he remained standing a while, and at length inquired if he\n too could not be a doctor. ‘Oh, yes,’ said the doctor, ‘that is soon\n managed.’ ‘What must I do?’ asked the peasant. ‘In the first place buy\n yourself an A B C book of the kind which has a cock on the frontispiece;\n in the second, turn your cart and your two oxen into money, and get\n yourself some clothes, and whatsoever else pertains to medicine; thirdly,\n have a sign painted for yourself with the words: “I am Doctor Knowall,”\n and have that nailed up above your house-door.’ The peasant did everything\n that he had been told to do. When he had doctored people awhile, but not\n long, a rich and great lord had some money stolen. Then he was told about\n Doctor Knowall who lived in such and such a village, and must know what\n had become of the money. So the lord had the horses harnessed to his\n carriage, drove out to the village, and asked Crabb if he were Doctor\n Knowall. Yes, he was, he said. Then he was to go with him and bring back\n the stolen money. ‘Oh, yes, but Grete, my wife, must go too.’ The lord was\n willing, and let both of them have a seat in the carriage, and they all\n drove away together. When they came to the nobleman’s castle, the table\n was spread, and Crabb was told to sit down and eat. ‘Yes, but my wife,\n Grete, too,’ said he, and he seated himself with her at the table. And\n when the first servant came with a dish of delicate fare, the peasant\n nudged his wife, and said: ‘Grete, that was the first,’ meaning that was\n the servant who brought the first dish. The servant, however, thought he\n intended by that to say: ‘That is the first thief,’ and as he actually was\n so, he was terrified, and said to his comrade outside: ‘The doctor knows\n all: we shall fare ill, he said I was the first.’ The second did not want\n to go in at all, but was forced. So when he went in with his dish, the\n peasant nudged his wife, and said: ‘Grete, that is the second.’ This\n servant was equally alarmed, and he got out as fast as he could. The third\n fared no better, for the peasant again said: ‘Grete, that is the third.’\n The fourth had to carry in a dish that was covered, and the lord told the\n doctor that he was to show his skill, and guess what was beneath the\n cover. Actually, there were crabs. The doctor looked at the dish, had no\n idea what to say, and cried: ‘Ah, poor Crabb.’ When the lord heard that,\n he cried: ‘There! he knows it; he must also know who has the money!’\nOn this the servants looked terribly uneasy, and made a sign to the doctor\n that they wished him to step outside for a moment. When therefore he went\n out, all four of them confessed to him that they had stolen the money, and\n said that they would willingly restore it and give him a heavy sum into\n the bargain, if he would not denounce them, for if he did they would be\n hanged. They led him to the spot where the money was concealed. With this\n the doctor was satisfied, and returned to the hall, sat down to the table,\n and said: ‘My lord, now will I search in my book where the gold is\n hidden.’ The fifth servant, however, crept into the stove to hear if the\n doctor knew still more. But the doctor sat still and opened his A B C\n book, turned the pages backwards and forwards, and looked for the cock. As\n he could not find it immediately he said: ‘I know you are there, so you\n had better come out!’ Then the fellow in the stove thought that the doctor\n meant him, and full of terror, sprang out, crying: ‘That man knows\n everything!’ Then Doctor Knowall showed the lord where the money was, but\n did not say who had stolen it, and received from both sides much money in\n reward, and became a renowned man.']","- The cook heard Tom Thumb shouting in the parson’s house, sprang from bed, opened the door, and the thieves fled.
- Later, the cook carried a large bundle of hay to feed the cows, with Tom hidden in the hay, and the cow ended up swallowing him along with the hay.","When the cook herd Tom Thumb shouting in the parson’s house, she sprang out of bed and ran to open the door, but found nobody and went away for a light. By the time she came back, Tom had slipped off into the barn to sleep. Early the next morning, the cook got up to feed the cows and carried away a bundle of hay with Tom asleep inside. She put the hay into the cow’s rick, and the cow ate Tom up in a mouthful. So, the cook’s actions led to Tom ending up inside the cow.",1.0,1.0,0.47
